Company Name,Exchange:Ticker,Industry Group,Primary Sector,SIC Code,Country,Broad Group,Sub Group
"Lifan Technology (Group) Co., Ltd. (SHSE:601777)",SHSE:601777,Auto & Truck,Consumer Discretionary,3700,China,Emerging Markets,China
Lifco AB (publ) (OM:LIFCO B),OM:LIFCO B,Diversified,Industrials,5047,Sweden,Developed Europe,EU & Environs
"Life Clips, Inc. (OTCPK:LCLP)",OTCPK:LCLP,Heathcare Information and Technology,Health Care,7372,United States,United States,United States
Life Concepts Holdings Limited (SEHK:8056),SEHK:8056,Restaurant/Dining,Consumer Discretionary,5812,Hong Kong,Emerging Markets,China
Life Corporation (TSE:8194),TSE:8194,Retail (Grocery and Food),Consumer Staples,5411,Japan,Japan,Japan
"Life Foods Co., Ltd. (JASDAQ:3065)",JASDAQ:3065,Restaurant/Dining,Consumer Discretionary,5812,Japan,Japan,Japan
Life Healthcare Group Holdings Limited (JSE:LHC),JSE:LHC,Hospitals/Healthcare Facilities,Health Care,8060,South Africa,Emerging Markets,Africa and Middle East
Life Healthcare Group Limited (SEHK:928),SEHK:928,Healthcare Support Services,Health Care,5600,Hong Kong,Emerging Markets,China
"Life Intelligent Enterprise Holdings Co.,Ltd. (TSE:5856)",TSE:5856,Retail (Grocery and Food),Consumer Staples,5900,Japan,Japan,Japan
"Life On Earth, Inc. (OTCPK:LFER)",OTCPK:LFER,Software (System & Application),Information Technology,5140,United States,United States,United States
Life Science Reit PLC (AIM:LABS),AIM:LABS,R.E.I.T.,Real Estate,6798,United Kingdom,Developed Europe,UK
Life Science Technology Inc. (XKON:A285770),XKON:A285770,Healthcare Products,Health Care,3845,South Korea,Emerging Markets,Small Asia
"Life Storage, Inc. (NYSE:LSI)",NYSE:LSI,R.E.I.T.,Real Estate,6798,United States,United States,United States
"Life Time Group Holdings, Inc. (NYSE:LTH)",NYSE:LTH,Recreation,Consumer Discretionary,7990,United States,United States,United States
"Life Travel & Tourist Service Co., Ltd. (TPEX:2745)",TPEX:2745,Hotel/Gaming,Consumer Discretionary,4700,Taiwan,Emerging Markets,Small Asia
"Life's Time Capsule Services, Inc. (OTCPK:LTCP)",OTCPK:LTCP,Software (Internet),Information Technology,7370,United States,United States,United States
LifeBrandz Ltd. (Catalist:1D3),Catalist:1D3,Restaurant/Dining,Consumer Discretionary,5810,Singapore,Emerging Markets,Small Asia
Lifecare AS (OB:LIFE),OB:LIFE,Healthcare Products,Health Care,3841,Norway,Developed Europe,EU & Environs
LifeClean International AB (publ) (OM:LCLEAN),OM:LCLEAN,Chemical (Specialty),Materials,2842,Sweden,Developed Europe,EU & Environs
"Lifecome Biochemistry Co.,Ltd. (SZSE:002868)",SZSE:002868,Drugs (Biotechnology),Health Care,2836,China,Emerging Markets,China
"Lifedrink Company, Inc. (TSE:2585)",TSE:2585,Beverage (Soft),Consumer Staples,2086,Japan,Japan,Japan
Lifeist Wellness Inc. (TSXV:LFST),TSXV:LFST,Retail (Online),Consumer Discretionary,3990,Canada,"Australia, NZ and Canada",Canada
"Lifeline Biotechnologies, Inc. (OTCPK:LLBO)",OTCPK:LLBO,Healthcare Products,Health Care,3845,United States,United States,United States
Lifeline SPAC I Oyj (HLSE:LL1SPAC),HLSE:LL1SPAC,Investments & Asset Management,Financials,9995,Finland,Developed Europe,EU & Environs
"Lifeloc Technologies, Inc. (OTCPK:LCTC)",OTCPK:LCTC,Electronics (General),Information Technology,3845,United States,United States,United States
"LifeMD, Inc. (NasdaqGM:LFMD)",NasdaqGM:LFMD,Household Products,Consumer Staples,2834,United States,United States,United States
Lifenet Insurance Company (TSE:7157),TSE:7157,Insurance (Life),Financials,6300,Japan,Japan,Japan
LifeQuest World Corporation (OTCPK:LQWC),OTCPK:LQWC,Environmental & Waste Services,Industrials,4952,United States,United States,United States
LifeSemantics Corp. (KOSDAQ:A347700),KOSDAQ:A347700,Heathcare Information and Technology,Health Care,7370,South Korea,Emerging Markets,Small Asia
LifeSpeak Inc. (TSX:LSPK),TSX:LSPK,Software (System & Application),Information Technology,7370,Canada,"Australia, NZ and Canada",Canada
Lifespot Capital AG (MUN:CDZ0),MUN:CDZ0,Heathcare Information and Technology,Health Care,3845,Germany,Developed Europe,EU & Environs
"LifeStance Health Group, Inc. (NasdaqGS:LFST)",NasdaqGS:LFST,Healthcare Support Services,Health Care,8093,United States,United States,United States
LifeStar Holding p.l.c. (MTSE:LSR),MTSE:LSR,Insurance (Life),Financials,6311,Malta,Developed Europe,EU & Environs
LifeStar Insurance plc (MTSE:LSI),MTSE:LSI,Insurance (Life),Financials,6311,Malta,Developed Europe,EU & Environs
Lifestyle China Group Limited (SEHK:2136),SEHK:2136,Retail (General),Consumer Discretionary,5311,Hong Kong,Emerging Markets,China
Lifestyle Communities Limited (ASX:LIC),ASX:LIC,Real Estate (Development),Real Estate,6500,Australia,"Australia, NZ and Canada",Australia & NZ
Lifestyle Global Enterprise Inc. (TPEX:8066),TPEX:8066,Retail (Building Supply),Consumer Discretionary,3678,Taiwan,Emerging Markets,Small Asia
Lifestyle International Holdings Limited (SEHK:1212),SEHK:1212,Retail (General),Consumer Discretionary,5311,Hong Kong,Emerging Markets,China
LifeTech Scientific Corporation (SEHK:1302),SEHK:1302,Healthcare Products,Health Care,3841,China,Emerging Markets,China
"Lifetime Brands, Inc. (NasdaqGS:LCUT)",NasdaqGS:LCUT,Household Products,Consumer Discretionary,3420,United States,United States,United States
LifeVantage Corporation (NasdaqCM:LFVN),NasdaqCM:LFVN,Household Products,Consumer Staples,2834,United States,United States,United States
"Lifeway Foods, Inc. (NasdaqGM:LWAY)",NasdaqGM:LWAY,Food Processing,Consumer Staples,2020,United States,United States,United States
LifeWorks Inc. (TSX:LWRK),TSX:LWRK,Business & Consumer Services,Industrials,8742,Canada,"Australia, NZ and Canada",Canada
"LIFULL Co., Ltd. (TSE:2120)",TSE:2120,Software (Entertainment),Communication Services,6531,Japan,Japan,Japan
"LIG Assets, Inc. (OTCPK:LIGA)",OTCPK:LIGA,Real Estate (Operations & Services),Real Estate,6799,United States,United States,United States
"LIG Nex1 Co., Ltd. (KOSE:A079550)",KOSE:A079550,Aerospace/Defense,Industrials,3760,South Korea,Emerging Markets,Small Asia
Ligand Pharmaceuticals Incorporated (NasdaqGM:LGND),NasdaqGM:LGND,Drugs (Biotechnology),Health Care,2834,United States,United States,United States
Ligao Foods Co.Ltd (SZSE:300973),SZSE:300973,Food Processing,Consumer Staples,2050,China,Emerging Markets,China
"Ligeance Aerospace Technology Co.,Ltd. (SZSE:000697)",SZSE:000697,Aerospace/Defense,Industrials,3720,China,Emerging Markets,China
"Light Media Holdings, Inc. (OTCPK:LGMH)",OTCPK:LGMH,Software (Entertainment),Communication Services,7375,United States,United States,United States
Light S.A. (BOVESPA:LIGT3),BOVESPA:LIGT3,Power,Utilities,4911,Brazil,Emerging Markets,Latin America & Caribbean
Light Science Technologies Holdings Plc (AIM:LST),AIM:LST,Electronics (General),Information Technology,3672,United Kingdom,Developed Europe,UK
LightAir AB (publ) (NGM:LAIR),NGM:LAIR,Furn/Home Furnishings,Consumer Discretionary,3634,Sweden,Developed Europe,EU & Environs
Lightbridge Corporation (NasdaqCM:LTBR),NasdaqCM:LTBR,Coal & Related Energy,Energy,2860,United States,United States,United States
Lighthouse Global Holdings Inc. (OTCPK:LHGI),OTCPK:LHGI,Investments & Asset Management,Financials,6726,United States,United States,United States
Lighthouse Properties plc (JSE:LTE),JSE:LTE,Real Estate (Operations & Services),Real Estate,6512,Mauritius,Emerging Markets,Africa and Middle East
Lighting and Equipment Public Company Limited (SET:L&E),SET:L&E,Electrical Equipment,Industrials,3640,Thailand,Emerging Markets,Small Asia
LightJump Acquisition Corporation (NasdaqCM:LJAQ),NasdaqCM:LJAQ,Investments & Asset Management,Financials,9995,United States,United States,United States
"Lightning eMotors, Inc. (NYSE:ZEV)",NYSE:ZEV,Construction Supplies,Industrials,3711,United States,United States,United States
"LightPath Technologies, Inc. (NasdaqCM:LPTH)",NasdaqCM:LPTH,Electronics (General),Information Technology,3827,United States,United States,United States
Lightron Inc. (KOSDAQ:A069540),KOSDAQ:A069540,Telecom. Equipment,Information Technology,3663,South Korea,Emerging Markets,Small Asia
Lightspeed Commerce Inc. (TSX:LSPD),TSX:LSPD,Software (System & Application),Information Technology,7370,Canada,"Australia, NZ and Canada",Canada
Lightspeed Discoveries Inc. (TSXV:LSD.H),TSXV:LSD.H,Metals & Mining,Materials,1000,Canada,"Australia, NZ and Canada",Canada
"Lightwave Logic, Inc. (NasdaqCM:LWLG)",NasdaqCM:LWLG,Electronics (General),Information Technology,2821,United States,United States,United States
"Ligitek Electronics Co.,Ltd (TPEX:8111)",TPEX:8111,Semiconductor,Information Technology,3674,Taiwan,Emerging Markets,Small Asia
Ligua Inc. (TSE:7090),TSE:7090,Healthcare Support Services,Health Care,8090,Japan,Japan,Japan
"Lih Tai Construction Enterprise Co., Ltd. (TPEX:5520)",TPEX:5520,Construction Supplies,Materials,3270,Taiwan,Emerging Markets,Small Asia
"Lihe Technology (Hunan) Co., Ltd. (SZSE:300800)",SZSE:300800,Electronics (General),Information Technology,3829,China,Emerging Markets,China
"Lihit Lab., Inc. (TSE:7975)",TSE:7975,Office Equipment & Services,Industrials,2670,Japan,Japan,Japan
Lii Hen Industries Bhd (KLSE:LIIHEN),KLSE:LIIHEN,Furn/Home Furnishings,Consumer Discretionary,2510,Malaysia,Emerging Markets,Small Asia
"LiJiang YuLong Tourism Co., LTD. (SZSE:002033)",SZSE:002033,Hotel/Gaming,Consumer Discretionary,4700,China,Emerging Markets,China
"LIKE Co., Ltd. (TSE:2462)",TSE:2462,Business & Consumer Services,Industrials,7361,Japan,Japan,Japan
Likewise Group plc (AIM:LIKE),AIM:LIKE,Retail (Distributors),Consumer Discretionary,5099,United Kingdom,Developed Europe,UK
Likhitha Infrastructure Limited (BSE:543240),BSE:543240,Oilfield Svcs/Equip.,Energy,1623,India,Emerging Markets,India
LILAMA 10 Joint Stock Company (HOSE:L10),HOSE:L10,Engineering/Construction,Industrials,1700,Vietnam,Emerging Markets,Small Asia
Lilama 18 Joint Stock Company (HOSE:LM8),HOSE:LM8,Engineering/Construction,Industrials,1600,Vietnam,Emerging Markets,Small Asia
LILAMA 45.3 Joint Stock Company (HNX:L43),HNX:L43,Engineering/Construction,Industrials,1600,Vietnam,Emerging Markets,Small Asia
Lilama 69-1 Joint Stock Company (HNX:L61),HNX:L61,Engineering/Construction,Industrials,1600,Vietnam,Emerging Markets,Small Asia
LILAMA 69-2 Joint Stock Company (HNX:L62),HNX:L62,Engineering/Construction,Industrials,1600,Vietnam,Emerging Markets,Small Asia
Lilama 7 Joint Stock Company (HNX:LM7),HNX:LM7,Engineering/Construction,Industrials,1700,Vietnam,Emerging Markets,Small Asia
Lilama Erection Mechanical Joint Stock Company (HNX:L35),HNX:L35,Engineering/Construction,Industrials,1700,Vietnam,Emerging Markets,Small Asia
Lilium N.V. (NasdaqGS:LILM),NasdaqGS:LILM,Aerospace/Defense,Industrials,4522,Germany,Developed Europe,EU & Environs
"Lily Group Co., Ltd. (SHSE:603823)",SHSE:603823,Chemical (Basic),Materials,2860,China,Emerging Markets,China
"Lily Textile Co., Ltd. (TWSE:1443)",TWSE:1443,Apparel,Consumer Discretionary,2200,Taiwan,Emerging Markets,Small Asia
"Lilycolor Co., Ltd. (JASDAQ:9827)",JASDAQ:9827,Retail (Distributors),Consumer Discretionary,5700,Japan,Japan,Japan
"Limbach Holdings, Inc. (NasdaqCM:LMB)",NasdaqCM:LMB,Engineering/Construction,Industrials,1700,United States,United States,United States
Lime Chemicals Limited (BSE:507759),BSE:507759,Chemical (Basic),Materials,2810,India,Emerging Markets,India
Lime Technologies AB (publ) (OM:LIME),OM:LIME,Software (System & Application),Information Technology,7370,Sweden,Developed Europe,EU & Environs
"Limelight Networks, Inc. (NasdaqGS:LLNW)",NasdaqGS:LLNW,Software (Internet),Information Technology,7370,United States,United States,United States
LIMES Schlosskliniken AG (XTRA:LIK),XTRA:LIK,Hospitals/Healthcare Facilities,Health Care,8060,Germany,Developed Europe,EU & Environs
"Limestone Bancorp, Inc. (NasdaqCM:LMST)",NasdaqCM:LMST,Banks (Regional),Financials,6020,United States,United States,United States
"Limin Group Co., Ltd. (SZSE:002734)",SZSE:002734,Chemical (Specialty),Materials,2870,China,Emerging Markets,China
Liminal BioSciences Inc. (DB:PJ2N),DB:PJ2N,Drugs (Biotechnology),Health Care,2836,Canada,"Australia, NZ and Canada",Canada
Limitless Venture Group Inc. (OTCPK:LVGI),OTCPK:LVGI,Household Products,Consumer Staples,2844,United States,United States,United States
Limoneira Company (NasdaqGS:LMNR),NasdaqGS:LMNR,Farming/Agriculture,Consumer Staples,100,United States,United States,United States
Limuru Tea Plc (NASE:LIMT),NASE:LIMT,Food Processing,Consumer Staples,2090,Kenya,Emerging Markets,Africa and Middle East
"Lin BioScience, Inc. (TPEX:6696)",TPEX:6696,Drugs (Biotechnology),Health Care,2836,Taiwan,Emerging Markets,Small Asia
"Lin Horn Technology Co., Ltd. (TPEX:5464)",TPEX:5464,Electronics (General),Information Technology,3672,Taiwan,Emerging Markets,Small Asia
Linaks Microelectronics Ltd (BSE:517463),BSE:517463,Electronics (General),Information Technology,3672,India,Emerging Markets,India
Linamar Corporation (TSX:LNR),TSX:LNR,Auto Parts,Consumer Discretionary,3714,Canada,"Australia, NZ and Canada",Canada
Linc AB (OM:LINC),OM:LINC,Investments & Asset Management,Financials,6799,Sweden,Developed Europe,EU & Environs
Linc Limited (BSE:531241),BSE:531241,Office Equipment & Services,Industrials,3950,India,Emerging Markets,India
Lincoln Educational Services Corporation (NasdaqGS:LINC),NasdaqGS:LINC,Education,Consumer Discretionary,8200,United States,United States,United States
"Lincoln Electric Holdings, Inc. (NasdaqGS:LECO)",NasdaqGS:LECO,Machinery,Industrials,3540,United States,United States,United States
Lincoln Gold Mining Inc. (TSXV:LMG),TSXV:LMG,Precious Metals,Materials,1040,Canada,"Australia, NZ and Canada",Canada
Lincoln National Corporation (NYSE:LNC),NYSE:LNC,Insurance (Life),Financials,6311,United States,United States,United States
Lincoln Pharmaceuticals Limited (BSE:531633),BSE:531633,Drugs (Pharmaceutical),Health Care,2834,India,Emerging Markets,India
Lindab International AB (publ) (OM:LIAB),OM:LIAB,Building Materials,Industrials,3444,Sweden,Developed Europe,EU & Environs
Lindbergh S.p.A. (BIT:LDB),BIT:LDB,Business & Consumer Services,Industrials,4210,Italy,Developed Europe,EU & Environs
"Lindblad Expeditions Holdings, Inc. (NasdaqCM:LIND)",NasdaqCM:LIND,Hotel/Gaming,Consumer Discretionary,4700,United States,United States,United States
Linde Bangladesh Limited (DSE:LINDEBD),DSE:LINDEBD,Chemical (Specialty),Materials,2810,Bangladesh,Emerging Markets,Small Asia
Linde India Limited (BSE:523457),BSE:523457,Chemical (Specialty),Materials,2810,India,Emerging Markets,India
Linde plc (NYSE:LIN),NYSE:LIN,Chemical (Specialty),Materials,2810,United Kingdom,Developed Europe,UK
"Lindeman Asia Investment Co., Ltd. (KOSDAQ:A277070)",KOSDAQ:A277070,Investments & Asset Management,Financials,6799,South Korea,Emerging Markets,Small Asia
Lindian Resources Limited (ASX:LIN),ASX:LIN,Metals & Mining,Materials,1000,Australia,"Australia, NZ and Canada",Australia & NZ
Lindsay Australia Limited (ASX:LAU),ASX:LAU,Trucking,Industrials,4210,Australia,"Australia, NZ and Canada",Australia & NZ
Lindsay Corporation (NYSE:LNN),NYSE:LNN,Farming/Agriculture,Industrials,3523,United States,United States,United States
"Línea Directa Aseguradora, S.A. (BME:LDA)",BME:LDA,Insurance (Prop/Cas.),Financials,6331,Spain,Developed Europe,EU & Environs
"Lineage Cell Therapeutics, Inc. (NYSEAM:LCTX)",NYSEAM:LCTX,Drugs (Biotechnology),Health Care,2836,United States,United States,United States
Linedata Services S.A. (ENXTPA:LIN),ENXTPA:LIN,Software (System & Application),Information Technology,7372,France,Developed Europe,EU & Environs
"Linekong Interactive Group Co., Ltd. (SEHK:8267)",SEHK:8267,Entertainment,Communication Services,7372,China,Emerging Markets,China
"Linewell Software Co., Ltd. (SHSE:603636)",SHSE:603636,Software (System & Application),Information Technology,7372,China,Emerging Markets,China
Ling Yue Services Group Limited (SEHK:2165),SEHK:2165,Real Estate (Operations & Services),Real Estate,6531,China,Emerging Markets,China
Ling Yui Holdings Limited (SEHK:784),SEHK:784,Engineering/Construction,Industrials,1700,Hong Kong,Emerging Markets,China
Ling Yun Industrial Corporation Limited (SHSE:600480),SHSE:600480,Auto Parts,Consumer Discretionary,3714,China,Emerging Markets,China
Lingbao Gold Group Company Ltd. (SEHK:3330),SEHK:3330,Precious Metals,Materials,1040,Hong Kong,Emerging Markets,China
"Lingda Group Co., Ltd. (SZSE:300125)",SZSE:300125,Building Materials,Industrials,3559,China,Emerging Markets,China
"Lingerie Fighting Championships, Inc. (OTCPK:BOTY)",OTCPK:BOTY,Entertainment,Communication Services,7941,United States,United States,United States
Lingkaran Trans Kota Holdings Berhad (KLSE:LITRAK),KLSE:LITRAK,Transportation,Industrials,1600,Malaysia,Emerging Markets,Small Asia
"LingNan Eco&Culture-Tourism Co.,Ltd. (SZSE:002717)",SZSE:002717,Engineering/Construction,Industrials,700,China,Emerging Markets,China
Lingo Media Corporation (TSXV:LM),TSXV:LM,Publishing & Newspapers,Communication Services,2731,Canada,"Australia, NZ and Canada",Canada
"Lingotes Especiales, S.A. (BME:LGT)",BME:LGT,Auto Parts,Consumer Discretionary,3312,Spain,Developed Europe,EU & Environs
"Lingsen Precision Industries, Ltd. (TWSE:2369)",TWSE:2369,Semiconductor,Information Technology,3674,Taiwan,Emerging Markets,Small Asia
Lingyi iTech (Guangdong) Company (SZSE:002600),SZSE:002600,Electronics (General),Information Technology,3260,China,Emerging Markets,China
"Lingyuan Iron & Steel Co., Ltd. (SHSE:600231)",SHSE:600231,Steel,Materials,3312,China,Emerging Markets,China
"Linhai Co.,Ltd. (SHSE:600099)",SHSE:600099,Auto & Truck,Consumer Discretionary,3751,China,Emerging Markets,China
"Linical Co., Ltd. (TSE:2183)",TSE:2183,Heathcare Information and Technology,Health Care,8731,Japan,Japan,Japan
Linius Technologies Limited (ASX:LNU),ASX:LNU,Software (System & Application),Information Technology,7372,Australia,"Australia, NZ and Canada",Australia & NZ
Link Administration Holdings Limited (ASX:LNK),ASX:LNK,Information Services,Information Technology,6200,Australia,"Australia, NZ and Canada",Australia & NZ
Link and Motivation Inc. (TSE:2170),TSE:2170,Business & Consumer Services,Industrials,8742,Japan,Japan,Japan
Link Bilgisayar Sistemleri Yazilimi ve Donanimi Sanayi ve Ticaret A.S. (IBSE:LINK),IBSE:LINK,Software (System & Application),Information Technology,7372,Turkey,Developed Europe,EU & Environs
Link Global Technologies Inc. (CNSX:LNK),CNSX:LNK,Software (Internet),Information Technology,7370,Canada,"Australia, NZ and Canada",Canada
Link Holdings Limited (SEHK:8237),SEHK:8237,Hotel/Gaming,Consumer Discretionary,7011,Hong Kong,Emerging Markets,China
LINK Mobility Group Holding ASA (OB:LINK),OB:LINK,Software (System & Application),Information Technology,7370,Norway,Developed Europe,EU & Environs
Link Pharma Chem Limited (BSE:524748),BSE:524748,Chemical (Basic),Materials,2833,India,Emerging Markets,India
Link Prop Investment AB (publ) (OM:LINKAB),OM:LINKAB,Real Estate (Operations & Services),Real Estate,6500,Sweden,Developed Europe,EU & Environs
Link Real Estate Investment Trust (SEHK:823),SEHK:823,R.E.I.T.,Real Estate,6798,Hong Kong,Emerging Markets,China
Link Reservations Inc. (OTCPK:LRSV),OTCPK:LRSV,Electrical Equipment,Industrials,6794,United Kingdom,Developed Europe,UK
Link-Asia International MedTech Group Limited (SEHK:1143),SEHK:1143,Electronics (General),Information Technology,3663,Hong Kong,Emerging Markets,China
Link-U Inc. (TSE:4446),TSE:4446,Software (Entertainment),Communication Services,7370,Japan,Japan,Japan
Linkage Assurance Plc (NGSE:LINKASSURE),NGSE:LINKASSURE,Insurance (Prop/Cas.),Financials,6331,Nigeria,Emerging Markets,Africa and Middle East
"Linkage Software Co., LTD (SHSE:688588)",SHSE:688588,Software (System & Application),Information Technology,7371,China,Emerging Markets,China
Linkbal Inc. (TSE:6046),TSE:6046,Software (Entertainment),Communication Services,7370,Japan,Japan,Japan
"LINKBANCORP, Inc. (OTCPK:LNKB)",OTCPK:LNKB,Banks (Regional),Financials,6020,United States,United States,United States
"LinkCom Manufacturing Co.,LTD. (TPEX:6821)",TPEX:6821,Electronics (General),Information Technology,3679,Taiwan,Emerging Markets,Small Asia
Linkfire A/S (OM:LINKFI),OM:LINKFI,Entertainment,Communication Services,7310,Denmark,Developed Europe,EU & Environs
"Linkgenesis Co., Ltd. (KOSDAQ:A219420)",KOSDAQ:A219420,Computer Services,Information Technology,7373,South Korea,Emerging Markets,Small Asia
Linklogis Inc. (SEHK:9959),SEHK:9959,Software (System & Application),Information Technology,7370,China,Emerging Markets,China
Linocraft Holdings Limited (SEHK:8383),SEHK:8383,Publishing & Newspapers,Industrials,2750,Malaysia,Emerging Markets,Small Asia
LINTEC Corporation (TSE:7966),TSE:7966,Chemical (Basic),Materials,2670,Japan,Japan,Japan
"Lintes Technology Co., Ltd. (TWSE:6715)",TWSE:6715,Computers/Peripherals,Information Technology,3570,Taiwan,Emerging Markets,Small Asia
Linus Digital Finance AG (DB:LDF),DB:LDF,Financial Svcs. (Non-bank & Insurance),Financials,6500,Germany,Developed Europe,EU & Environs
Linz Textil Holding AG (WBAG:LTH),WBAG:LTH,Apparel,Consumer Discretionary,2200,Austria,Developed Europe,EU & Environs
"Linzhou Heavy Machinery Group Co.,Ltd (SZSE:002535)",SZSE:002535,Machinery,Industrials,3530,China,Emerging Markets,China
Lion Asiapac Limited (SGX:BAZ),SGX:BAZ,Construction Supplies,Materials,5065,Singapore,Emerging Markets,Small Asia
Lion Brewery (Ceylon) PLC (COSE:LION.N0000),COSE:LION.N0000,Beverage (Alcoholic),Consumer Staples,2082,Sri Lanka,Emerging Markets,Small Asia
"Lion Chemtech Co., Ltd. (KOSDAQ:A171120)",KOSDAQ:A171120,Building Materials,Industrials,2860,South Korea,Emerging Markets,Small Asia
Lion Copper and Gold Corp. (TSXV:LEO),TSXV:LEO,Metals & Mining,Materials,1000,Canada,"Australia, NZ and Canada",Canada
Lion Corporation (TSE:4912),TSE:4912,Household Products,Consumer Staples,2840,Japan,Japan,Japan
LION E-Mobility AG (XTRA:LMIA),XTRA:LMIA,Electrical Equipment,Industrials,3690,Switzerland,Developed Europe,EU & Environs
Lion Energy Limited (ASX:LIO),ASX:LIO,Oil/Gas (Production and Exploration),Energy,1311,Australia,"Australia, NZ and Canada",Australia & NZ
Lion Industries Corporation Berhad (KLSE:LIONIND),KLSE:LIONIND,Steel,Materials,3312,Malaysia,Emerging Markets,Small Asia
Lion One Metals Limited (TSXV:LIO),TSXV:LIO,Precious Metals,Materials,1040,Canada,"Australia, NZ and Canada",Canada
Lion Posim Berhad (KLSE:LIONPSIM),KLSE:LIONPSIM,Retail (Distributors),Industrials,9998,Malaysia,Emerging Markets,Small Asia
Lion Rock Group Limited (SEHK:1127),SEHK:1127,Publishing & Newspapers,Industrials,2750,Hong Kong,Emerging Markets,China
"Lion Travel Service Co., Ltd. (TWSE:2731)",TWSE:2731,Hotel/Gaming,Consumer Discretionary,4700,Taiwan,Emerging Markets,Small Asia
"Lionco Pharmaceutical Group Co.,Ltd. (SHSE:603669)",SHSE:603669,Drugs (Pharmaceutical),Health Care,2834,China,Emerging Markets,China
Lionero AS (OTCNO:LION),OTCNO:LION,Oil/Gas (Production and Exploration),Energy,1311,Norway,Developed Europe,EU & Environs
Lionheart Acquisition Corporation II (NasdaqCM:LCAP),NasdaqCM:LCAP,Investments & Asset Management,Financials,9995,United States,United States,United States
Lionheart III Corp (NasdaqGM:LION),NasdaqGM:LION,Investments & Asset Management,Financials,9995,United States,United States,United States
Lions Bay Capital Inc. (TSXV:LBI),TSXV:LBI,Investments & Asset Management,Financials,6799,Canada,"Australia, NZ and Canada",Canada
Lions Gate Entertainment Corp. (NYSE:LGF.A),NYSE:LGF.A,Entertainment,Communication Services,7812,United States,United States,United States
Liontown Resources Limited (ASX:LTR),ASX:LTR,Metals & Mining,Materials,1000,Australia,"Australia, NZ and Canada",Australia & NZ
Liontrust Asset Management PLC (LSE:LIO),LSE:LIO,Investments & Asset Management,Financials,0,United Kingdom,Developed Europe,UK
Lipetsk Power Sale Company Open Joint-Stock Company (MISX:LPSB),MISX:LPSB,Power,Utilities,4911,Russia,Emerging Markets,Eastern Europe & Russia
Lipidor AB (publ) (OM:LIPI),OM:LIPI,Drugs (Pharmaceutical),Health Care,2834,Sweden,Developed Europe,EU & Environs
Lipigon Pharmaceuticals AB (publ) (OM:LPGO),OM:LPGO,Drugs (Pharmaceutical),Health Care,2834,Sweden,Developed Europe,EU & Environs
Lipocine Inc. (NasdaqCM:LPCN),NasdaqCM:LPCN,Drugs (Pharmaceutical),Health Care,2834,United States,United States,United States
Lippi Systems Limited (BSE:526604),BSE:526604,Machinery,Industrials,3555,India,Emerging Markets,India
Lippo China Resources Limited (SEHK:156),SEHK:156,Food Wholesalers,Consumer Staples,6500,Hong Kong,Emerging Markets,China
Lippo Limited (SEHK:226),SEHK:226,Food Wholesalers,Consumer Staples,6500,Hong Kong,Emerging Markets,China
Lippo Malls Indonesia Retail Trust (SGX:D5IU),SGX:D5IU,R.E.I.T.,Real Estate,6798,Singapore,Emerging Markets,Small Asia
Lipum AB (publ) (OM:LIPUM),OM:LIPUM,Drugs (Pharmaceutical),Health Care,2834,Sweden,Developed Europe,EU & Environs
"LiqTech International, Inc. (NasdaqCM:LIQT)",NasdaqCM:LIQT,Machinery,Industrials,3590,Denmark,Developed Europe,EU & Environs
Liquid Avatar Technologies Inc. (CNSX:LQID),CNSX:LQID,Software (System & Application),Information Technology,7370,Canada,"Australia, NZ and Canada",Canada
Liquid Media Group Ltd. (NasdaqCM:YVR),NasdaqCM:YVR,Entertainment,Communication Services,7370,Canada,"Australia, NZ and Canada",Canada
Liquidia Corporation (NasdaqCM:LQDA),NasdaqCM:LQDA,Drugs (Pharmaceutical),Health Care,2836,United States,United States,United States
"Liquidity Services, Inc. (NasdaqGS:LQDT)",NasdaqGS:LQDT,Retail (Online),Consumer Discretionary,5960,United States,United States,United States
"Liquidmetal Technologies, Inc. (OTCPK:LQMT)",OTCPK:LQMT,Metals & Mining,Materials,3310,United States,United States,United States
"Liqun Commercial Group Co.,Ltd. (SHSE:601366)",SHSE:601366,Retail (General),Consumer Discretionary,5311,China,Emerging Markets,China
"LIS Co., Ltd. (KOSDAQ:A138690)",KOSDAQ:A138690,Semiconductor Equip,Information Technology,3540,South Korea,Emerging Markets,Small Asia
