Company Name,Exchange:Ticker,Industry Group,Primary Sector,SIC Code,Country,Broad Group,Sub Group
Ceylinco Insurance PLC (COSE:CINS.N0000),COSE:CINS.N0000,Insurance (General),Financials,6300,Sri Lanka,Emerging Markets,Small Asia
Ceylon Beverage Holdings PLC (COSE:BREW.N0000),COSE:BREW.N0000,Beverage (Alcoholic),Consumer Staples,2082,Sri Lanka,Emerging Markets,Small Asia
Ceylon Cold Stores PLC (COSE:CCS.N0000),COSE:CCS.N0000,Beverage (Soft),Consumer Staples,2086,Sri Lanka,Emerging Markets,Small Asia
Ceylon Grain Elevators PLC (COSE:GRAN.N0000),COSE:GRAN.N0000,Food Processing,Consumer Staples,2040,Sri Lanka,Emerging Markets,Small Asia
Ceylon Graphite Corp. (TSXV:CYL),TSXV:CYL,Metals & Mining,Materials,1400,Canada,"Australia, NZ and Canada",Canada
Ceylon Guardian Investment Trust PLC (COSE:GUAR.N0000),COSE:GUAR.N0000,Investments & Asset Management,Financials,6282,Sri Lanka,Emerging Markets,Small Asia
Ceylon Hospitals PLC (COSE:CHL.X0000),COSE:CHL.X0000,Hospitals/Healthcare Facilities,Health Care,8060,Sri Lanka,Emerging Markets,Small Asia
Ceylon Hotels Corporation PLC (COSE:CHOT.N0000),COSE:CHOT.N0000,Hotel/Gaming,Consumer Discretionary,7011,Sri Lanka,Emerging Markets,Small Asia
Ceylon Investment PLC (COSE:CINV.N0000),COSE:CINV.N0000,Investments & Asset Management,Financials,6799,Sri Lanka,Emerging Markets,Small Asia
Ceylon Tea Brokers PLC (COSE:CTBL.N0000),COSE:CTBL.N0000,Retail (Distributors),Consumer Discretionary,5140,Sri Lanka,Emerging Markets,Small Asia
Ceylon Tobacco Company PLC (COSE:CTC.N0000),COSE:CTC.N0000,Tobacco,Consumer Staples,2111,Sri Lanka,Emerging Markets,Small Asia
CEZ Distribution Bulgaria AD (BUL:CEZD),BUL:CEZD,Power,Utilities,4911,Bulgaria,Emerging Markets,Eastern Europe & Russia
CEZ Electro Bulgaria AD (BUL:CEZE),BUL:CEZE,Power,Utilities,4911,Bulgaria,Emerging Markets,Eastern Europe & Russia
"CEZ, a. s. (SEP:CEZ)",SEP:CEZ,Power,Utilities,4911,Czech Republic,Developed Europe,EU & Environs
CF Acquisition Corp. IV (NasdaqCM:CFIV),NasdaqCM:CFIV,Investments & Asset Management,Financials,9995,United States,United States,United States
CF Acquisition Corp. V (NasdaqCM:CFV),NasdaqCM:CFV,Investments & Asset Management,Financials,9995,United States,United States,United States
CF Acquisition Corp. VI (NasdaqCM:CFVI),NasdaqCM:CFVI,Investments & Asset Management,Financials,9995,United States,United States,United States
CF Acquisition Corp. VIII (NasdaqCM:CFFE),NasdaqCM:CFFE,Investments & Asset Management,Financials,9995,United States,United States,United States
CF Bankshares Inc. (NasdaqCM:CFBK),NasdaqCM:CFBK,Financial Svcs. (Non-bank & Insurance),Financials,6035,United States,United States,United States
CF Energy Corp. (TSXV:CFY),TSXV:CFY,Power,Utilities,4924,Canada,"Australia, NZ and Canada",Canada
"CF Industries Holdings, Inc. (NYSE:CF)",NYSE:CF,Chemical (Specialty),Materials,2870,United States,United States,United States
CFAO Motors Cote d'Ivoire SA (BRVM:CFAC),BRVM:CFAC,Retail (Distributors),Consumer Discretionary,5500,Ivory Coast,Emerging Markets,Africa and Middle East
"CFECAPITAL, S. De R.L. De C.V. (BMV:FCFE 18)",BMV:FCFE 18,Power,Utilities,4911,Mexico,Emerging Markets,Latin America & Caribbean
CFI Holding S.A. (WSE:CFI),WSE:CFI,Real Estate (General/Diversified),Real Estate,1500,Poland,Developed Europe,EU & Environs
CFI-Compagnie Foncière Internationale (ENXTPA:CFI),ENXTPA:CFI,R.E.I.T.,Real Estate,6798,France,Developed Europe,EU & Environs
CFM Holdings Limited (Catalist:5EB),Catalist:5EB,Machinery,Industrials,3460,Singapore,Emerging Markets,Small Asia
CFM Indosuez Wealth Management SA (ENXTPA:MLCFM),ENXTPA:MLCFM,Bank (Money Center),Financials,6020,Monaco,Developed Europe,EU & Environs
CFN Enterprises Inc. (OTCPK:CNFN.D),OTCPK:CNFN.D,Software (Entertainment),Communication Services,7370,United States,United States,United States
CFOAM Limited (ASX:CFO),ASX:CFO,Electrical Equipment,Industrials,3620,Australia,"Australia, NZ and Canada",Australia & NZ
CFS Investment and Import Export Trading Joint Stock Company (HNX:KLF),HNX:KLF,Hotel/Gaming,Consumer Discretionary,7011,Vietnam,Emerging Markets,Small Asia
CG Power and Industrial Solutions Limited (BSE:500093),BSE:500093,Electrical Equipment,Industrials,3612,India,Emerging Markets,India
CG-VAK Software and Exports Limited (BSE:531489),BSE:531489,Software (System & Application),Information Technology,7372,India,Emerging Markets,India
CGE Energy Inc. (OTCPK:CGEI),OTCPK:CGEI,Green & Renewable Energy,Utilities,4991,United States,United States,United States
CGE Gas Natural S.A. (SNSE:CGEGAS),SNSE:CGEGAS,Power,Utilities,4932,Chile,Emerging Markets,Latin America & Caribbean
CGG (ENXTPA:CGG),ENXTPA:CGG,Oilfield Svcs/Equip.,Energy,1382,France,Developed Europe,EU & Environs
CGI Inc. (TSX:GIB.A),TSX:GIB.A,Computer Services,Information Technology,7370,Canada,"Australia, NZ and Canada",Canada
CGift AG (HMSE:T7RA),HMSE:T7RA,Investments & Asset Management,Financials,6799,Germany,Developed Europe,EU & Environs
CGN Mining Company Limited (SEHK:1164),SEHK:1164,Coal & Related Energy,Energy,1220,Hong Kong,Emerging Markets,China
"CGN New Energy Holdings Co., Ltd. (SEHK:1811)",SEHK:1811,Power,Utilities,4991,Hong Kong,Emerging Markets,China
"CGN Nuclear Technology Development Co., Ltd. (SZSE:000881)",SZSE:000881,Chemical (Specialty),Materials,6552,China,Emerging Markets,China
"CGN Power Co., Ltd. (SEHK:1816)",SEHK:1816,Power,Utilities,4991,China,Emerging Markets,China
"CGrowth Capital, Inc. (OTCPK:CGRA)",OTCPK:CGRA,Investments & Asset Management,Financials,6411,United States,United States,United States
CGS International Inc. (TPEX:5310),TPEX:5310,Computers/Peripherals,Information Technology,3577,Taiwan,Emerging Markets,Small Asia
"CGS International, Inc. (OTCPK:CGSI)",OTCPK:CGSI,Electronics (General),Information Technology,3720,United States,United States,United States
CGX Energy Inc. (TSXV:OYL),TSXV:OYL,Oil/Gas (Production and Exploration),Energy,1311,Canada,"Australia, NZ and Canada",Canada
"CH Biotech R&D Co., Ltd. (TPEX:6534)",TPEX:6534,Chemical (Specialty),Materials,2836,Taiwan,Emerging Markets,Small Asia
CH Offshore Ltd. (SGX:C13),SGX:C13,Oilfield Svcs/Equip.,Energy,1382,Singapore,Emerging Markets,Small Asia
CH. Karnchang Public Company Limited (SET:CK),SET:CK,Engineering/Construction,Industrials,1540,Thailand,Emerging Markets,Small Asia
"CHA Biotech Co., Ltd. (KOSDAQ:A085660)",KOSDAQ:A085660,Hospitals/Healthcare Facilities,Health Care,3851,South Korea,Emerging Markets,Small Asia
"Cha Vaccine Research Institute Co., Ltd. (KOSDAQ:A261780)",KOSDAQ:A261780,Drugs (Biotechnology),Health Care,2836,South Korea,Emerging Markets,Small Asia
Chaarat Gold Holdings Limited (AIM:CGH),AIM:CGH,Precious Metals,Materials,1040,Kyrgyzstan,Emerging Markets,Eastern Europe & Russia
"Chacha Food Company, Limited (SZSE:002557)",SZSE:002557,Food Processing,Consumer Staples,2090,China,Emerging Markets,China
"Chaheng Precision Co., Ltd. (TPEX:4546)",TPEX:4546,Aerospace/Defense,Industrials,3724,Taiwan,Emerging Markets,Small Asia
"Chahua Modern Housewares Co., Ltd. (SHSE:603615)",SHSE:603615,Household Products,Consumer Discretionary,3990,China,Emerging Markets,China
Chai Watana Tannery Group Public Company Limited (SET:CWT),SET:CWT,Apparel,Consumer Discretionary,3100,Thailand,Emerging Markets,Small Asia
Chailease Holding Company Limited (TWSE:5871),TWSE:5871,Financial Svcs. (Non-bank & Insurance),Financials,6153,Taiwan,Emerging Markets,Small Asia
"Chain Chon Industrial Co., Ltd. (TPEX:5014)",TPEX:5014,Steel,Materials,3312,Taiwan,Emerging Markets,Small Asia
"Chainqui Construction Development Co.,Ltd (TWSE:2509)",TWSE:2509,Engineering/Construction,Industrials,1520,Taiwan,Emerging Markets,Small Asia
Chaintech Technology Corporation (TWSE:2425),TWSE:2425,Computers/Peripherals,Information Technology,3572,Taiwan,Emerging Markets,Small Asia
Chakana Copper Corp. (TSXV:PERU),TSXV:PERU,Metals & Mining,Materials,1000,Canada,"Australia, NZ and Canada",Canada
Chakratec Ltd. (TASE:CKRT),TASE:CKRT,Electrical Equipment,Industrials,3690,Israel,Emerging Markets,Africa and Middle East
Chakwal Spinning Mills Limited (KASE:CWSM),KASE:CWSM,Apparel,Consumer Discretionary,2200,Pakistan,Emerging Markets,Small Asia
Chalet Hotels Limited (NSEI:CHALET),NSEI:CHALET,Hotel/Gaming,Consumer Discretionary,7011,India,Emerging Markets,India
Chalice Brands Ltd. (CNSX:CHAL),CNSX:CHAL,Drugs (Pharmaceutical),Health Care,2834,Canada,"Australia, NZ and Canada",Canada
Chalice Mining Limited (ASX:CHN),ASX:CHN,Metals & Mining,Materials,1000,Australia,"Australia, NZ and Canada",Australia & NZ
"Chalkis Health Industry Co., Ltd (SZSE:000972)",SZSE:000972,Food Processing,Consumer Staples,2033,China,Emerging Markets,China
Challenger Energy Group PLC (AIM:CEG),AIM:CEG,Oil/Gas (Production and Exploration),Energy,1311,Isle of Man,Developed Europe,EU & Environs
Challenger Exploration Limited (ASX:CEL),ASX:CEL,Metals & Mining,Materials,1311,Australia,"Australia, NZ and Canada",Australia & NZ
Challenger Limited (ASX:CGF),ASX:CGF,Financial Svcs. (Non-bank & Insurance),Financials,6311,Australia,"Australia, NZ and Canada",Australia & NZ
Challenger Technologies Limited (SGX:573),SGX:573,Retail (Special Lines),Consumer Discretionary,5734,Singapore,Emerging Markets,Small Asia
Cham Foods (Israel) Ltd (TASE:CHAM),TASE:CHAM,Food Processing,Consumer Staples,2090,Israel,Emerging Markets,Africa and Middle East
Chaman Lal Setia Exports Ltd. (BSE:530307),BSE:530307,Farming/Agriculture,Consumer Staples,2030,India,Emerging Markets,India
Chambal Breweries & Distilleries Limited (BSE:512301),BSE:512301,Retail (Distributors),Consumer Discretionary,5180,India,Emerging Markets,India
Chambal Fertilisers and Chemicals Limited (BSE:500085),BSE:500085,Chemical (Specialty),Materials,2870,India,Emerging Markets,India
Chamberlin plc (AIM:CMH),AIM:CMH,Steel,Materials,3320,United Kingdom,Developed Europe,UK
Champion Alliance International Holdings Limited (SEHK:1629),SEHK:1629,Packaging & Container,Materials,2670,China,Emerging Markets,China
Champion Bear Resources Ltd. (TSXV:CBA),TSXV:CBA,Metals & Mining,Materials,1000,Canada,"Australia, NZ and Canada",Canada
Champion Breweries Plc (NGSE:CHAMPION),NGSE:CHAMPION,Beverage (Alcoholic),Consumer Staples,2082,Nigeria,Emerging Markets,Africa and Middle East
"Champion Building Materials Co., Ltd. (TWSE:1806)",TWSE:1806,Building Materials,Industrials,3250,Taiwan,Emerging Markets,Small Asia
Champion Gaming Group Inc. (TSXV:WAGR),TSXV:WAGR,Information Services,Information Technology,7374,Canada,"Australia, NZ and Canada",Canada
Champion Iron Limited (ASX:CIA),ASX:CIA,Steel,Materials,1000,Australia,"Australia, NZ and Canada",Australia & NZ
Champion Microelectronic Corporation (TWSE:3257),TWSE:3257,Semiconductor,Information Technology,3674,Taiwan,Emerging Markets,Small Asia
Champion Real Estate Investment Trust (SEHK:2778),SEHK:2778,R.E.I.T.,Real Estate,6798,Hong Kong,Emerging Markets,China
Champion Technology Holdings Limited (SEHK:92),SEHK:92,Oilfield Svcs/Equip.,Energy,3576,Hong Kong,Emerging Markets,China
"Champions Oncology, Inc. (NasdaqCM:CSBR)",NasdaqCM:CSBR,Heathcare Information and Technology,Health Care,2836,United States,United States,United States
ChampionX Corporation (NasdaqGS:CHX),NasdaqGS:CHX,Oilfield Svcs/Equip.,Energy,3533,United States,United States,United States
Chams Plc (NGSE:CHAMS),NGSE:CHAMS,Software (System & Application),Information Technology,7372,Nigeria,Emerging Markets,Africa and Middle East
"Chancellor Group, Inc. (OTCPK:CHAG)",OTCPK:CHAG,Oil/Gas (Production and Exploration),Energy,1311,United States,United States,United States
Chander Electronics Corp. (TPEX:8068),TPEX:8068,Computer Services,Information Technology,5065,Taiwan,Emerging Markets,Small Asia
Chandni Machines Limited (BSE:542627),BSE:542627,Apparel,Consumer Discretionary,5084,India,Emerging Markets,India
Chandni Textiles Engineering Industries Limited (BSE:522292),BSE:522292,Machinery,Industrials,2200,India,Emerging Markets,India
Chandra Bhagat Pharma Limited (BSE:542934),BSE:542934,Healthcare Support Services,Health Care,5122,India,Emerging Markets,India
Chandra Prabhu International Ltd. (BSE:530309),BSE:530309,Retail (Distributors),Industrials,5050,India,Emerging Markets,India
Chandrima Mercantiles Limited (BSE:540829),BSE:540829,Retail (Distributors),Consumer Discretionary,5094,India,Emerging Markets,India
"Chang Chun Eurasia Group Co., Ltd. (SHSE:600697)",SHSE:600697,Retail (General),Consumer Discretionary,5331,China,Emerging Markets,China
"Chang Hwa Commercial Bank, Ltd. (TWSE:2801)",TWSE:2801,Bank (Money Center),Financials,6020,Taiwan,Emerging Markets,Small Asia
Chang Jia M&E Engineering Corp. (TPEX:4550),TPEX:4550,Engineering/Construction,Industrials,8711,Taiwan,Emerging Markets,Small Asia
"Chang Jiang Shipping Group Phoenix Co.,Ltd (SZSE:000520)",SZSE:000520,Shipbuilding & Marine,Industrials,2911,China,Emerging Markets,China
"Chang Lan Electric Technology Co.,Ltd. (SZSE:002879)",SZSE:002879,Electrical Equipment,Industrials,3357,China,Emerging Markets,China
"CHANG TYPE Industrial Co., Ltd. (TWSE:1541)",TWSE:1541,Furn/Home Furnishings,Consumer Discretionary,3540,Taiwan,Emerging Markets,Small Asia
Chang Wah Electromaterials Inc. (TWSE:8070),TWSE:8070,Computer Services,Information Technology,5065,Taiwan,Emerging Markets,Small Asia
"Chang Wah Technology Co., Ltd. (TPEX:6548)",TPEX:6548,Semiconductor Equip,Information Technology,3679,Taiwan,Emerging Markets,Small Asia
Chang-Ho Fibre Corporation (TWSE:1468),TWSE:1468,Apparel,Consumer Discretionary,2221,Taiwan,Emerging Markets,Small Asia
"Changan Minsheng APLL Logistics Co., Ltd. (SEHK:1292)",SEHK:1292,Transportation,Industrials,4210,Hong Kong,Emerging Markets,China
"Changbai Mountain Tourism Co., Ltd. (SHSE:603099)",SHSE:603099,Hotel/Gaming,Consumer Discretionary,4700,China,Emerging Markets,China
"Changchai Company, Limited (SZSE:000570)",SZSE:000570,Machinery,Industrials,3510,China,Emerging Markets,China
Changchun BCHT Biotechnology Co. (SHSE:688276),SHSE:688276,Drugs (Biotechnology),Health Care,2836,China,Emerging Markets,China
"Changchun Engley Automobile Industry Co.,Ltd. (SHSE:601279)",SHSE:601279,Auto Parts,Consumer Discretionary,3714,China,Emerging Markets,China
"Changchun FAWAY Automobile Components Co.,Ltd (SHSE:600742)",SHSE:600742,Auto Parts,Consumer Discretionary,3714,China,Emerging Markets,China
"Changchun Gas Co,.Ltd (SHSE:600333)",SHSE:600333,Power,Utilities,3312,China,Emerging Markets,China
Changchun High & New Technology Industry (Group) Inc. (SZSE:000661),SZSE:000661,Drugs (Pharmaceutical),Health Care,2836,China,Emerging Markets,China
"Changchun UP Optotech Co.,Ltd. (SZSE:002338)",SZSE:002338,Aerospace/Defense,Industrials,3823,China,Emerging Markets,China
"Changchun Yidong Clutch CO.,LTD (SHSE:600148)",SHSE:600148,Auto Parts,Consumer Discretionary,3714,China,Emerging Markets,China
"Changchun Zhiyuan New Energy Equipment Co., Ltd (SZSE:300985)",SZSE:300985,Construction Supplies,Industrials,3443,China,Emerging Markets,China
Change Financial Limited (ASX:CCA),ASX:CCA,Information Services,Information Technology,7374,Australia,"Australia, NZ and Canada",Australia & NZ
Change Healthcare Inc. (NasdaqGS:CHNG),NasdaqGS:CHNG,Heathcare Information and Technology,Health Care,7372,United States,United States,United States
Change Inc. (TSE:3962),TSE:3962,Computer Services,Information Technology,7373,Japan,Japan,Japan
"Changgao Electric Group Co., Ltd. (SZSE:002452)",SZSE:002452,Electrical Equipment,Industrials,3612,China,Emerging Markets,China
"Changhae Ethanol Co., Ltd. (KOSDAQ:A004650)",KOSDAQ:A004650,Chemical (Specialty),Materials,2800,South Korea,Emerging Markets,Small Asia
"Changhong Huayi Compressor Co., Ltd. (SZSE:000404)",SZSE:000404,Machinery,Industrials,3560,China,Emerging Markets,China
Changhong Jiahua Holdings Limited (SEHK:3991),SEHK:3991,Computer Services,Information Technology,5064,Hong Kong,Emerging Markets,China
"Changhong Meiling Co., Ltd. (SZSE:200521)",SZSE:200521,Furn/Home Furnishings,Consumer Discretionary,3630,China,Emerging Markets,China
"Changjiang & Jinggong Steel Building (Group) Co., Ltd (SHSE:600496)",SHSE:600496,Engineering/Construction,Industrials,3440,China,Emerging Markets,China
"Changjiang Publishing & Media Co.,Ltd (SHSE:600757)",SHSE:600757,Publishing & Newspapers,Communication Services,2200,China,Emerging Markets,China
"Changjiang Runfa Health Industry Co., Ltd. (SZSE:002435)",SZSE:002435,Drugs (Pharmaceutical),Health Care,3440,China,Emerging Markets,China
Changjiang Securities Company Limited (SZSE:000783),SZSE:000783,Brokerage & Investment Banking,Financials,6211,China,Emerging Markets,China
Changmao Biochemical Engineering Company Limited (SEHK:954),SEHK:954,Chemical (Specialty),Materials,2860,China,Emerging Markets,China
Changmao Biochemical Engineering Company Limited (SEHK:954),SEHK:954,Chemical (Specialty),Materials,2860,China,Emerging Markets,China
Changqing Machinery Company Limited (SHSE:603768),SHSE:603768,Auto Parts,Consumer Discretionary,3714,China,Emerging Markets,China
"Changs Ascending Enterprise Co., Ltd. (TPEX:8038)",TPEX:8038,Electrical Equipment,Industrials,3690,Taiwan,Emerging Markets,Small Asia
"Changsha Broad Homes Industrial Group Co., Ltd. (SEHK:2163)",SEHK:2163,Engineering/Construction,Industrials,1500,China,Emerging Markets,China
"Changsha DIALINE New Material Sci.&Tech. Co., Ltd. (SZSE:300700)",SZSE:300700,Machinery,Industrials,3541,China,Emerging Markets,China
"Changsha Jingjia Microelectronics Co., Ltd. (SZSE:300474)",SZSE:300474,Semiconductor,Information Technology,3674,China,Emerging Markets,China
"Changsha Tongcheng Holdings Co.,Ltd (SZSE:000419)",SZSE:000419,Retail (General),Consumer Discretionary,5311,China,Emerging Markets,China
"Changshu Fengfan Power Equipment Co., Ltd. (SHSE:601700)",SHSE:601700,Engineering/Construction,Industrials,3440,China,Emerging Markets,China
"Changshu Guorui Technology Co., Ltd. (SZSE:300600)",SZSE:300600,Electrical Equipment,Industrials,3613,China,Emerging Markets,China
"Changshu Tianyin Electromechanical Co.,Ltd (SZSE:300342)",SZSE:300342,Electrical Equipment,Industrials,3674,China,Emerging Markets,China
"Changying Xinzhi Technology Co.,Ltd. (SZSE:002664)",SZSE:002664,Auto Parts,Consumer Discretionary,3714,China,Emerging Markets,China
Changyou Alliance Group Limited (SEHK:1039),SEHK:1039,Retail (Online),Consumer Discretionary,3714,Hong Kong,Emerging Markets,China
Changyuan Technology Group Ltd. (SHSE:600525),SHSE:600525,Electrical Equipment,Industrials,3600,China,Emerging Markets,China
"Changzheng Engineering Co.,LTD (SHSE:603698)",SHSE:603698,Oilfield Svcs/Equip.,Energy,3533,China,Emerging Markets,China
"Changzhou Almaden Co., Ltd. (SZSE:002623)",SZSE:002623,Semiconductor,Information Technology,3211,China,Emerging Markets,China
"Changzhou Aohong Electronics Co., Ltd. (SHSE:605058)",SHSE:605058,Electronics (General),Information Technology,3672,China,Emerging Markets,China
"Changzhou Galaxy Century Microelectronics Co.,Ltd. (SHSE:688689)",SHSE:688689,Semiconductor,Information Technology,3674,China,Emerging Markets,China
Changzhou Kaidi Electrical Inc. (SHSE:605288),SHSE:605288,Electrical Equipment,Industrials,3690,China,Emerging Markets,China
"Changzhou Langbo Sealing Technologies Co.,Ltd. (SHSE:603655)",SHSE:603655,Rubber& Tires,Consumer Discretionary,3050,China,Emerging Markets,China
Changzhou Nrb Corporation (SZSE:002708),SZSE:002708,Machinery,Industrials,3560,China,Emerging Markets,China
"Changzhou Qianhong Biopharma CO.,LTD (SZSE:002550)",SZSE:002550,Drugs (Pharmaceutical),Health Care,2836,China,Emerging Markets,China
Changzhou Shenli Electrical Machine Incorporated Company (SHSE:603819),SHSE:603819,Electrical Equipment,Industrials,3620,China,Emerging Markets,China
"Changzhou Tenglong AutoPartsCo.,Ltd. (SHSE:603158)",SHSE:603158,Auto Parts,Consumer Discretionary,3714,China,Emerging Markets,China
"Changzhou Tiansheng New Materials Co., Ltd. (SZSE:300169)",SZSE:300169,Chemical (Basic),Materials,3080,China,Emerging Markets,China
"Changzhou Tronly New Electronic Materials Co., Ltd. (SZSE:300429)",SZSE:300429,Chemical (Specialty),Materials,2800,China,Emerging Markets,China
"Changzhou Xingyu Automotive Lighting Systems Co.,Ltd. (SHSE:601799)",SHSE:601799,Auto Parts,Consumer Discretionary,3714,China,Emerging Markets,China
"Changzhou Zhongying Science & Technology Co., Ltd (SZSE:300936)",SZSE:300936,Electronics (General),Information Technology,3670,China,Emerging Markets,China
Chanhigh Holdings Limited (SEHK:2017),SEHK:2017,Engineering/Construction,Industrials,1600,China,Emerging Markets,China
Chanjet Information Technology Company Limited (SEHK:1588),SEHK:1588,Software (System & Application),Information Technology,7372,China,Emerging Markets,China
Channel Micron Holdings Company Limited (SEHK:2115),SEHK:2115,Building Materials,Industrials,3564,Malaysia,Emerging Markets,Small Asia
"Channel Well Technology Co.,Ltd. (TPEX:3078)",TPEX:3078,Electronics (General),Information Technology,3679,Taiwan,Emerging Markets,Small Asia
ChannelAdvisor Corporation (NYSE:ECOM),NYSE:ECOM,Software (System & Application),Information Technology,7370,United States,United States,United States
"Chant Sincere Co., Ltd. (TWSE:6205)",TWSE:6205,Electronics (General),Information Technology,3678,Taiwan,Emerging Markets,Small Asia
Chaoda Modern Agriculture (Holdings) Limited (SEHK:682),SEHK:682,Farming/Agriculture,Consumer Staples,100,Hong Kong,Emerging Markets,China
Chaoju Eye Care Holdings Limited (SEHK:2219),SEHK:2219,Hospitals/Healthcare Facilities,Health Care,8060,China,Emerging Markets,China
Chaoprayamahanakorn Public Company Limited (SET:CMC),SET:CMC,Real Estate (Development),Real Estate,6552,Thailand,Emerging Markets,Small Asia
Chaowei Power Holdings Limited (SEHK:951),SEHK:951,Auto Parts,Consumer Discretionary,3690,China,Emerging Markets,China
"Chaozhou Three-Circle (Group) Co.,Ltd. (SZSE:300408)",SZSE:300408,Electronics (General),Information Technology,3670,China,Emerging Markets,China
CHAR Technologies Ltd. (TSXV:YES),TSXV:YES,Environmental & Waste Services,Industrials,4950,Canada,"Australia, NZ and Canada",Canada
"Charah Solutions, Inc. (NYSE:CHRA)",NYSE:CHRA,Environmental & Waste Services,Industrials,4950,United States,United States,United States
Charan Insurance Public Company Limited (SET:CHARAN),SET:CHARAN,Insurance (Prop/Cas.),Financials,6331,Thailand,Emerging Markets,Small Asia
Chardan NexTech Acquisition 2 Corp. (NasdaqCM:CNTQ),NasdaqCM:CNTQ,Investments & Asset Management,Financials,9995,United States,United States,United States
"Charge Enterprises, Inc. (OTCPK:CRGE)",OTCPK:CRGE,Software (System & Application),Information Technology,4911,United States,United States,United States
ChargePanel AB (publ) (OM:CHARGE),OM:CHARGE,Software (System & Application),Information Technology,7370,Sweden,Developed Europe,EU & Environs
"ChargePoint Holdings, Inc. (NYSE:CHPT)",NYSE:CHPT,Electrical Equipment,Industrials,7500,United States,United States,United States
Charger Metals NL (ASX:CHR),ASX:CHR,Metals & Mining,Materials,1000,Australia,"Australia, NZ and Canada",Australia & NZ
Chargeurs SA (ENXTPA:CRI),ENXTPA:CRI,Diversified,Industrials,9997,France,Developed Europe,EU & Environs
Chariot Limited (AIM:CHAR),AIM:CHAR,Oil/Gas (Production and Exploration),Energy,1311,Guernsey,Developed Europe,EU & Environs
"Charle Co.,Ltd. (TSE:9885)",TSE:9885,Retail (Distributors),Consumer Discretionary,5130,Japan,Japan,Japan
"Charles & Colvard, Ltd. (NasdaqCM:CTHR)",NasdaqCM:CTHR,Apparel,Consumer Discretionary,3290,United States,United States,United States
"Charles River Laboratories International, Inc. (NYSE:CRL)",NYSE:CRL,Heathcare Information and Technology,Health Care,8731,United States,United States,United States
Charles Stanley Group PLC (LSE:CAY),LSE:CAY,Brokerage & Investment Banking,Financials,6200,United Kingdom,Developed Europe,UK
Charlestowne Premium Beverages Inc. (OTCPK:FPWM),OTCPK:FPWM,Beverage (Alcoholic),Consumer Staples,6200,United States,United States,United States
"Charlie's Holdings, Inc. (OTCPK:CHUC)",OTCPK:CHUC,Tobacco,Consumer Staples,2100,United States,United States,United States
"Charlotte's Web Holdings, Inc. (TSX:CWEB)",TSX:CWEB,Drugs (Pharmaceutical),Health Care,2834,United States,United States,United States
Charm Care Corporation (TSE:6062),TSE:6062,Healthcare Support Services,Health Care,8050,Japan,Japan,Japan
"Charm Engineering Co.,Ltd. (KOSE:A009310)",KOSE:A009310,Semiconductor Equip,Information Technology,3559,South Korea,Emerging Markets,Small Asia
"Charmacy Pharmaceutical Co., Ltd. (SEHK:2289)",SEHK:2289,Healthcare Support Services,Health Care,5122,China,Emerging Markets,China
Charms Industries Limited (BSE:531327),BSE:531327,Financial Svcs. (Non-bank & Insurance),Financials,6099,India,Emerging Markets,India
Charn Issara Development Public Company Limited (SET:CI),SET:CI,Real Estate (Development),Real Estate,6552,Thailand,Emerging Markets,Small Asia
"Charoen Pokphand Enterprise(Taiwan) Co., Ltd. (TWSE:1215)",TWSE:1215,Food Processing,Consumer Staples,2040,Taiwan,Emerging Markets,Small Asia
Charoen Pokphand Foods Public Company Limited (SET:CPF),SET:CPF,Food Processing,Consumer Staples,200,Thailand,Emerging Markets,Small Asia
Charoong Thai Wire and Cable Public Company Limited (SET:CTW),SET:CTW,Electrical Equipment,Industrials,3357,Thailand,Emerging Markets,Small Asia
"Chart Industries, Inc. (NYSE:GTLS)",NYSE:GTLS,Machinery,Industrials,3443,United States,United States,United States
"Charter Communications, Inc. (NasdaqGS:CHTR)",NasdaqGS:CHTR,Cable TV,Communication Services,4841,United States,United States,United States
Charter Hall Long WALE REIT (ASX:CLW),ASX:CLW,R.E.I.T.,Real Estate,6798,Australia,"Australia, NZ and Canada",Australia & NZ
Charter Hall Retail Real Estate Investment Trust (ASX:CQR),ASX:CQR,R.E.I.T.,Real Estate,6798,Australia,"Australia, NZ and Canada",Australia & NZ
Charter Hall Social Infrastructure REIT (ASX:CQE),ASX:CQE,R.E.I.T.,Real Estate,6798,Australia,"Australia, NZ and Canada",Australia & NZ
