Company Name,Exchange:Ticker,Industry Group,Primary Sector,SIC Code,Country,Broad Group,Sub Group
Longwell Company (TPEX:6290),TPEX:6290,Electrical Equipment,Industrials,3640,Taiwan,Emerging Markets,Small Asia
Longwen Group Corp. (OTCPK:LWLW),OTCPK:LWLW,Electronics (General),Information Technology,9995,United States,United States,United States
"Longxing Chemical Stock Co., Ltd. (SZSE:002442)",SZSE:002442,Chemical (Basic),Materials,2890,China,Emerging Markets,China
"Longyan Kaolin Clay Co., Ltd. (SHSE:605086)",SHSE:605086,Construction Supplies,Materials,1400,China,Emerging Markets,China
"Longyan Zhuoyue New Energy Co., Ltd. (SHSE:688196)",SHSE:688196,Oilfield Svcs/Equip.,Energy,2990,China,Emerging Markets,China
"Longzhou Group Co., Ltd. (SZSE:002682)",SZSE:002682,Trucking,Industrials,4210,China,Emerging Markets,China
"Lonkey Industrial Co.,Ltd.Guangzhou (SZSE:000523)",SZSE:000523,Household Products,Consumer Staples,2840,China,Emerging Markets,China
Lonking Holdings Limited (SEHK:3339),SEHK:3339,Construction Supplies,Industrials,3531,China,Emerging Markets,China
Lonseal Corporation (TSE:4224),TSE:4224,Building Materials,Industrials,2820,Japan,Japan,Japan
"Lontrue Co., Ltd. (SZSE:300175)",SZSE:300175,Farming/Agriculture,Consumer Staples,2030,China,Emerging Markets,China
Lonza Group Ltd (SWX:LONN),SWX:LONN,Heathcare Information and Technology,Health Care,2800,Switzerland,Developed Europe,EU & Environs
Look Holdings Incorporated (TSE:8029),TSE:8029,Apparel,Consumer Discretionary,2300,Japan,Japan,Japan
Lookers plc (LSE:LOOK),LSE:LOOK,Retail (Automotive),Consumer Discretionary,5500,United Kingdom,Developed Europe,UK
Looks Health Services Limited (BSE:534422),BSE:534422,Hospitals/Healthcare Facilities,Health Care,8090,India,Emerging Markets,India
Loomis AB (publ) (OM:LOOMIS),OM:LOOMIS,Business & Consumer Services,Industrials,7381,Sweden,Developed Europe,EU & Environs
Loop Energy Inc. (TSX:LPEN),TSX:LPEN,Electrical Equipment,Industrials,3620,Canada,"Australia, NZ and Canada",Canada
"Loop Industries, Inc. (NasdaqGM:LOOP)",NasdaqGM:LOOP,Chemical (Basic),Materials,2821,Canada,"Australia, NZ and Canada",Canada
"Loop Media, Inc. (OTCPK:LPTV)",OTCPK:LPTV,Entertainment,Communication Services,7371,United States,United States,United States
"Loop Telecommunication International,Inc. (TWSE:3025)",TWSE:3025,Telecom. Equipment,Information Technology,3669,Taiwan,Emerging Markets,Small Asia
LoopUp Group plc (AIM:LOOP),AIM:LOOP,Software (System & Application),Information Technology,7370,United Kingdom,Developed Europe,UK
"Lootom Telcovideo Network (wuxi) Co., Ltd. (SZSE:300555)",SZSE:300555,Telecom. Equipment,Information Technology,3663,China,Emerging Markets,China
Lopez Holdings Corporation (PSE:LPZ),PSE:LPZ,Power,Utilities,4991,Philippines,Emerging Markets,Small Asia
Lord Global Corporation (OTCPK:LRDG),OTCPK:LRDG,Entertainment,Communication Services,7812,United States,United States,United States
Lords & Company Worldwide Holdings Inc. (CNSX:LRDS),CNSX:LRDS,Drugs (Pharmaceutical),Health Care,2834,Canada,"Australia, NZ and Canada",Canada
Lords Chloro Alkali Limited (BSE:500284),BSE:500284,Chemical (Basic),Materials,2810,India,Emerging Markets,India
Lords Group Trading PLC (AIM:LORD),AIM:LORD,Retail (Distributors),Industrials,5200,United Kingdom,Developed Europe,UK
Lords Ishwar Hotels Limited (BSE:530065),BSE:530065,Hotel/Gaming,Consumer Discretionary,7011,India,Emerging Markets,India
Lordstown Motors Corp. (NasdaqGS:RIDE),NasdaqGS:RIDE,Auto & Truck,Consumer Discretionary,3711,United States,United States,United States
Lorenzini Apparels Limited (BSE:540952),BSE:540952,Apparel,Consumer Discretionary,2300,India,Emerging Markets,India
Lorenzo Shipping Corporation (PSE:LSC),PSE:LSC,Shipbuilding & Marine,Industrials,4400,Philippines,Emerging Markets,Small Asia
Los Andes Copper Ltd. (TSXV:LA),TSXV:LA,Metals & Mining,Materials,1000,Canada,"Australia, NZ and Canada",Canada
Los Cerros Limited (ASX:LCL),ASX:LCL,Metals & Mining,Materials,1000,Australia,"Australia, NZ and Canada",Australia & NZ
Losinjska Plovidba Holding d.d. (ZGSE:LPLH),ZGSE:LPLH,Shipbuilding & Marine,Industrials,4400,Croatia,Emerging Markets,EU & Environs
"LOT VACUUM Co., Ltd. (KOSDAQ:A083310)",KOSDAQ:A083310,Semiconductor Equip,Information Technology,3559,South Korea,Emerging Markets,Small Asia
"Lot78, Inc. (OTCPK:LOTE)",OTCPK:LOTE,Apparel,Consumer Discretionary,2300,United Kingdom,Developed Europe,UK
"Lotes Co., Ltd (TWSE:3533)",TWSE:3533,Electronics (General),Information Technology,3678,Taiwan,Emerging Markets,Small Asia
Loto Interactive Limited (SEHK:8198),SEHK:8198,Hotel/Gaming,Consumer Discretionary,7990,Hong Kong,Emerging Markets,China
Lotte Chemical Corporation (KOSE:A011170),KOSE:A011170,Chemical (Basic),Materials,2821,South Korea,Emerging Markets,Small Asia
Lotte Chemical Pakistan Limited (KASE:LOTCHEM),KASE:LOTCHEM,Chemical (Basic),Materials,2860,Pakistan,Emerging Markets,Small Asia
Lotte Chemical Titan Holding Berhad (KLSE:LCTITAN),KLSE:LCTITAN,Chemical (Basic),Materials,2820,Malaysia,Emerging Markets,Small Asia
"Lotte Chilsung Beverage Co.,Ltd. (KOSE:A005300)",KOSE:A005300,Beverage (Soft),Consumer Staples,2086,South Korea,Emerging Markets,Small Asia
"Lotte Confectionery Co., Ltd. (KOSE:A280360)",KOSE:A280360,Food Processing,Consumer Staples,2030,South Korea,Emerging Markets,Small Asia
LOTTE Corporation (KOSE:A004990),KOSE:A004990,Diversified,Industrials,2060,South Korea,Emerging Markets,Small Asia
Lotte Data Communication Company (KOSE:A286940),KOSE:A286940,Computer Services,Information Technology,7370,South Korea,Emerging Markets,Small Asia
"LOTTE Fine Chemical Co., Ltd. (KOSE:A004000)",KOSE:A004000,Chemical (Diversified),Materials,2810,South Korea,Emerging Markets,Small Asia
"Lotte Food Co.,Ltd. (KOSE:A002270)",KOSE:A002270,Food Processing,Consumer Staples,2000,South Korea,Emerging Markets,Small Asia
"LOTTE Himart Co.,Ltd. (KOSE:A071840)",KOSE:A071840,Retail (Special Lines),Consumer Discretionary,5700,South Korea,Emerging Markets,Small Asia
"Lotte Non - Life Insurance Co., Ltd. (KOSE:A000400)",KOSE:A000400,Insurance (Prop/Cas.),Financials,6331,South Korea,Emerging Markets,Small Asia
"LOTTE REIT Co., Ltd. (KOSE:A330590)",KOSE:A330590,R.E.I.T.,Real Estate,6798,South Korea,Emerging Markets,Small Asia
"LOTTE rental co.,ltd. (KOSE:A089860)",KOSE:A089860,Trucking,Industrials,7510,South Korea,Emerging Markets,Small Asia
"Lotte Shopping Co., Ltd. (KOSE:A023530)",KOSE:A023530,Retail (General),Consumer Discretionary,5311,South Korea,Emerging Markets,Small Asia
"Lotte Tour Development Co., Ltd. (KOSE:A032350)",KOSE:A032350,Hotel/Gaming,Consumer Discretionary,4700,South Korea,Emerging Markets,Small Asia
Lottery.com Inc. (NasdaqGM:LTRY),NasdaqGM:LTRY,Hotel/Gaming,Consumer Discretionary,7990,United States,United States,United States
Lottotech Ltd (MUSE:LOTO.N0000),MUSE:LOTO.N0000,Hotel/Gaming,Consumer Discretionary,7990,Mauritius,Emerging Markets,Africa and Middle East
Lotus Bakeries NV (ENXTBR:LOTB),ENXTBR:LOTB,Food Processing,Consumer Staples,2050,Belgium,Developed Europe,EU & Environs
Lotus Bio-Technology Development Corp. (OTCPK:LBTD),OTCPK:LBTD,Entertainment,Communication Services,7812,United States,United States,United States
Lotus Chocolate Company Limited (BSE:523475),BSE:523475,Food Processing,Consumer Staples,2060,India,Emerging Markets,India
Lotus Eye Hospital and Institute Limited (BSE:532998),BSE:532998,Hospitals/Healthcare Facilities,Health Care,8090,India,Emerging Markets,India
Lotus Health Group Company (SHSE:600186),SHSE:600186,Food Processing,Consumer Staples,2860,China,Emerging Markets,China
Lotus Horizon Holdings Limited (SEHK:6063),SEHK:6063,Engineering/Construction,Industrials,1700,Hong Kong,Emerging Markets,China
Lotus Hydro Power PLC (COSE:HPFL.N0000),COSE:HPFL.N0000,Green & Renewable Energy,Utilities,4991,Sri Lanka,Emerging Markets,Small Asia
Lotus KFM Berhad (KLSE:LOTUS),KLSE:LOTUS,Food Processing,Consumer Staples,2040,Malaysia,Emerging Markets,Small Asia
"Lotus Pharmaceutical Co., Ltd. (TWSE:1795)",TWSE:1795,Drugs (Pharmaceutical),Health Care,2834,Taiwan,Emerging Markets,Small Asia
"Lotus Pharmaceuticals, Inc. (OTCPK:LTUS)",OTCPK:LTUS,Drugs (Pharmaceutical),Health Care,2834,China,Emerging Markets,China
Lotus Resources Limited (ASX:LOT),ASX:LOT,Metals & Mining,Materials,1000,Australia,"Australia, NZ and Canada",Australia & NZ
Lotus Ventures Inc. (CNSX:J),CNSX:J,Drugs (Pharmaceutical),Health Care,2833,Canada,"Australia, NZ and Canada",Canada
Lotus's Retail Growth Freehold and Leasehold Property Fund (SET:LPF),SET:LPF,R.E.I.T.,Real Estate,6798,Thailand,Emerging Markets,Small Asia
Loudspring Oyj (HLSE:LOUD),HLSE:LOUD,Investments & Asset Management,Financials,6799,Finland,Developed Europe,EU & Environs
Louis Capital Joint Stock Company (HOSE:TGG),HOSE:TGG,Engineering/Construction,Industrials,0,Vietnam,Emerging Markets,Small Asia
Louis Land Joint Stock Company (HNX:BII),HNX:BII,Engineering/Construction,Industrials,1600,Vietnam,Emerging Markets,Small Asia
Louis plc (CSE:LUI),CSE:LUI,Hotel/Gaming,Consumer Discretionary,4700,Cyprus,Developed Europe,EU & Environs
Louisa Professional Coffee Ltd. (TPEX:2758),TPEX:2758,Food Processing,Consumer Staples,2090,Taiwan,Emerging Markets,Small Asia
Louisiana-Pacific Corporation (NYSE:LPX),NYSE:LPX,Paper/Forest Products,Materials,2400,United States,United States,United States
Loulis Mills S.A. (ATSE:KYLO),ATSE:KYLO,Food Processing,Consumer Staples,2040,Greece,Developed Europe,EU & Environs
Loungers plc (AIM:LGRS),AIM:LGRS,Restaurant/Dining,Consumer Discretionary,5810,United Kingdom,Developed Europe,UK
Lovable Lingerie Limited (BSE:533343),BSE:533343,Apparel,Consumer Discretionary,2340,India,Emerging Markets,India
"Lovable Marketing Group,inc. (TSE:9254)",TSE:9254,Advertising,Communication Services,8742,Japan,Japan,Japan
Love Pharma Inc. (CNSX:LUV),CNSX:LUV,Drugs (Pharmaceutical),Health Care,2833,Canada,"Australia, NZ and Canada",Canada
Lovisa Holdings Limited (ASX:LOV),ASX:LOV,Retail (Special Lines),Consumer Discretionary,5944,Australia,"Australia, NZ and Canada",Australia & NZ
Lovisagruvan AB (publ) (NGM:LOVI),NGM:LOVI,Metals & Mining,Materials,1000,Sweden,Developed Europe,EU & Environs
Low Keng Huat (Singapore) Limited (SGX:F1E),SGX:F1E,Real Estate (General/Diversified),Real Estate,1500,Singapore,Emerging Markets,Small Asia
"Lowe's Companies, Inc. (NYSE:LOW)",NYSE:LOW,Retail (Building Supply),Consumer Discretionary,5200,United States,United States,United States
Lowell Farms Inc. (CNSX:LOWL),CNSX:LOWL,Drugs (Pharmaceutical),Health Care,2834,United States,United States,United States
Loxley Public Company Limited (SET:LOXLEY),SET:LOXLEY,Electronics (General),Information Technology,5063,Thailand,Emerging Markets,Small Asia
Loyal Equipments Limited (BSE:539227),BSE:539227,Machinery,Industrials,3443,India,Emerging Markets,India
Loyal Solutions A/S (OM:LOYAL),OM:LOYAL,Software (System & Application),Information Technology,7370,Denmark,Developed Europe,EU & Environs
Loyal Textile Mills Limited (BSE:514036),BSE:514036,Apparel,Consumer Discretionary,2200,India,Emerging Markets,India
"Loyalty Founder Enterprise Co.,Ltd. (TPEX:5465)",TPEX:5465,Computers/Peripherals,Information Technology,3490,Taiwan,Emerging Markets,Small Asia
Loyalty Ventures Inc. (NasdaqGS:LYLT),NasdaqGS:LYLT,Advertising,Communication Services,7389,United States,United States,United States
LPA Group Plc (AIM:LPA),AIM:LPA,Electrical Equipment,Industrials,3670,United Kingdom,Developed Europe,UK
LPI Capital Bhd (KLSE:LPI),KLSE:LPI,Insurance (Prop/Cas.),Financials,6331,Malaysia,Emerging Markets,Small Asia
LPKF Laser & Electronics AG (XTRA:LPK),XTRA:LPK,Electronics (General),Information Technology,3672,Germany,Developed Europe,EU & Environs
LPL Financial Holdings Inc. (NasdaqGS:LPLA),NasdaqGS:LPLA,Brokerage & Investment Banking,Financials,6211,United States,United States,United States
LPP SA (WSE:LPP),WSE:LPP,Apparel,Consumer Discretionary,2300,Poland,Developed Europe,EU & Environs
LPS Brasil - Consultoria de Imóveis S.A. (BOVESPA:LPSB3),BOVESPA:LPSB3,Real Estate (Operations & Services),Real Estate,6531,Brazil,Emerging Markets,Latin America & Caribbean
LQwD FinTech Corp. (TSXV:LQWD),TSXV:LQWD,Software (System & Application),Information Technology,1000,Canada,"Australia, NZ and Canada",Canada
LS Cable & System Asia Ltd. (KOSE:A229640),KOSE:A229640,Electrical Equipment,Industrials,3357,South Korea,Emerging Markets,Small Asia
LS Corp. (KOSE:A006260),KOSE:A006260,Electrical Equipment,Industrials,3357,South Korea,Emerging Markets,Small Asia
"LS ELECTRIC Co., Ltd. (KOSE:A010120)",KOSE:A010120,Electrical Equipment,Industrials,3612,South Korea,Emerging Markets,Small Asia
LS Networks Corporation Limited (KOSE:A000680),KOSE:A000680,Retail (Special Lines),Consumer Discretionary,2300,South Korea,Emerging Markets,Small Asia
LS telcom AG (XTRA:LSX),XTRA:LSX,Software (System & Application),Information Technology,7372,Germany,Developed Europe,EU & Environs
"LSB Industries, Inc. (NYSE:LXU)",NYSE:LXU,Chemical (Diversified),Materials,2810,United States,United States,United States
LSI Industries Inc. (NasdaqGS:LYTS),NasdaqGS:LYTS,Electrical Equipment,Industrials,3640,United States,United States,United States
LSI Software S.A. (WSE:LSI),WSE:LSI,Software (System & Application),Information Technology,7372,Poland,Developed Europe,EU & Environs
LSL Property Services plc (LSE:LSL),LSE:LSL,Real Estate (Operations & Services),Real Estate,6531,United Kingdom,Developed Europe,UK
LT Foods Limited (BSE:532783),BSE:532783,Food Processing,Consumer Staples,2040,India,Emerging Markets,India
"LT Group, Inc. (PSE:LTG)",PSE:LTG,Diversified,Industrials,2080,Philippines,Emerging Markets,Small Asia
"LTC Co.,Ltd (KOSDAQ:A170920)",KOSDAQ:A170920,Chemical (Basic),Materials,2800,South Korea,Emerging Markets,Small Asia
"LTC Properties, Inc. (NYSE:LTC)",NYSE:LTC,R.E.I.T.,Real Estate,6798,United States,United States,United States
LTKM Berhad (KLSE:LTKM),KLSE:LTKM,Food Processing,Consumer Staples,200,Malaysia,Emerging Markets,Small Asia
"LTS, Inc. (TSE:6560)",TSE:6560,Business & Consumer Services,Industrials,8742,Japan,Japan,Japan
"Lu Thai Textile Co., Ltd. (SZSE:200726)",SZSE:200726,Apparel,Consumer Discretionary,2200,China,Emerging Markets,China
LU-VE S.p.A. (BIT:LUVE),BIT:LUVE,Building Materials,Industrials,3585,Italy,Developed Europe,EU & Environs
Lub-rref (Bangladesh) Limited (DSE:LRBDL),DSE:LRBDL,Chemical (Basic),Materials,2992,Bangladesh,Emerging Markets,Small Asia
Lubawa S.A. (WSE:LBW),WSE:LBW,Aerospace/Defense,Industrials,3842,Poland,Developed Europe,EU & Environs
Lubelski Wegiel Bogdanka S.A. (WSE:LWB),WSE:LWB,Coal & Related Energy,Energy,1220,Poland,Developed Europe,EU & Environs
"Luby's, Inc. (NYSE:LUB)",NYSE:LUB,Restaurant/Dining,Consumer Discretionary,5812,United States,United States,United States
Lucapa Diamond Company Limited (ASX:LOM),ASX:LOM,Precious Metals,Materials,1400,Australia,"Australia, NZ and Canada",Australia & NZ
Lucara Diamond Corp. (TSX:LUC),TSX:LUC,Precious Metals,Materials,1400,Canada,"Australia, NZ and Canada",Canada
Lucas Bols N.V. (ENXTAM:BOLS),ENXTAM:BOLS,Beverage (Alcoholic),Consumer Staples,2085,Netherlands,Developed Europe,EU & Environs
Luceco plc (LSE:LUCE),LSE:LUCE,Electrical Equipment,Industrials,3640,United Kingdom,Developed Europe,UK
Lucibel SA (ENXTPA:ALUCI),ENXTPA:ALUCI,Electrical Equipment,Industrials,3640,France,Developed Europe,EU & Environs
Lucid Diagnostics Inc. (NasdaqGM:LUCD),NasdaqGM:LUCD,Healthcare Products,Health Care,3845,United States,United States,United States
"Lucid Group, Inc. (NasdaqGS:LCID)",NasdaqGS:LCID,Auto & Truck,Consumer Discretionary,3711,United States,United States,United States
"Lucira Health, Inc. (NasdaqGS:LHDX)",NasdaqGS:LHDX,Healthcare Products,Health Care,3845,United States,United States,United States
Lucisano Media Group S.p.A. (BIT:LMG),BIT:LMG,Entertainment,Communication Services,7812,Italy,Developed Europe,EU & Environs
"LuckLand Co., Ltd. (TSE:9612)",TSE:9612,Business & Consumer Services,Industrials,8700,Japan,Japan,Japan
Lucky Cement Corporation (TWSE:1108),TWSE:1108,Construction Supplies,Materials,3241,Taiwan,Emerging Markets,Small Asia
Lucky Cement Limited (KASE:LUCK),KASE:LUCK,Construction Supplies,Materials,3241,Pakistan,Emerging Markets,Small Asia
"Lucky Film Company,Limited (SHSE:600135)",SHSE:600135,Chemical (Basic),Materials,3861,China,Emerging Markets,China
"Lucky Harvest Co., Ltd. (SZSE:002965)",SZSE:002965,Machinery,Industrials,3540,China,Emerging Markets,China
Lucky Minerals Inc. (TSXV:LKY),TSXV:LKY,Metals & Mining,Materials,1000,Canada,"Australia, NZ and Canada",Canada
Ludan Engineering Co. Ltd. (TASE:LUDN),TASE:LUDN,Engineering/Construction,Industrials,7373,Israel,Emerging Markets,Africa and Middle East
Ludlow Jute & Specialities Limited (BSE:526179),BSE:526179,Apparel,Consumer Discretionary,2200,India,Emerging Markets,India
Luduson G Inc. (OTCPK:LDSN),OTCPK:LDSN,Advertising,Communication Services,7311,Hong Kong,Emerging Markets,China
LUDWIG BECK am Rathauseck - Textilhaus Feldmeier AG (XTRA:ECK),XTRA:ECK,Retail (General),Consumer Discretionary,5311,Germany,Developed Europe,EU & Environs
"Ludwig Enterprises, Inc. (OTCPK:LUDG)",OTCPK:LUDG,Broadcasting,Communication Services,4832,United States,United States,United States
Luen Thai Holdings Limited (SEHK:311),SEHK:311,Apparel,Consumer Discretionary,2300,Hong Kong,Emerging Markets,China
Luen Wong Group Holdings Limited (SEHK:8217),SEHK:8217,Engineering/Construction,Industrials,1600,Hong Kong,Emerging Markets,China
"Luenmei Quantum Co.,Ltd (SHSE:600167)",SHSE:600167,Utility (Water),Utilities,4961,China,Emerging Markets,China
Luff Enterprises Ltd. (CNSX:LUFF),CNSX:LUFF,Drugs (Pharmaceutical),Health Care,2834,Canada,"Australia, NZ and Canada",Canada
LUG S.A. (WSE:LUG),WSE:LUG,Electrical Equipment,Industrials,3640,Poland,Developed Europe,EU & Environs
Luhai Holding Corp. (TWSE:2115),TWSE:2115,Rubber& Tires,Consumer Discretionary,3714,Taiwan,Emerging Markets,Small Asia
Luharuka Media & Infra Limited (BSE:512048),BSE:512048,Financial Svcs. (Non-bank & Insurance),Financials,6153,India,Emerging Markets,India
Luk Fook Holdings (International) Limited (SEHK:590),SEHK:590,Retail (Special Lines),Consumer Discretionary,5944,Hong Kong,Emerging Markets,China
Luk Hing Entertainment Group Holdings Limited (SEHK:8052),SEHK:8052,Restaurant/Dining,Consumer Discretionary,5810,Hong Kong,Emerging Markets,China
Luka Koper d.d. (LJSE:LKPG),LJSE:LKPG,Shipbuilding & Marine,Industrials,4400,Slovenia,Emerging Markets,EU & Environs
Luka Ploce d.d. (ZGSE:LKPC),ZGSE:LKPC,Shipbuilding & Marine,Industrials,4400,Croatia,Emerging Markets,EU & Environs
Luka Rijeka d.d. (ZGSE:LKRI),ZGSE:LKRI,Shipbuilding & Marine,Industrials,4400,Croatia,Emerging Markets,EU & Environs
Lukardi S.A. (WSE:LUK),WSE:LUK,Computer Services,Information Technology,7370,Poland,Developed Europe,EU & Environs
Lukas Biomedical Inc. (TPEX:6814),TPEX:6814,Drugs (Biotechnology),Health Care,2836,Taiwan,Emerging Markets,Small Asia
"LUKEN Technologies Co., Ltd. (XKON:A162120)",XKON:A162120,Semiconductor Equip,Information Technology,3559,South Korea,Emerging Markets,Small Asia
Luks Group (Vietnam Holdings) Company Limited (SEHK:366),SEHK:366,Construction Supplies,Materials,3241,Hong Kong,Emerging Markets,China
Lüks Kadife Ticaret ve Sanayi A.S. (IBSE:LUKSK),IBSE:LUKSK,Apparel,Consumer Discretionary,2200,Turkey,Developed Europe,EU & Environs
"Lulu's Fashion Lounge Holdings, Inc. (NasdaqGM:LVLU)",NasdaqGM:LVLU,Retail (Online),Consumer Discretionary,5960,United States,United States,United States
Lululemon Athletica Inc. (NasdaqGS:LULU),NasdaqGS:LULU,Apparel,Consumer Discretionary,2300,Canada,"Australia, NZ and Canada",Canada
Lum Chang Holdings Limited (SGX:L19),SGX:L19,Engineering/Construction,Industrials,1500,Singapore,Emerging Markets,Small Asia
Lumarine AS (OTCNO:LUMA),OTCNO:LUMA,Food Processing,Consumer Staples,273,Norway,Developed Europe,EU & Environs
Lumax Auto Technologies Limited (NSEI:LUMAXTECH),NSEI:LUMAXTECH,Auto Parts,Consumer Discretionary,3751,India,Emerging Markets,India
Lumax Industries Limited (BSE:517206),BSE:517206,Auto Parts,Consumer Discretionary,3640,India,Emerging Markets,India
"Lumax International Corp., Ltd. (TWSE:6192)",TWSE:6192,Retail (Distributors),Industrials,5065,Taiwan,Emerging Markets,Small Asia
Lumbee Guaranty Bank (OTCPK:LUMB),OTCPK:LUMB,Banks (Regional),Financials,6022,United States,United States,United States
Lumber Depot Limited (JMSE:LUMBER),JMSE:LUMBER,Retail (Distributors),Industrials,5031,Jamaica,Emerging Markets,Latin America & Caribbean
"Lumen Technologies, Inc. (NYSE:LUMN)",NYSE:LUMN,Telecom. Services,Communication Services,4813,United States,United States,United States
"Lumens Co., Ltd. (KOSDAQ:A038060)",KOSDAQ:A038060,Semiconductor,Information Technology,3679,South Korea,Emerging Markets,Small Asia
"Lument Finance Trust, Inc. (NYSE:LFT)",NYSE:LFT,R.E.I.T.,Financials,6798,United States,United States,United States
Lumentum Holdings Inc. (NasdaqGS:LITE),NasdaqGS:LITE,Telecom. Equipment,Information Technology,3576,United States,United States,United States
Lumibird SA (ENXTPA:LBIRD),ENXTPA:LBIRD,Electronics (General),Information Technology,3845,France,Developed Europe,EU & Environs
Lumiera Health Inc. (TSXV:NHP),TSXV:NHP,Drugs (Pharmaceutical),Health Care,2833,Canada,"Australia, NZ and Canada",Canada
Lumina Gold Corp. (TSXV:LUM),TSXV:LUM,Precious Metals,Materials,1040,Canada,"Australia, NZ and Canada",Canada
Lumina Group Limited (SEHK:1162),SEHK:1162,Business & Consumer Services,Industrials,1700,Hong Kong,Emerging Markets,China
"Luminar Media Group, Inc. (OTCPK:LRGR)",OTCPK:LRGR,Entertainment,Communication Services,7929,Canada,"Australia, NZ and Canada",Canada
"Luminar Technologies, Inc. (NasdaqGS:LAZR)",NasdaqGS:LAZR,Auto Parts,Consumer Discretionary,3714,United States,United States,United States
Luminescence Technology Corp. (TPEX:6729),TPEX:6729,Chemical (Specialty),Materials,2860,Taiwan,Emerging Markets,Small Asia
Luminex Resources Corp. (TSXV:LR),TSXV:LR,Metals & Mining,Materials,1000,Canada,"Australia, NZ and Canada",Canada
Luminor Financial Holdings Limited (Catalist:5UA),Catalist:5UA,Real Estate (Development),Real Estate,6552,Singapore,Emerging Markets,Small Asia
LumiraDx Limited (NasdaqGM:LMDX),NasdaqGM:LMDX,Healthcare Products,Health Care,3845,United Kingdom,Developed Europe,UK
Lumito AB (publ) (NGM:LUMITO),NGM:LUMITO,Healthcare Products,Health Care,3845,Sweden,Developed Europe,EU & Environs
Lumos Diagnostics Holdings Limited (ASX:LDX),ASX:LDX,Healthcare Products,Health Care,3829,Australia,"Australia, NZ and Canada",Australia & NZ
"Lumos Pharma, Inc. (NasdaqGM:LUMO)",NasdaqGM:LUMO,Drugs (Biotechnology),Health Care,2836,United States,United States,United States
"Lumosa Therapeutics Co., Ltd. (TPEX:6535)",TPEX:6535,Drugs (Pharmaceutical),Health Care,2836,Taiwan,Emerging Markets,Small Asia
Luna Innovations Incorporated (NasdaqCM:LUNA),NasdaqCM:LUNA,Electronics (General),Information Technology,3827,United States,United States,United States
Lundin Energy AB (publ) (OM:LUNE),OM:LUNE,Oil/Gas (Production and Exploration),Energy,1311,Sweden,Developed Europe,EU & Environs
Lundin Gold Inc. (TSX:LUG),TSX:LUG,Precious Metals,Materials,1040,Canada,"Australia, NZ and Canada",Canada
Lundin Mining Corporation (TSX:LUN),TSX:LUN,Metals & Mining,Materials,1000,Canada,"Australia, NZ and Canada",Canada
"Lung Hwa Electronics Co., Ltd. (TWSE:2424)",TWSE:2424,Electronics (Consumer & Office),Consumer Discretionary,3651,Taiwan,Emerging Markets,Small Asia
Lung Kee (Bermuda) Holdings Limited (SEHK:255),SEHK:255,Machinery,Industrials,3540,Hong Kong,Emerging Markets,China
"Lung Pien Vacuum Industry Co., Ltd. (TPEX:5267)",TPEX:5267,Machinery,Industrials,3559,Taiwan,Emerging Markets,Small Asia
"LungLife AI, Inc. (AIM:LLAI)",AIM:LLAI,Drugs (Biotechnology),Health Care,8731,United States,United States,United States
"Lungteh Shipbuilding Co., Ltd. (TPEX:6753)",TPEX:6753,Construction Supplies,Industrials,3730,Taiwan,Emerging Markets,Small Asia
Lungyen Life Service Corporation (TPEX:5530),TPEX:5530,Business & Consumer Services,Consumer Discretionary,7200,Taiwan,Emerging Markets,Small Asia
Lunnon Metals Limited (ASX:LM8),ASX:LM8,Metals & Mining,Materials,1000,Australia,"Australia, NZ and Canada",Australia & NZ
"Luo Lih-Fen Holding Co., Ltd. (TWSE:6666)",TWSE:6666,Household Products,Consumer Staples,2844,Cayman Islands,Emerging Markets,Latin America & Caribbean
Luokung Technology Corp. (NasdaqCM:LKCO),NasdaqCM:LKCO,Software (Entertainment),Communication Services,7370,China,Emerging Markets,China
"Luolai Lifestyle Technology Co., Ltd. (SZSE:002293)",SZSE:002293,Apparel,Consumer Discretionary,2300,China,Emerging Markets,China
Luong Tai Construction Joint Stock Company (HNX:LUT),HNX:LUT,Engineering/Construction,Industrials,1600,Vietnam,Emerging Markets,Small Asia
"Luoniushan Co., Ltd. (SZSE:000735)",SZSE:000735,Food Processing,Consumer Staples,200,China,Emerging Markets,China
"Luoxin Pharmaceuticals Group Stock Co., Ltd. (SZSE:002793)",SZSE:002793,Drugs (Pharmaceutical),Health Care,2834,China,Emerging Markets,China
Luoyang Glass Company Limited (SEHK:1108),SEHK:1108,Building Materials,Industrials,3211,China,Emerging Markets,China
"Luoyang Jianlong Micro-nano New Material Co., Ltd (SHSE:688357)",SHSE:688357,Chemical (Specialty),Materials,2800,China,Emerging Markets,China
"Luoyang Northglass Technology Co.,Ltd (SZSE:002613)",SZSE:002613,Machinery,Industrials,3559,China,Emerging Markets,China
"Luoyang Xinqianglian Slewing Bearing Co., Ltd. (SZSE:300850)",SZSE:300850,Machinery,Industrials,3562,China,Emerging Markets,China
Lupaka Gold Corp. (TSXV:LPK),TSXV:LPK,Precious Metals,Materials,1040,Canada,"Australia, NZ and Canada",Canada
Lupatech S.A. (BOVESPA:LUPA3),BOVESPA:LUPA3,Oilfield Svcs/Equip.,Energy,3533,Brazil,Emerging Markets,Latin America & Caribbean
Lupin Limited (BSE:500257),BSE:500257,Drugs (Pharmaceutical),Health Care,2834,India,Emerging Markets,India
