Company Name,Exchange:Ticker,Industry Group,Primary Sector,SIC Code,Country,Broad Group,Sub Group
Malu Paper Mills Limited (BSE:532728),BSE:532728,Paper/Forest Products,Materials,2621,India,Emerging Markets,India
"Malvern Bancorp, Inc. (NasdaqGM:MLVF)",NasdaqGM:MLVF,Banks (Regional),Financials,6020,United States,United States,United States
Malvern International Plc (AIM:MLVN),AIM:MLVN,Education,Consumer Discretionary,8200,United Kingdom,Developed Europe,UK
Malwatte Valley Plantations PLC (COSE:MAL.N0000),COSE:MAL.N0000,Food Processing,Consumer Staples,2090,Sri Lanka,Emerging Markets,Small Asia
"MamaMancini's Holdings, Inc. (NasdaqCM:MMMB)",NasdaqCM:MMMB,Food Processing,Consumer Staples,2030,United States,United States,United States
Maman-Cargo Terminals & Handling Ltd. (TASE:MMAN),TASE:MMAN,Transportation,Industrials,4731,Israel,Emerging Markets,Africa and Middle East
Mamba Exploration Limited (ASX:M24),ASX:M24,Metals & Mining,Materials,1000,Australia,"Australia, NZ and Canada",Australia & NZ
"Mamiya-OP Co., Ltd. (TSE:7991)",TSE:7991,Recreation,Consumer Discretionary,3679,Japan,Japan,Japan
"Mammoth Energy Services, Inc. (NasdaqGS:TUSK)",NasdaqGS:TUSK,Oilfield Svcs/Equip.,Energy,1389,United States,United States,United States
Mammoth Resources Corp. (TSXV:MTH),TSXV:MTH,Metals & Mining,Materials,1041,Canada,"Australia, NZ and Canada",Canada
Mammy Mart Corporation (JASDAQ:9823),JASDAQ:9823,Retail (Grocery and Food),Consumer Staples,5411,Japan,Japan,Japan
Man Group plc (LSE:EMG),LSE:EMG,Investments & Asset Management,Financials,6282,Jersey,Developed Europe,EU & Environs
Man Industries (India) Limited (BSE:513269),BSE:513269,Engineering/Construction,Industrials,3490,India,Emerging Markets,India
Man Infraconstruction Limited (BSE:533169),BSE:533169,Engineering/Construction,Industrials,1600,India,Emerging Markets,India
Man King Holdings Limited (SEHK:2193),SEHK:2193,Engineering/Construction,Industrials,1540,Hong Kong,Emerging Markets,China
Man Sang International Limited (SEHK:938),SEHK:938,Real Estate (Development),Real Estate,3911,Hong Kong,Emerging Markets,China
Man Shing Global Holdings Limited (SEHK:8309),SEHK:8309,Environmental & Waste Services,Industrials,4950,Hong Kong,Emerging Markets,China
Man Shun Group (Holdings) Limited (SEHK:1746),SEHK:1746,Engineering/Construction,Industrials,1731,Hong Kong,Emerging Markets,China
Man Wah Holdings Limited (SEHK:1999),SEHK:1999,Furn/Home Furnishings,Consumer Discretionary,2510,Hong Kong,Emerging Markets,China
Man Yue Technology Holdings Limited (SEHK:894),SEHK:894,Electronics (General),Information Technology,3600,Hong Kong,Emerging Markets,China
"Man Zai Industrial Co.,LTD. (TPEX:4543)",TPEX:4543,Auto Parts,Consumer Discretionary,3714,Taiwan,Emerging Markets,Small Asia
"MANAC Chemical Partners Co.,Ltd. (TSE:4360)",TSE:4360,Chemical (Specialty),Materials,3715,Japan,Japan,Japan
Managem S.A. (CBSE:MNG),CBSE:MNG,Metals & Mining,Materials,1000,Morocco,Emerging Markets,Africa and Middle East
"Management Solutions co.,Ltd. (TSE:7033)",TSE:7033,Business & Consumer Services,Industrials,8742,Japan,Japan,Japan
ManagePay Systems Berhad (KLSE:MPAY),KLSE:MPAY,Computer Services,Information Technology,7373,Malaysia,Emerging Markets,Small Asia
Manaksia Aluminium Company Limited (BSE:539045),BSE:539045,Metals & Mining,Materials,3350,India,Emerging Markets,India
Manaksia Coated Metals & Industries Limited (BSE:539046),BSE:539046,Metals & Mining,Materials,3399,India,Emerging Markets,India
Manaksia Limited (BSE:532932),BSE:532932,Metals & Mining,Materials,3490,India,Emerging Markets,India
Manaksia Steels Limited (BSE:539044),BSE:539044,Steel,Materials,3310,India,Emerging Markets,India
Manali Petrochemicals Limited (BSE:500268),BSE:500268,Chemical (Specialty),Materials,2911,India,Emerging Markets,India
Manappuram Finance Limited (BSE:531213),BSE:531213,Financial Svcs. (Non-bank & Insurance),Financials,6141,India,Emerging Markets,India
Manas Enerji Yonetimi Sanayi Ve Ticaret Anonim Sirketi (IBSE:MANAS),IBSE:MANAS,Electronics (General),Information Technology,3824,Turkey,Developed Europe,EU & Environs
Manas Properties Limited (BSE:540402),BSE:540402,Real Estate (Operations & Services),Real Estate,6500,India,Emerging Markets,India
Manav Infra Projects Limited (NSEI:MANAV),NSEI:MANAV,Engineering/Construction,Industrials,1611,India,Emerging Markets,India
Manazel Holding Company K.P.S.C. (KWSE:MANAZEL),KWSE:MANAZEL,Real Estate (Development),Real Estate,6500,Kuwait,Emerging Markets,Africa and Middle East
Manazel PJSC (ADX:MANAZEL),ADX:MANAZEL,Real Estate (Development),Real Estate,6500,United Arab Emirates,Emerging Markets,Africa and Middle East
Manchester United plc (NYSE:MANU),NYSE:MANU,Entertainment,Communication Services,7900,United Kingdom,Developed Europe,UK
Mandalay Resources Corporation (TSX:MND),TSX:MND,Precious Metals,Materials,1000,Canada,"Australia, NZ and Canada",Canada
Mandarake Inc. (TSE:2652),TSE:2652,Retail (Special Lines),Consumer Discretionary,5900,Japan,Japan,Japan
Mandarin Hotel Public Company Limited (SET:MANRIN),SET:MANRIN,Hotel/Gaming,Consumer Discretionary,7011,Thailand,Emerging Markets,Small Asia
Mandarin Oriental International Limited (SGX:M04),SGX:M04,Hotel/Gaming,Consumer Discretionary,7011,Hong Kong,Emerging Markets,China
"Mandiant, Inc. (NasdaqGS:MNDT)",NasdaqGS:MNDT,Software (System & Application),Information Technology,7373,United States,United States,United States
Mando Corporation (KOSE:A204320),KOSE:A204320,Auto Parts,Consumer Discretionary,3714,South Korea,Emerging Markets,Small Asia
Mandom Corporation (TSE:4917),TSE:4917,Household Products,Consumer Staples,2844,Japan,Japan,Japan
Mandrake Resources Limited (ASX:MAN),ASX:MAN,Precious Metals,Materials,3460,Australia,"Australia, NZ and Canada",Australia & NZ
Mangal Credit & Fincorp Ltd. (BSE:505850),BSE:505850,Financial Svcs. (Non-bank & Insurance),Financials,6211,India,Emerging Markets,India
Mangalam Cement Limited (BSE:502157),BSE:502157,Construction Supplies,Materials,3241,India,Emerging Markets,India
Mangalam Drugs & Organics Limited (BSE:532637),BSE:532637,Drugs (Pharmaceutical),Health Care,2834,India,Emerging Markets,India
Mangalam Global Enterprise Limited (NSEI:MGEL),NSEI:MGEL,Farming/Agriculture,Consumer Staples,2070,India,Emerging Markets,India
Mangalam Industrial Finance Limited (BSE:537800),BSE:537800,Financial Svcs. (Non-bank & Insurance),Financials,6100,India,Emerging Markets,India
Mangalam Organics Limited (BSE:514418),BSE:514418,Chemical (Basic),Materials,2800,India,Emerging Markets,India
Mangalam Seeds Limited (BSE:539275),BSE:539275,Farming/Agriculture,Consumer Staples,100,India,Emerging Markets,India
Mangalam Timber Products Limited (BSE:516007),BSE:516007,Paper/Forest Products,Materials,2400,India,Emerging Markets,India
Mangalore Chemicals & Fertilizers Limited (BSE:530011),BSE:530011,Chemical (Specialty),Materials,2870,India,Emerging Markets,India
Mangalore Refinery and Petrochemicals Limited (BSE:500109),BSE:500109,Oilfield Svcs/Equip.,Energy,2911,India,Emerging Markets,India
Manganese X Energy Corp. (TSXV:MN),TSXV:MN,Metals & Mining,Materials,1044,Canada,"Australia, NZ and Canada",Canada
Mangata Holding S.A. (WSE:MGT),WSE:MGT,Machinery,Industrials,3490,Poland,Developed Europe,EU & Environs
Mangazeya Mining Ltd. (TSXV:MGZ.H),TSXV:MGZ.H,Precious Metals,Materials,1040,British Virgin Islands,Emerging Markets,Latin America & Caribbean
"Mango Excellent Media Co., Ltd. (SZSE:300413)",SZSE:300413,Entertainment,Communication Services,5960,China,Emerging Markets,China
Mangold Fondkommission AB (OM:MANG),OM:MANG,Brokerage & Investment Banking,Financials,6200,Sweden,Developed Europe,EU & Environs
"Manhattan Associates, Inc. (NasdaqGS:MANH)",NasdaqGS:MANH,Software (System & Application),Information Technology,7373,United States,United States,United States
"Manhattan Bridge Capital, Inc. (NasdaqCM:LOAN)",NasdaqCM:LOAN,R.E.I.T.,Financials,6798,United States,United States,United States
Manhattan Corporation Limited (ASX:MHC),ASX:MHC,Precious Metals,Materials,1090,Australia,"Australia, NZ and Canada",Australia & NZ
Manhattan Resources Limited (SGX:L02),SGX:L02,Shipbuilding & Marine,Industrials,4400,Singapore,Emerging Markets,Small Asia
"Manhattan Scientifics, Inc. (OTCPK:MHTX)",OTCPK:MHTX,Drugs (Biotechnology),Health Care,8731,United States,United States,United States
"Manho Rope & Wire Co., Ltd. (KOSE:A001080)",KOSE:A001080,Steel,Materials,3490,South Korea,Emerging Markets,Small Asia
"Mani, Inc. (TSE:7730)",TSE:7730,Healthcare Products,Health Care,3841,Japan,Japan,Japan
ManifestSeven Holdings Corporation (CNSX:MSVN),CNSX:MSVN,Retail (Special Lines),Consumer Staples,5912,United States,United States,United States
"Maniker F&G Co., Ltd. (KOSDAQ:A195500)",KOSDAQ:A195500,Food Processing,Consumer Staples,2000,South Korea,Emerging Markets,Small Asia
"Maniker.Co.,Ltd (KOSE:A027740)",KOSE:A027740,Food Processing,Consumer Staples,2015,South Korea,Emerging Markets,Small Asia
Manila Broadcasting Company (PSE:MBC),PSE:MBC,Broadcasting,Communication Services,4832,Philippines,Emerging Markets,Small Asia
Manila Bulletin Publishing Corporation (PSE:MB),PSE:MB,Publishing & Newspapers,Communication Services,2711,Philippines,Emerging Markets,Small Asia
Manila Electric Company (PSE:MER),PSE:MER,Power,Utilities,4911,Philippines,Emerging Markets,Small Asia
"Manila Jockey Club, Inc. (PSE:MJC)",PSE:MJC,Hotel/Gaming,Consumer Discretionary,7948,Philippines,Emerging Markets,Small Asia
Manila Mining Corporation (PSE:MA),PSE:MA,Precious Metals,Materials,1040,Philippines,Emerging Markets,Small Asia
"Manila Water Company, Inc. (PSE:MWC)",PSE:MWC,Utility (Water),Utilities,4941,Philippines,Emerging Markets,Small Asia
Manipal Finance Corporation Limited (BSE:507938),BSE:507938,Financial Svcs. (Non-bank & Insurance),Financials,6141,India,Emerging Markets,India
"Manitex International, Inc. (NasdaqCM:MNTX)",NasdaqCM:MNTX,Construction Supplies,Industrials,3537,United States,United States,United States
Manitou BF SA (ENXTPA:MTU),ENXTPA:MTU,Construction Supplies,Industrials,3530,France,Developed Europe,EU & Environs
Manitou Gold Inc. (TSXV:MTU),TSXV:MTU,Precious Metals,Materials,1040,Canada,"Australia, NZ and Canada",Canada
Manjeera Constructions Limited (BSE:533078),BSE:533078,Real Estate (Development),Real Estate,1500,India,Emerging Markets,India
Mannai Corporation Q.P.S.C. (DSM:MCCS),DSM:MCCS,Diversified,Industrials,9997,Qatar,Emerging Markets,Africa and Middle East
"Mannatech, Incorporated (NasdaqGS:MTEX)",NasdaqGS:MTEX,Household Products,Consumer Staples,2834,United States,United States,United States
"Manning & Napier, Inc. (NYSE:MN)",NYSE:MN,Investments & Asset Management,Financials,6282,United States,United States,United States
Manning Ventures Inc. (CNSX:MANN),CNSX:MANN,Metals & Mining,Materials,1000,Canada,"Australia, NZ and Canada",Canada
MannKind Corporation (NasdaqGM:MNKD),NasdaqGM:MNKD,Drugs (Biotechnology),Health Care,2836,United States,United States,United States
Manolete Partners Plc (AIM:MANO),AIM:MANO,Investments & Asset Management,Financials,6799,United Kingdom,Developed Europe,UK
Manor Estates and Industries Limited (BSE:526115),BSE:526115,Apparel,Consumer Discretionary,2252,India,Emerging Markets,India
Manorama Industries Limited (BSE:541974),BSE:541974,Food Processing,Consumer Staples,2070,India,Emerging Markets,India
ManpowerGroup Greater China Limited (SEHK:2180),SEHK:2180,Business & Consumer Services,Industrials,7361,China,Emerging Markets,China
ManpowerGroup Inc. (NYSE:MAN),NYSE:MAN,Business & Consumer Services,Industrials,7363,United States,United States,United States
Mansei Corporation (TSE:7565),TSE:7565,Electrical Equipment,Industrials,5000,Japan,Japan,Japan
Mansfelder Metals Ltd. (OTCPK:MNSF),OTCPK:MNSF,Metals & Mining,Materials,3350,Hong Kong,Emerging Markets,China
Mansi Finance (Chennai) Limited (BSE:511758),BSE:511758,Financial Svcs. (Non-bank & Insurance),Financials,6159,India,Emerging Markets,India
Mansion International Holdings Limited,,Apparel,Consumer Discretionary,2300,Hong Kong,Emerging Markets,China
Mansoura Poultry co.S.A.E (CASE:MPCO),CASE:MPCO,Farming/Agriculture,Consumer Staples,2000,Egypt,Emerging Markets,Africa and Middle East
Mantaro Precious Metals Corp. (TSXV:MNTR),TSXV:MNTR,Precious Metals,Materials,1040,Canada,"Australia, NZ and Canada",Canada
ManTech International Corporation (NasdaqGS:MANT),NasdaqGS:MANT,Business & Consumer Services,Industrials,7373,United States,United States,United States
Mantex AB (publ) (OM:MANTEX),OM:MANTEX,Electronics (General),Information Technology,3812,Sweden,Developed Europe,EU & Environs
Manufacture De Panneaux Bois Du Sud (BVMT:MPBS),BVMT:MPBS,Paper/Forest Products,Materials,2400,Tunisia,Emerging Markets,Africa and Middle East
Manufacturing Integration Technology Ltd (SGX:M11),SGX:M11,Electronics (General),Information Technology,3559,Singapore,Emerging Markets,Small Asia
Manugraph India Limited (BSE:505324),BSE:505324,Machinery,Industrials,3555,India,Emerging Markets,India
Manuka Resources Limited (ASX:MKR),ASX:MKR,Precious Metals,Materials,1040,Australia,"Australia, NZ and Canada",Australia & NZ
Manulife Financial Corporation (TSX:MFC),TSX:MFC,Insurance (Life),Financials,6311,Canada,"Australia, NZ and Canada",Canada
Manulife Holdings Berhad (KLSE:MANULFE),KLSE:MANULFE,Insurance (Life),Financials,6311,Malaysia,Emerging Markets,Small Asia
Manulife US Real Estate Investment Trust (SGX:BTOU),SGX:BTOU,R.E.I.T.,Real Estate,6798,Singapore,Emerging Markets,Small Asia
Manutan International S.A. (ENXTPA:MAN),ENXTPA:MAN,Retail (Online),Consumer Discretionary,5961,France,Developed Europe,EU & Environs
Manx Financial Group PLC (AIM:MFX),AIM:MFX,Financial Svcs. (Non-bank & Insurance),Financials,6141,Isle of Man,Developed Europe,EU & Environs
ManyDev Studio SE (WSE:MAN),WSE:MAN,Entertainment,Communication Services,7372,Poland,Developed Europe,EU & Environs
Manz AG (XTRA:M5Z),XTRA:M5Z,Semiconductor Equip,Information Technology,3559,Germany,Developed Europe,EU & Environs
"Manzo Pharmaceuticals, Inc. (OTCPK:MNZO)",OTCPK:MNZO,Drugs (Pharmaceutical),Health Care,1311,United States,United States,United States
Mao Bao Inc. (TWSE:1732),TWSE:1732,Household Products,Consumer Staples,2840,Taiwan,Emerging Markets,Small Asia
"Maoming Petro-Chemical Shihua Co., Ltd (SZSE:000637)",SZSE:000637,Chemical (Basic),Materials,2860,China,Emerging Markets,China
Maoyan Entertainment (SEHK:1896),SEHK:1896,Retail (Online),Consumer Discretionary,7370,China,Emerging Markets,China
"Maoye Commercial Co., Ltd. (SHSE:600828)",SHSE:600828,Retail (General),Consumer Discretionary,5331,China,Emerging Markets,China
Maoye International Holdings Limited (SEHK:848),SEHK:848,Retail (General),Consumer Discretionary,5311,China,Emerging Markets,China
MAPFRE Middlesea p.l.c. (MTSE:MMS),MTSE:MMS,Insurance (General),Financials,6331,Malta,Developed Europe,EU & Environs
"Mapfre, S.A. (BME:MAP)",BME:MAP,Insurance (General),Financials,6331,Spain,Developed Europe,EU & Environs
Maple Gold Mines Ltd. (TSXV:MGM),TSXV:MGM,Precious Metals,Materials,1040,Canada,"Australia, NZ and Canada",Canada
Maple Leaf Cement Factory Limited (KASE:MLCF),KASE:MLCF,Construction Supplies,Materials,3241,Pakistan,Emerging Markets,Small Asia
Maple Leaf Foods Inc. (TSX:MFI),TSX:MFI,Food Processing,Consumer Staples,2000,Canada,"Australia, NZ and Canada",Canada
Maple Leaf Green World Inc. (OTCPK:MGWF.F),OTCPK:MGWF.F,Drugs (Pharmaceutical),Health Care,2834,Canada,"Australia, NZ and Canada",Canada
Maple Peak Investments Inc. (TSXV:MAP),TSXV:MAP,Hotel/Gaming,Consumer Discretionary,7999,Canada,"Australia, NZ and Canada",Canada
Mapletree Commercial Trust (SGX:N2IU),SGX:N2IU,R.E.I.T.,Real Estate,6798,Singapore,Emerging Markets,Small Asia
Mapletree Industrial Trust (SGX:ME8U),SGX:ME8U,R.E.I.T.,Real Estate,6798,Singapore,Emerging Markets,Small Asia
Mapletree Logistics Trust (SGX:M44U),SGX:M44U,R.E.I.T.,Real Estate,6798,Singapore,Emerging Markets,Small Asia
Mapletree North Asia Commercial Trust (SGX:RW0U),SGX:RW0U,R.E.I.T.,Real Estate,6798,Singapore,Emerging Markets,Small Asia
Maps S.p.A. (BIT:MAPS),BIT:MAPS,Software (System & Application),Information Technology,7372,Italy,Developed Europe,EU & Environs
Mapspeople A/S (CPSE:MAPS),CPSE:MAPS,Software (System & Application),Information Technology,7372,Denmark,Developed Europe,EU & Environs
"Maptelligent, Inc. (OTCPK:MAPT)",OTCPK:MAPT,Software (System & Application),Information Technology,7372,United States,United States,United States
Maquia Capital Acquisition Corporation (NasdaqCM:MAQC),NasdaqCM:MAQC,Investments & Asset Management,Financials,9995,United States,United States,United States
Maral Overseas Limited (BSE:521018),BSE:521018,Apparel,Consumer Discretionary,2200,India,Emerging Markets,India
Maraska d.d. (ZGSE:MRSK),ZGSE:MRSK,Beverage (Alcoholic),Consumer Staples,2080,Croatia,Emerging Markets,EU & Environs
"Marathon Bancorp, Inc. (OTCPK:MBBC)",OTCPK:MBBC,Financial Svcs. (Non-bank & Insurance),Financials,6035,United States,United States,United States
"Marathon Digital Holdings, Inc. (NasdaqCM:MARA)",NasdaqCM:MARA,Software (System & Application),Information Technology,7372,United States,United States,United States
Marathon Gold Corporation (TSX:MOZ),TSX:MOZ,Precious Metals,Materials,1000,Canada,"Australia, NZ and Canada",Canada
Marathon Nextgen Realty Limited (BSE:503101),BSE:503101,Real Estate (Development),Real Estate,6552,India,Emerging Markets,India
Marathon Oil Corporation (NYSE:MRO),NYSE:MRO,Oil/Gas (Production and Exploration),Energy,1311,United States,United States,United States
Marathon Petroleum Corporation (NYSE:MPC),NYSE:MPC,Oilfield Svcs/Equip.,Energy,2911,United States,United States,United States
"Maravai LifeSciences Holdings, Inc. (NasdaqGS:MRVI)",NasdaqGS:MRVI,Heathcare Information and Technology,Health Care,8731,United States,United States,United States
Marawila Resorts PLC (COSE:MARA.N0000),COSE:MARA.N0000,Hotel/Gaming,Consumer Discretionary,7011,Sri Lanka,Emerging Markets,Small Asia
Marble Financial Inc. (CNSX:MRBL),CNSX:MRBL,Financial Svcs. (Non-bank & Insurance),Financials,6141,Canada,"Australia, NZ and Canada",Canada
Marblegate Acquisition Corp. (NasdaqGM:GATE),NasdaqGM:GATE,Investments & Asset Management,Financials,9995,United States,United States,United States
Marche Corporation (TSE:7524),TSE:7524,Restaurant/Dining,Consumer Discretionary,5812,Japan,Japan,Japan
"Marchex, Inc. (NasdaqGS:MCHX)",NasdaqGS:MCHX,Advertising,Communication Services,7389,United States,United States,United States
Marco Holdings Berhad (KLSE:MARCO),KLSE:MARCO,Retail (Distributors),Consumer Discretionary,5065,Malaysia,Emerging Markets,Small Asia
Marco Polo Marine Ltd. (SGX:5LY),SGX:5LY,Shipbuilding & Marine,Industrials,3730,Singapore,Emerging Markets,Small Asia
"Marcus & Millichap, Inc. (NYSE:MMI)",NYSE:MMI,Real Estate (Operations & Services),Real Estate,6531,United States,United States,United States
"Marcus & Millichap, Inc. (NYSE:MMI)",NYSE:MMI,Real Estate (Operations & Services),Real Estate,6531,United States,United States,United States
"Marcventures Holdings, Inc. (PSE:MARC)",PSE:MARC,Metals & Mining,Materials,1000,Philippines,Emerging Markets,Small Asia
Mare Nostrum Société anonyme (ENXTPA:ALMAR),ENXTPA:ALMAR,Business & Consumer Services,Industrials,7363,France,Developed Europe,EU & Environs
Marechale Capital Plc (AIM:MAC),AIM:MAC,Brokerage & Investment Banking,Financials,6211,United Kingdom,Developed Europe,UK
Marel hf. (ICSE:MAREL),ICSE:MAREL,Machinery,Industrials,3550,Iceland,Developed Europe,Eastern Europe & Russia
Marfin Investment Group Holdings S.A. (ATSE:MIG),ATSE:MIG,Diversified,Financials,6799,Greece,Developed Europe,EU & Environs
Marfrig Global Foods S.A. (BOVESPA:MRFG3),BOVESPA:MRFG3,Food Processing,Consumer Staples,2011,Brazil,Emerging Markets,Latin America & Caribbean
Marg Techno-Projects Limited (BSE:540254),BSE:540254,Financial Svcs. (Non-bank & Insurance),Financials,6100,India,Emerging Markets,India
Margaret Lake Diamonds Inc. (TSXV:DIA),TSXV:DIA,Metals & Mining,Materials,1000,Canada,"Australia, NZ and Canada",Canada
Margaritaville (Turks) Ltd (JMSE:MTL),JMSE:MTL,Restaurant/Dining,Consumer Discretionary,5810,Turks & Caicos Islands,Emerging Markets,Latin America & Caribbean
Margo Caribe Inc. (OTCPK:MRGO),OTCPK:MRGO,Farming/Agriculture,Consumer Staples,100,United States,United States,United States
Margo Finance Limited (BSE:500206),BSE:500206,Financial Svcs. (Non-bank & Insurance),Financials,6159,India,Emerging Markets,India
Margün Enerji Üretim Sanayi ve Ticaret Anonim Sirketi (IBSE:MAGEN),IBSE:MAGEN,Green & Renewable Energy,Utilities,4911,Turkey,Developed Europe,EU & Environs
Mari Petroleum Company Limited (KASE:MARI),KASE:MARI,Oil/Gas (Production and Exploration),Energy,1311,Pakistan,Emerging Markets,Small Asia
Marico Bangladesh Limited (DSE:MARICO),DSE:MARICO,Household Products,Consumer Staples,2840,Bangladesh,Emerging Markets,Small Asia
Marico Limited (BSE:531642),BSE:531642,Household Products,Consumer Staples,2844,India,Emerging Markets,India
Maridive and Oil Services S.A.E. (CASE:MOIL),CASE:MOIL,Oilfield Svcs/Equip.,Energy,1382,Egypt,Emerging Markets,Africa and Middle East
Marie Brizard Wine & Spirits SA (ENXTPA:MBWS),ENXTPA:MBWS,Beverage (Alcoholic),Consumer Staples,2085,France,Developed Europe,EU & Environs
"Marijuana Company of America, Inc. (OTCPK:MCOA)",OTCPK:MCOA,Drugs (Pharmaceutical),Health Care,7370,United States,United States,United States
"Marijuana Strategic Ventures, Inc. (OTCPK:MSVI)",OTCPK:MSVI,Drugs (Pharmaceutical),Health Care,2834,United States,United States,United States
Marimaca Copper Corp. (TSX:MARI),TSX:MARI,Metals & Mining,Materials,1000,Chile,Emerging Markets,Latin America & Caribbean
MariMed Inc. (OTCPK:MRMD),OTCPK:MRMD,Drugs (Pharmaceutical),Health Care,2834,United States,United States,United States
Marimekko Oyj (HLSE:MEKKO),HLSE:MEKKO,Apparel,Consumer Discretionary,2300,Finland,Developed Europe,EU & Environs
"Marimo Regional Revitalization REIT, Inc. (TSE:3470)",TSE:3470,R.E.I.T.,Real Estate,6798,Japan,Japan,Japan
Marin Software Incorporated (NasdaqGM:MRIN),NasdaqGM:MRIN,Software (System & Application),Information Technology,7370,United States,United States,United States
Marine & General Berhad (KLSE:M&G),KLSE:M&G,Oilfield Svcs/Equip.,Energy,1600,Malaysia,Emerging Markets,Small Asia
"Marine Bancorp of Florida, Inc. (OTCPK:MBOF)",OTCPK:MBOF,Banks (Regional),Financials,6022,United States,United States,United States
Marine Electricals (India) Limited (NSEI:MARINE),NSEI:MARINE,Electrical Equipment,Industrials,3600,India,Emerging Markets,India
Marine Petroleum Trust (NasdaqCM:MARP.S),NasdaqCM:MARP.S,Oil/Gas (Production and Exploration),Energy,6792,United States,United States,United States
Marine Products Corporation (NYSE:MPX),NYSE:MPX,Recreation,Consumer Discretionary,3730,United States,United States,United States
Marine Supply and Engineering Service Joint Stock Company (HNX:MAC),HNX:MAC,Shipbuilding & Marine,Industrials,3730,Vietnam,Emerging Markets,Small Asia
"MarineMax, Inc. (NYSE:HZO)",NYSE:HZO,Retail (Special Lines),Consumer Discretionary,5500,United States,United States,United States
Mariner Corporation Limited (ASX:MCX),ASX:MCX,Investments & Asset Management,Financials,6200,Australia,"Australia, NZ and Canada",Australia & NZ
Marinomed Biotech AG (WBAG:MARI),WBAG:MARI,Drugs (Pharmaceutical),Health Care,2834,Austria,Developed Europe,EU & Environs
"Marinus Pharmaceuticals, Inc. (NasdaqGM:MRNS)",NasdaqGM:MRNS,Drugs (Pharmaceutical),Health Care,2836,United States,United States,United States
Maris Spinners Limited (BSE:531503),BSE:531503,Apparel,Consumer Discretionary,2200,India,Emerging Markets,India
Marisa Lojas S.A. (BOVESPA:AMAR3),BOVESPA:AMAR3,Retail (General),Consumer Discretionary,5311,Brazil,Emerging Markets,Latin America & Caribbean
Marítima de Inversiones S.A. (SNSE:MARINSA),SNSE:MARINSA,Diversified,Financials,4412,Chile,Emerging Markets,Latin America & Caribbean
Maritime & Merchant Bank ASA (OTCNO:MMBANK),OTCNO:MMBANK,Banks (Regional),Financials,6020,Norway,Developed Europe,EU & Environs
Maritime Resources Corp. (TSXV:MAE),TSXV:MAE,Precious Metals,Materials,1040,Canada,"Australia, NZ and Canada",Canada
"Marizyme, Inc. (OTCPK:MRZM)",OTCPK:MRZM,Drugs (Biotechnology),Health Care,2836,United States,United States,United States
Marka S.A. (WSE:MRK),WSE:MRK,Financial Svcs. (Non-bank & Insurance),Financials,6141,Poland,Developed Europe,EU & Environs
Marka Yatirim Holding A.S. (IBSE:MARKA),IBSE:MARKA,Investments & Asset Management,Financials,6726,Turkey,Developed Europe,EU & Environs
Markel Corporation (NYSE:MKL),NYSE:MKL,Insurance (Prop/Cas.),Financials,6331,United States,United States,United States
"Marker Therapeutics, Inc. (NasdaqGM:MRKR)",NasdaqGM:MRKR,Drugs (Biotechnology),Health Care,2836,United States,United States,United States
Market Creators Limited (BSE:526891),BSE:526891,Brokerage & Investment Banking,Financials,6211,India,Emerging Markets,India
MarketAxess Holdings Inc. (NasdaqGS:MKTX),NasdaqGS:MKTX,Financial Svcs. (Non-bank & Insurance),Financials,6200,United States,United States,United States
Marketech International Corp. (TWSE:6196),TWSE:6196,Semiconductor Equip,Information Technology,5065,Taiwan,Emerging Markets,Small Asia
"MarketEnterprise Co.,Ltd (TSE:3135)",TSE:3135,Retail (Online),Consumer Discretionary,5961,Japan,Japan,Japan
Marketing Worldwide Corp (OTCPK:MWWC),OTCPK:MWWC,Auto Parts,Consumer Discretionary,5013,United States,United States,United States
"MarketWise, Inc. (NasdaqGM:MKTW)",NasdaqGM:MKTW,Financial Svcs. (Non-bank & Insurance),Financials,7370,United States,United States,United States
Markforged Holding Corporation (NYSE:MKFG),NYSE:MKFG,Machinery,Industrials,3555,United States,United States,United States
"MarkLines Co., Ltd. (TSE:3901)",TSE:3901,Software (Entertainment),Communication Services,7370,Japan,Japan,Japan
Markolines Pavement Technologies Limited (BSE:543364),BSE:543364,Transportation,Industrials,4700,India,Emerging Markets,India
