Company Name,Exchange:Ticker,Industry Group,Primary Sector,SIC Code,Country,Broad Group,Sub Group
"Zhejiang Jiaxin Silk Corp., Ltd. (SZSE:002404)",SZSE:002404,Apparel,Consumer Discretionary,2300,China,Emerging Markets,China
"Zhejiang Jiecang Linear Motion Technology Co.,Ltd. (SHSE:603583)",SHSE:603583,Electronics (General),Information Technology,3823,China,Emerging Markets,China
"Zhejiang Jiemei Electronic And Technology Co., Ltd. (SZSE:002859)",SZSE:002859,Packaging & Container,Materials,2670,China,Emerging Markets,China
"Zhejiang Jihua Group Co., Ltd. (SHSE:603980)",SHSE:603980,Chemical (Specialty),Materials,2860,China,Emerging Markets,China
"Zhejiang jin sheng new materials co., LTD. (SZSE:300849)",SZSE:300849,Packaging & Container,Materials,3080,China,Emerging Markets,China
"Zhejiang Jindun Fans Co., Ltd (SZSE:300411)",SZSE:300411,Machinery,Industrials,3564,China,Emerging Markets,China
"Zhejiang Jinfei Kaida Wheel Co.,Ltd. (SZSE:002863)",SZSE:002863,Auto Parts,Consumer Discretionary,3714,China,Emerging Markets,China
"Zhejiang Jinggong Science & Technology Co., Ltd (SZSE:002006)",SZSE:002006,Machinery,Industrials,3559,China,Emerging Markets,China
"Zhejiang Jinghua Laser Technology Co.,Ltd (SHSE:603607)",SHSE:603607,Paper/Forest Products,Materials,2621,China,Emerging Markets,China
"Zhejiang Jingsheng Mechanical & Electrical Co., Ltd. (SZSE:300316)",SZSE:300316,Semiconductor Equip,Information Technology,3559,China,Emerging Markets,China
Zhejiang Jingu Company Limited (SZSE:002488),SZSE:002488,Auto Parts,Consumer Discretionary,3714,China,Emerging Markets,China
"Zhejiang Jingxin Pharmaceutical Co., Ltd. (SZSE:002020)",SZSE:002020,Drugs (Pharmaceutical),Health Care,2833,China,Emerging Markets,China
"Zhejiang Jingxing Paper Joint Stock Co., Ltd. (SZSE:002067)",SZSE:002067,Packaging & Container,Materials,2631,China,Emerging Markets,China
"Zhejiang Jinke Tom Culture Industry Co., Ltd. (SZSE:300459)",SZSE:300459,Chemical (Specialty),Materials,2890,China,Emerging Markets,China
"Zhejiang Jinlihua Electric Co., Ltd. (SZSE:300069)",SZSE:300069,Machinery,Industrials,3600,China,Emerging Markets,China
"Zhejiang Jiuli Hi-Tech Metals Co., Ltd. (SZSE:002318)",SZSE:002318,Steel,Materials,3317,China,Emerging Markets,China
"Zhejiang Jiuzhou Pharmaceutical Co., Ltd (SHSE:603456)",SHSE:603456,Drugs (Pharmaceutical),Health Care,2833,China,Emerging Markets,China
"Zhejiang Jolly Pharmaceutical Co.,LTD (SZSE:300181)",SZSE:300181,Drugs (Pharmaceutical),Health Care,2834,China,Emerging Markets,China
"Zhejiang Juhua Co., Ltd. (SHSE:600160)",SHSE:600160,Chemical (Basic),Materials,2800,China,Emerging Markets,China
"Zhejiang Juli Culture Development Co.,Ltd. (SZSE:002247)",SZSE:002247,Entertainment,Communication Services,7372,China,Emerging Markets,China
"Zhejiang JW Precision Machinery Co.,Ltd (SZSE:300984)",SZSE:300984,Machinery,Industrials,3562,China,Emerging Markets,China
"Zhejiang Kaier New Materials Co.,Ltd. (SZSE:300234)",SZSE:300234,Construction Supplies,Materials,3270,China,Emerging Markets,China
"Zhejiang Kan Specialities Material Co., Ltd. (SZSE:002012)",SZSE:002012,Paper/Forest Products,Materials,2600,China,Emerging Markets,China
"ZheJiang KangLongDa Special Protection Technology Co., Ltd (SHSE:603665)",SHSE:603665,Apparel,Consumer Discretionary,3842,China,Emerging Markets,China
"Zhejiang Kingland Pipeline and Technologies Co.,Ltd. (SZSE:002443)",SZSE:002443,Oilfield Svcs/Equip.,Energy,3317,China,Emerging Markets,China
"Zhejiang Langdi Group Co., Ltd. (SHSE:603726)",SHSE:603726,Machinery,Industrials,3390,China,Emerging Markets,China
"Zhejiang Lante Optics Co., Ltd. (SHSE:688127)",SHSE:688127,Electronics (General),Information Technology,3827,China,Emerging Markets,China
"Zhejiang Liming Intelligent Manufacturing Co.,Ltd. (SHSE:603048)",SHSE:603048,Auto Parts,Consumer Discretionary,3714,China,Emerging Markets,China
"Zhejiang Linuo Flow Control Technology Co.,Ltd (SZSE:300838)",SZSE:300838,Machinery,Industrials,3490,China,Emerging Markets,China
"Zhejiang Longsheng Group Co.,Ltd (SHSE:600352)",SHSE:600352,Chemical (Specialty),Materials,2890,China,Emerging Markets,China
"Zhejiang Medicine Co., Ltd. (SHSE:600216)",SHSE:600216,Drugs (Pharmaceutical),Health Care,2834,China,Emerging Markets,China
"Zhejiang Meida Industrial Co., Ltd. (SZSE:002677)",SZSE:002677,Furn/Home Furnishings,Consumer Discretionary,3630,China,Emerging Markets,China
"Zhejiang Meili High Technology Co., Ltd. (SZSE:300611)",SZSE:300611,Auto Parts,Consumer Discretionary,3490,China,Emerging Markets,China
"Zhejiang Meilun Elevator Co., Ltd. (SHSE:603321)",SHSE:603321,Machinery,Industrials,3530,China,Emerging Markets,China
Zhejiang Meorient Commerce Exhibition Inc. (SZSE:300795),SZSE:300795,Advertising,Communication Services,7389,China,Emerging Markets,China
"Zhejiang Ming Jewelry Co., Ltd. (SZSE:002574)",SZSE:002574,Apparel,Consumer Discretionary,3910,China,Emerging Markets,China
"Zhejiang mtcn Technology Co.,Ltd (SZSE:003026)",SZSE:003026,Semiconductor,Information Technology,3674,China,Emerging Markets,China
"Zhejiang Mustang Battery Co.,Ltd (SHSE:605378)",SHSE:605378,Household Products,Consumer Staples,3690,China,Emerging Markets,China
"ZHEJIANG NARADA POWER SOURCE Co. , Ltd. (SZSE:300068)",SZSE:300068,Electrical Equipment,Industrials,3690,China,Emerging Markets,China
Zhejiang Natural Outdoor Goods Inc. (SHSE:605080),SHSE:605080,Recreation,Consumer Discretionary,3089,China,Emerging Markets,China
"Zhejiang NetSun Co., Ltd. (SZSE:002095)",SZSE:002095,Retail (Distributors),Industrials,7370,China,Emerging Markets,China
Zhejiang NHU Company Ltd. (SZSE:002001),SZSE:002001,Drugs (Pharmaceutical),Health Care,2833,China,Emerging Markets,China
"Zhejiang Oceanking Development Co., Ltd. (SHSE:603213)",SHSE:603213,Chemical (Basic),Materials,2899,China,Emerging Markets,China
"Zhejiang Orient Financial Holdings Group Co., Ltd. (SHSE:600120)",SHSE:600120,Retail (Distributors),Consumer Discretionary,5130,China,Emerging Markets,China
"Zhejiang Orient Gene Biotech Co., Ltd. (SHSE:688298)",SHSE:688298,Drugs (Biotechnology),Health Care,2835,China,Emerging Markets,China
"Zhejiang Provincial New Energy Investment Group Co., Ltd. (SHSE:600032)",SHSE:600032,Green & Renewable Energy,Utilities,4911,China,Emerging Markets,China
"Zhejiang Publishing & Media Co., Ltd. (SHSE:601921)",SHSE:601921,Publishing & Newspapers,Communication Services,2731,China,Emerging Markets,China
"Zhejiang Qianjiang Biochemical Co., Ltd (SHSE:600796)",SHSE:600796,Chemical (Specialty),Materials,2870,China,Emerging Markets,China
"Zhejiang Qianjiang Motorcycle Co., Ltd. (SZSE:000913)",SZSE:000913,Auto & Truck,Consumer Discretionary,3751,China,Emerging Markets,China
"Zhejiang Reclaim Construction Group Co., Ltd. (SZSE:002586)",SZSE:002586,Engineering/Construction,Industrials,1600,China,Emerging Markets,China
"Zhejiang Red Dragonfly Footwear Co., Ltd. (SHSE:603116)",SHSE:603116,Shoe,Consumer Discretionary,3140,China,Emerging Markets,China
"Zhejiang Renzhi Co., Ltd. (SZSE:002629)",SZSE:002629,Oilfield Svcs/Equip.,Energy,1382,China,Emerging Markets,China
"Zhejiang RIFA Precision Machinery Co., Ltd. (SZSE:002520)",SZSE:002520,Machinery,Industrials,3540,China,Emerging Markets,China
"Zhejiang Risun Intelligent Technology Co.,Ltd (SHSE:688215)",SHSE:688215,Machinery,Industrials,3550,China,Emerging Markets,China
"Zhejiang Rongsheng Environmental Protection Paper Joint Stock Co., Ltd. (SHSE:603165)",SHSE:603165,Paper/Forest Products,Materials,2621,China,Emerging Markets,China
Zhejiang RuiYuan Intelligent Control Technology Company Limited (SEHK:8249),SEHK:8249,Electronics (General),Information Technology,3679,China,Emerging Markets,China
"Zhejiang Runtu Co., Ltd. (SZSE:002440)",SZSE:002440,Chemical (Specialty),Materials,2810,China,Emerging Markets,China
"Zhejiang Runyang New Material Technology Co., Ltd. (SZSE:300920)",SZSE:300920,Chemical (Basic),Materials,3080,China,Emerging Markets,China
"Zhejiang Sanfer Electric Co., Ltd (SHSE:605336)",SHSE:605336,Furn/Home Furnishings,Consumer Discretionary,3630,China,Emerging Markets,China
"Zhejiang Sanhua Intelligent Controls Co.,Ltd (SZSE:002050)",SZSE:002050,Machinery,Industrials,3490,China,Emerging Markets,China
"Zhejiang Sanmei Chemical Industry Co., Ltd. (SHSE:603379)",SHSE:603379,Chemical (Basic),Materials,2890,China,Emerging Markets,China
"Zhejiang Sanwei Rubber Item Co., Ltd. (SHSE:603033)",SHSE:603033,Chemical (Basic),Materials,2820,China,Emerging Markets,China
"Zhejiang Semir Garment Co., Ltd. (SZSE:002563)",SZSE:002563,Apparel,Consumer Discretionary,2300,China,Emerging Markets,China
"Zhejiang Sf Oilless Bearing Co.,Ltd. (SZSE:300817)",SZSE:300817,Machinery,Industrials,3562,China,Emerging Markets,China
"Zhejiang Shaoxing RuiFeng Rural Commercial Bank Co.,Ltd (SHSE:601528)",SHSE:601528,Bank (Money Center),Financials,6020,China,Emerging Markets,China
"Zhejiang Shapuaisi Pharmaceutical Co.,Ltd. (SHSE:603168)",SHSE:603168,Drugs (Pharmaceutical),Health Care,2834,China,Emerging Markets,China
"Zhejiang Shengda Bio-Pharm Co., Ltd. (SHSE:603079)",SHSE:603079,Drugs (Pharmaceutical),Health Care,2834,China,Emerging Markets,China
"Zhejiang Shengyang Science and Technology Co., Ltd. (SHSE:603703)",SHSE:603703,Telecom. Equipment,Information Technology,3357,China,Emerging Markets,China
Zhejiang Shibao Company Limited (SEHK:1057),SEHK:1057,Auto Parts,Consumer Discretionary,3714,China,Emerging Markets,China
"Zhejiang Shouxiangu Pharmaceutical Co., Ltd. (SHSE:603896)",SHSE:603896,Household Products,Consumer Staples,2834,China,Emerging Markets,China
"Zhejiang Shuanghuan Driveline Co., Ltd. (SZSE:002472)",SZSE:002472,Auto Parts,Consumer Discretionary,3714,China,Emerging Markets,China
"Zhejiang Songyuan Automotive Safety Systems Co.,Ltd. (SZSE:300893)",SZSE:300893,Auto Parts,Consumer Discretionary,3714,China,Emerging Markets,China
"Zhejiang Southeast Space Frame Co., Ltd. (SZSE:002135)",SZSE:002135,Engineering/Construction,Industrials,3390,China,Emerging Markets,China
"Zhejiang SSAW Boutique Hotels Co.,Ltd (SZSE:301073)",SZSE:301073,Hotel/Gaming,Consumer Discretionary,7011,China,Emerging Markets,China
"Zhejiang Starry Pharmaceutical Co.,Ltd. (SHSE:603520)",SHSE:603520,Drugs (Pharmaceutical),Health Care,2833,China,Emerging Markets,China
Zhejiang Sunflower Great Health Limited Liability Company (SZSE:300111),SZSE:300111,Semiconductor,Information Technology,3674,China,Emerging Markets,China
"Zhejiang Sunoren Solar Technology Co.,Ltd. (SHSE:603105)",SHSE:603105,Semiconductor,Information Technology,3674,China,Emerging Markets,China
"Zhejiang Sunrise Garment Group Co., Ltd. (SHSE:605138)",SHSE:605138,Apparel,Consumer Discretionary,2300,China,Emerging Markets,China
"Zhejiang Sunriver Culture Co.,Ltd. (SHSE:600576)",SHSE:600576,Entertainment,Communication Services,6500,China,Emerging Markets,China
"Zhejiang Supcon Technology Co., Ltd. (SHSE:688777)",SHSE:688777,Electronics (General),Information Technology,3569,China,Emerging Markets,China
"Zhejiang Supor Co., Ltd. (SZSE:002032)",SZSE:002032,Furn/Home Furnishings,Consumer Discretionary,3360,China,Emerging Markets,China
"Zhejiang Taifu Pump Co., Ltd (SZSE:300992)",SZSE:300992,Machinery,Industrials,3561,China,Emerging Markets,China
"Zhejiang Tailin BioEngineering Co.,Ltd (SZSE:300813)",SZSE:300813,Heathcare Information and Technology,Health Care,3841,China,Emerging Markets,China
"Zhejiang Taitan Co.,Ltd. (SZSE:003036)",SZSE:003036,Machinery,Industrials,3550,China,Emerging Markets,China
"Zhejiang Talent Television and Film Co., Ltd. (SZSE:300426)",SZSE:300426,Entertainment,Communication Services,7812,China,Emerging Markets,China
"Zhejiang Tengen Electrics Co.,Ltd. (SHSE:605066)",SHSE:605066,Electrical Equipment,Industrials,3620,China,Emerging Markets,China
"Zhejiang Tengy Environmental Technology Co., Ltd (SEHK:1527)",SEHK:1527,Machinery,Industrials,3564,China,Emerging Markets,China
"Zhejiang Three Stars New Materials Co., Ltd. (SHSE:603578)",SHSE:603578,Building Materials,Industrials,3220,China,Emerging Markets,China
"Zhejiang Tiancheng Controls Co., Ltd. (SHSE:603085)",SHSE:603085,Auto Parts,Consumer Discretionary,2531,China,Emerging Markets,China
"Zhejiang Tiantai Xianghe Industrial Co.,Ltd. (SHSE:603500)",SHSE:603500,Construction Supplies,Industrials,3743,China,Emerging Markets,China
"Zhejiang Tiantie Industry Co., Ltd. (SZSE:300587)",SZSE:300587,Chemical (Basic),Materials,2820,China,Emerging Markets,China
"Zhejiang Tianyu Pharmaceutical Co., Ltd. (SZSE:300702)",SZSE:300702,Drugs (Pharmaceutical),Health Care,2833,China,Emerging Markets,China
"Zhejiang Tieliu Clutch Co., Ltd. (SHSE:603926)",SHSE:603926,Auto Parts,Consumer Discretionary,3714,China,Emerging Markets,China
"Zhejiang Tony Electronic Co., Ltd (SHSE:603595)",SHSE:603595,Electrical Equipment,Industrials,3679,China,Emerging Markets,China
"Zhejiang Truelove Vogue Co., Ltd. (SZSE:003041)",SZSE:003041,Apparel,Consumer Discretionary,2273,China,Emerging Markets,China
"Zhejiang Tuna Environmental Science & TechnologyCo.,Ltd. (SHSE:603177)",SHSE:603177,Environmental & Waste Services,Industrials,3559,China,Emerging Markets,China
"Zhejiang Unifull Industrial Fibre Co., Ltd. (SZSE:002427)",SZSE:002427,Apparel,Consumer Discretionary,2200,China,Emerging Markets,China
"Zhejiang VIE Science & Technology Co., Ltd. (SZSE:002590)",SZSE:002590,Auto Parts,Consumer Discretionary,3714,China,Emerging Markets,China
"Zhejiang Viewshine Intelligent Meter Co.,Ltd (SZSE:002849)",SZSE:002849,Electronics (General),Information Technology,3824,China,Emerging Markets,China
"Zhejiang Walrus New Material Co.,Ltd. (SZSE:003011)",SZSE:003011,Building Materials,Industrials,3089,China,Emerging Markets,China
"Zhejiang Wanfeng Auto Wheel Co., Ltd. (SZSE:002085)",SZSE:002085,Auto Parts,Consumer Discretionary,3714,China,Emerging Markets,China
"Zhejiang Wanliyang Co., Ltd. (SZSE:002434)",SZSE:002434,Construction Supplies,Industrials,3714,China,Emerging Markets,China
"Zhejiang Wanma Co., Ltd. (SZSE:002276)",SZSE:002276,Electrical Equipment,Industrials,3357,China,Emerging Markets,China
"Zhejiang Wansheng Co., Ltd. (SHSE:603010)",SHSE:603010,Chemical (Basic),Materials,2890,China,Emerging Markets,China
Zhejiang Wecome Pharmaceutical Company Limited (SZSE:300878),SZSE:300878,Drugs (Pharmaceutical),Health Care,2834,China,Emerging Markets,China
"Zhejiang Weiming Environment Protection Co., Ltd. (SHSE:603568)",SHSE:603568,Environmental & Waste Services,Industrials,4953,China,Emerging Markets,China
"Zhejiang Weixing Industrial Development Co., Ltd. (SZSE:002003)",SZSE:002003,Apparel,Consumer Discretionary,3960,China,Emerging Markets,China
"Zhejiang Weixing New Building Materials Co., Ltd. (SZSE:002372)",SZSE:002372,Building Materials,Industrials,3080,China,Emerging Markets,China
"Zhejiang Wellsun Intelligent Technology Co.,Ltd. (SZSE:300882)",SZSE:300882,Electronics (General),Information Technology,3825,China,Emerging Markets,China
"Zhejiang Windey Co.,Ltd. (SZSE:300772)",SZSE:300772,Electrical Equipment,Industrials,3510,China,Emerging Markets,China
"Zhejiang Wolwo Bio-Pharmaceutical Co., Ltd. (SZSE:300357)",SZSE:300357,Drugs (Pharmaceutical),Health Care,2834,China,Emerging Markets,China
"Zhejiang XCC Group Co.,Ltd (SHSE:603667)",SHSE:603667,Machinery,Industrials,3562,China,Emerging Markets,China
"Zhejiang Xianju Pharmaceutical Co.,Ltd. (SZSE:002332)",SZSE:002332,Drugs (Pharmaceutical),Health Care,2834,China,Emerging Markets,China
"Zhejiang Xiantong Rubber&Plastic Co.,Ltd (SHSE:603239)",SHSE:603239,Auto Parts,Consumer Discretionary,3714,China,Emerging Markets,China
"Zhejiang Xidamen New Material Co.,Ltd. (SHSE:605155)",SHSE:605155,Building Materials,Industrials,2590,China,Emerging Markets,China
"Zhejiang Xinan Chemical Industrial Group Co.,Ltd (SHSE:600596)",SHSE:600596,Chemical (Diversified),Materials,2870,China,Emerging Markets,China
Zhejiang Xinao Textiles Inc. (SHSE:603889),SHSE:603889,Apparel,Consumer Discretionary,2200,China,Emerging Markets,China
"Zhejiang Xinchai Co., Ltd. (SZSE:301032)",SZSE:301032,Construction Supplies,Industrials,3510,China,Emerging Markets,China
"Zhejiang Xinguang Pharmaceutical Co., Ltd. (SZSE:300519)",SZSE:300519,Drugs (Pharmaceutical),Health Care,2834,China,Emerging Markets,China
"Zhejiang Xinhua Chemical Co.,Ltd (SHSE:603867)",SHSE:603867,Chemical (Basic),Materials,2800,China,Emerging Markets,China
"Zhejiang XinNong Chemical Co.,Ltd. (SZSE:002942)",SZSE:002942,Chemical (Specialty),Materials,2870,China,Emerging Markets,China
"Zhejiang Xinzhonggang Clean Energy Co., Ltd. (SHSE:605162)",SHSE:605162,Power,Utilities,4911,China,Emerging Markets,China
"Zhejiang Yangfan New Materials Co., Ltd. (SZSE:300637)",SZSE:300637,Chemical (Specialty),Materials,2890,China,Emerging Markets,China
"Zhejiang Yankon Group Co., Ltd. (SHSE:600261)",SHSE:600261,Electrical Equipment,Industrials,3640,China,Emerging Markets,China
"Zhejiang Yasha Decoration Co.,Ltd (SZSE:002375)",SZSE:002375,Business & Consumer Services,Consumer Discretionary,2520,China,Emerging Markets,China
"Zhejiang Yatai Pharmaceutical Co., Ltd. (SZSE:002370)",SZSE:002370,Drugs (Pharmaceutical),Health Care,2834,China,Emerging Markets,China
"ZheJiang Yayi Metal Technology Co.,Ltd. (SZSE:301113)",SZSE:301113,Furn/Home Furnishings,Consumer Discretionary,3630,China,Emerging Markets,China
"Zhejiang Yilida Ventilator Co.,Ltd. (SZSE:002686)",SZSE:002686,Building Materials,Industrials,3564,China,Emerging Markets,China
"Zhejiang Yiming Food Co., Ltd. (SHSE:605179)",SHSE:605179,Food Processing,Consumer Staples,2020,China,Emerging Markets,China
"Zhejiang Yingfeng Technology Co., Ltd. (SHSE:605055)",SHSE:605055,Apparel,Consumer Discretionary,2200,China,Emerging Markets,China
"Zhejiang Yinlun Machinery Co.,Ltd. (SZSE:002126)",SZSE:002126,Auto Parts,Consumer Discretionary,3714,China,Emerging Markets,China
"Zhejiang Yongan Rongtong Holdings Co., Ltd. (SEHK:8211)",SEHK:8211,Apparel,Consumer Discretionary,2200,Hong Kong,Emerging Markets,China
"Zhejiang Yonggui Electric Equipment Co., Ltd. (SZSE:300351)",SZSE:300351,Electrical Equipment,Industrials,3600,China,Emerging Markets,China
"Zhejiang Yonghe Refrigerant Co., Ltd. (SHSE:605020)",SHSE:605020,Chemical (Basic),Materials,2860,China,Emerging Markets,China
"Zhejiang Yongjin Metal Technology Co., Ltd (SHSE:603995)",SHSE:603995,Steel,Materials,3310,China,Emerging Markets,China
"Zhejiang Yongtai Technology Co.,Ltd. (SZSE:002326)",SZSE:002326,Chemical (Specialty),Materials,2800,China,Emerging Markets,China
"Zhejiang Youpon Integrated Ceiling Co.,Ltd. (SZSE:002718)",SZSE:002718,Furn/Home Furnishings,Consumer Discretionary,3640,China,Emerging Markets,China
"Zhejiang Yuejian Intelligent Equipment Co.,Ltd. (SHSE:603095)",SHSE:603095,Machinery,Industrials,3550,China,Emerging Markets,China
"Zhejiang Yueling Co., Ltd. (SZSE:002725)",SZSE:002725,Auto Parts,Consumer Discretionary,3714,China,Emerging Markets,China
"Zhejiang Zhaofeng Mechanical and Electronic Co.,Ltd. (SZSE:300695)",SZSE:300695,Auto Parts,Consumer Discretionary,3714,China,Emerging Markets,China
"Zhejiang Zhaolong Interconnect Technology Co., Limited (SZSE:300913)",SZSE:300913,Electrical Equipment,Industrials,3357,China,Emerging Markets,China
"Zhejiang Zhe Kuang Heavy Industries Co., Ltd. (SZSE:300837)",SZSE:300837,Construction Supplies,Industrials,3532,China,Emerging Markets,China
"Zhejiang Zheneng Electric Power Co., Ltd. (SHSE:600023)",SHSE:600023,Power,Utilities,4991,China,Emerging Markets,China
"Zhejiang Zhengguang Industrial Co., Ltd. (SZSE:301092)",SZSE:301092,Chemical (Basic),Materials,2821,China,Emerging Markets,China
"Zhejiang Zhengyuan Zhihui Technology Co.,Ltd. (SZSE:300645)",SZSE:300645,Computer Services,Information Technology,7370,China,Emerging Markets,China
"Zhejiang Zhenyuan Share Co., Ltd. (SZSE:000705)",SZSE:000705,Healthcare Support Services,Health Care,5122,China,Emerging Markets,China
"Zhejiang Zhongcheng Packing Material Co., Ltd. (SZSE:002522)",SZSE:002522,Chemical (Basic),Materials,3080,China,Emerging Markets,China
"Zhejiang Zhongjian Technology Co.,Ltd (SZSE:002779)",SZSE:002779,Furn/Home Furnishings,Consumer Discretionary,3524,China,Emerging Markets,China
"Zhejiang Zhongxin Fluoride Materials Co.,Ltd (SZSE:002915)",SZSE:002915,Chemical (Specialty),Materials,2810,China,Emerging Markets,China
"Zhejiang Zoenn Design Co., Ltd. (SZSE:300901)",SZSE:300901,Business & Consumer Services,Industrials,7389,China,Emerging Markets,China
"Zhejiang Zomax Transmission Co., Ltd. (SHSE:603767)",SHSE:603767,Auto Parts,Consumer Discretionary,3714,China,Emerging Markets,China
"Zhejiang Zone-King Environmental Sci&Tech Co., Ltd. (SHSE:688701)",SHSE:688701,Environmental & Waste Services,Industrials,4950,China,Emerging Markets,China
Zhen Ding Technology Holding Limited (TWSE:4958),TWSE:4958,Electronics (General),Information Technology,3672,Cayman Islands,Emerging Markets,Latin America & Caribbean
"Zhen Yu Hardware Co., Ltd. (TPEX:2947)",TPEX:2947,Retail (Building Supply),Consumer Discretionary,5200,Taiwan,Emerging Markets,Small Asia
"Zhende Medical Co., Ltd. (SHSE:603301)",SHSE:603301,Healthcare Products,Health Care,3842,China,Emerging Markets,China
Zheneng Jinjiang Environment Holding Company Limited (SGX:BWM),SGX:BWM,Green & Renewable Energy,Utilities,4953,China,Emerging Markets,China
Zheng Li Holdings Limited (SEHK:8283),SEHK:8283,Business & Consumer Services,Industrials,7500,Singapore,Emerging Markets,Small Asia
"Zhengping Road & Bridge Construction Co., Ltd. (SHSE:603843)",SHSE:603843,Engineering/Construction,Industrials,1600,China,Emerging Markets,China
Zhengye International Holdings Company Limited (SEHK:3363),SEHK:3363,Packaging & Container,Materials,2650,China,Emerging Markets,China
"Zhengyuan Geomatics Group Co.,Ltd. (SHSE:688509)",SHSE:688509,Business & Consumer Services,Industrials,7389,China,Emerging Markets,China
"Zhengzhou Coal Industry & Electric Power Co., Ltd. (SHSE:600121)",SHSE:600121,Coal & Related Energy,Energy,1220,China,Emerging Markets,China
Zhengzhou Coal Mining Machinery Group Company Limited (SEHK:564),SEHK:564,Construction Supplies,Industrials,3532,China,Emerging Markets,China
"Zhengzhou Deheng Hongsheng Technology Co., Ltd. (SHSE:600817)",SHSE:600817,Construction Supplies,Industrials,3651,China,Emerging Markets,China
"Zhengzhou Jiean Hi-Tech Co.,Ltd. (SZSE:300845)",SZSE:300845,Software (System & Application),Information Technology,7372,China,Emerging Markets,China
"Zhengzhou Qianweiyangchu Food Co., Ltd. (SZSE:001215)",SZSE:001215,Food Processing,Consumer Staples,2090,China,Emerging Markets,China
"Zhengzhou Sino-Crystal Diamond Co.,Ltd. (SZSE:300064)",SZSE:300064,Precious Metals,Materials,3290,China,Emerging Markets,China
"Zhengzhou Tiamaes Technology Co., Ltd (SZSE:300807)",SZSE:300807,Electronics (General),Information Technology,3578,China,Emerging Markets,China
"Zhenhai Petrochemical Engineering CO., LTD (SHSE:603637)",SHSE:603637,Engineering/Construction,Industrials,8711,China,Emerging Markets,China
"Zhenjiang Dongfang Electric Heating Technology Co., Ltd. (SZSE:300217)",SZSE:300217,Furn/Home Furnishings,Consumer Discretionary,3585,China,Emerging Markets,China
Zhenro Properties Group Limited (SEHK:6158),SEHK:6158,Real Estate (Development),Real Estate,6552,China,Emerging Markets,China
Zhenro Services Group Limited (SEHK:6958),SEHK:6958,Real Estate (Operations & Services),Real Estate,6531,China,Emerging Markets,China
"Zheshang Development Group Co., Ltd (SZSE:000906)",SZSE:000906,Retail (Distributors),Industrials,5082,China,Emerging Markets,China
"Zheshang Securities Co., Ltd. (SHSE:601878)",SHSE:601878,Brokerage & Investment Banking,Financials,6211,China,Emerging Markets,China
Zheshang Securities Zhejiang Expressway (SHSE:508001),SHSE:508001,R.E.I.T.,Real Estate,6798,China,Emerging Markets,China
"Zhewen Interactive Group Co., Ltd. (SHSE:600986)",SHSE:600986,Advertising,Communication Services,1600,China,Emerging Markets,China
"Zhewen Pictures Group co.,ltd (SHSE:601599)",SHSE:601599,Apparel,Consumer Discretionary,2200,China,Emerging Markets,China
Zhi Sheng Group Holdings Limited (SEHK:8370),SEHK:8370,Office Equipment & Services,Industrials,2522,China,Emerging Markets,China
Zhicheng Technology Group Ltd. (SEHK:8511),SEHK:8511,Electronics (General),Information Technology,3827,China,Emerging Markets,China
Zhidao International (Holdings) Limited (SEHK:1220),SEHK:1220,Engineering/Construction,Industrials,1700,Hong Kong,Emerging Markets,China
Zhixin Group Holding Limited (SEHK:2187),SEHK:2187,Construction Supplies,Materials,3270,China,Emerging Markets,China
"Zhiyang Innovation Technology Co., Ltd. (SHSE:688191)",SHSE:688191,Electrical Equipment,Industrials,3620,China,Emerging Markets,China
Zhong An Group Limited (SEHK:672),SEHK:672,Real Estate (Development),Real Estate,6552,China,Emerging Markets,China
Zhong Ao Home Group Limited (SEHK:1538),SEHK:1538,Real Estate (Operations & Services),Real Estate,6531,China,Emerging Markets,China
"Zhong Fu Tong Group Co., Ltd. (SZSE:300560)",SZSE:300560,Telecom. Services,Communication Services,4899,China,Emerging Markets,China
Zhong Hua International Holdings Limited (SEHK:1064),SEHK:1064,Real Estate (Operations & Services),Real Estate,6500,Hong Kong,Emerging Markets,China
Zhong Ji Longevity Science Group Limited (SEHK:767),SEHK:767,Financial Svcs. (Non-bank & Insurance),Financials,2430,Hong Kong,Emerging Markets,China
"Zhong Nong Yuan Fang Holdings, Inc. (OTCPK:ANAS)",OTCPK:ANAS,Drugs (Pharmaceutical),Health Care,6163,United States,United States,United States
"Zhong Yang Technology Co., Ltd. (TWSE:6668)",TWSE:6668,Machinery,Industrials,3827,Taiwan,Emerging Markets,Small Asia
"ZhongAn Online P & C Insurance Co., Ltd. (SEHK:6060)",SEHK:6060,Insurance (Prop/Cas.),Financials,6331,China,Emerging Markets,China
"Zhongbai Holdings Group Co.,Ltd (SZSE:000759)",SZSE:000759,Retail (Grocery and Food),Consumer Staples,5311,China,Emerging Markets,China
Zhongchang Big Data Corporation Limited (SHSE:600242),SHSE:600242,Computer Services,Information Technology,900,China,Emerging Markets,China
