Company Name,Exchange:Ticker,Industry Group,Primary Sector,SIC Code,Country,Broad Group,Sub Group
BSQUARE Corporation (NasdaqCM:BSQR),NasdaqCM:BSQR,Software (System & Application),Information Technology,5045,United States,United States,United States
BSR Real Estate Investment Trust (TSX:HOM.UN),TSX:HOM.UN,R.E.I.T.,Real Estate,6798,Canada,"Australia, NZ and Canada",Canada
BSRM Steels Limited (DSE:BSRMSTEEL),DSE:BSRMSTEEL,Steel,Materials,3310,Bangladesh,Emerging Markets,Small Asia
"BT Brands, Inc. (NasdaqCM:BTBD)",NasdaqCM:BTBD,Restaurant/Dining,Consumer Discretionary,5812,United States,United States,United States
BT Group plc (LSE:BT.A),LSE:BT.A,Telecom. Services,Communication Services,4813,United Kingdom,Developed Europe,UK
BT Wealth Industries Public Company Limited (SET:BTW),SET:BTW,Engineering/Construction,Industrials,3440,Thailand,Emerging Markets,Small Asia
BTB Real Estate Investment Trust (TSX:BTB.UN),TSX:BTB.UN,R.E.I.T.,Real Estate,6798,Canada,"Australia, NZ and Canada",Canada
BTC d.d. (LJSE:BTC),LJSE:BTC,Real Estate (Operations & Services),Real Estate,4789,Slovenia,Emerging Markets,EU & Environs
BTC Studios S.A. (WSE:BTC),WSE:BTC,Software (Internet),Information Technology,7370,Poland,Developed Europe,EU & Environs
BTCS Inc. (NasdaqCM:BTCS),NasdaqCM:BTCS,Software (System & Application),Information Technology,7370,United States,United States,United States
"BTG Hotels (Group) Co., Ltd. (SHSE:600258)",SHSE:600258,Hotel/Gaming,Consumer Discretionary,4700,China,Emerging Markets,China
BTG Pactual Logística Fundo de Investimento Imobiliário (BOVESPA:BTLG11),BOVESPA:BTLG11,R.E.I.T.,Real Estate,6726,Brazil,Emerging Markets,Latin America & Caribbean
BTL Inc. (TPEX:6840),TPEX:6840,Business & Consumer Services,Industrials,8734,Taiwan,Emerging Markets,Small Asia
BTM Resources Berhad (KLSE:BTM),KLSE:BTM,Paper/Forest Products,Materials,2400,Malaysia,Emerging Markets,Small Asia
BTRS Holdings Inc. (NasdaqGS:BTRS),NasdaqGS:BTRS,Software (System & Application),Information Technology,7370,United States,United States,United States
BTS Group AB (publ) (OM:BTS B),OM:BTS B,Business & Consumer Services,Industrials,8742,Sweden,Developed Europe,EU & Environs
BTS Group Holdings Public Company Limited (SET:BTS),SET:BTS,Transportation (Railroads),Industrials,3578,Thailand,Emerging Markets,Small Asia
BTU Metals Corp. (TSXV:BTU),TSXV:BTU,Precious Metals,Materials,1040,Canada,"Australia, NZ and Canada",Canada
BUA Cement Plc (NGSE:BUACEMENT),NGSE:BUACEMENT,Construction Supplies,Materials,3241,Nigeria,Emerging Markets,Africa and Middle East
Bualuang Office Leasehold Real Estate Investment Trust (SET:B-WORK),SET:B-WORK,R.E.I.T.,Real Estate,6798,Thailand,Emerging Markets,Small Asia
"Bubang Co., Ltd. (KOSDAQ:A014470)",KOSDAQ:A014470,Retail (General),Consumer Discretionary,3630,South Korea,Emerging Markets,Small Asia
Bubblr Inc. (OTCPK:BBLR),OTCPK:BBLR,Software (Entertainment),Communication Services,7370,United States,United States,United States
Bubs Australia Limited (ASX:BUB),ASX:BUB,Food Processing,Consumer Staples,6159,Australia,"Australia, NZ and Canada",Australia & NZ
Bucher Industries AG (SWX:BUCN),SWX:BUCN,Construction Supplies,Industrials,3523,Switzerland,Developed Europe,EU & Environs
"Bucket Studio Co., Ltd. (KOSDAQ:A066410)",KOSDAQ:A066410,Entertainment,Communication Services,7822,South Korea,Emerging Markets,Small Asia
"Bud Genius, Inc. (OTCPK:RIGH)",OTCPK:RIGH,Healthcare Support Services,Health Care,8071,United States,United States,United States
Budapesti Ingatlan Hasznosítási és Fejlesztési Nyrt. (BUSE:BIF),BUSE:BIF,Real Estate (Operations & Services),Real Estate,6500,Hungary,Developed Europe,EU & Environs
Buddy Technologies Limited (ASX:BUD),ASX:BUD,Furn/Home Furnishings,Consumer Discretionary,1000,Australia,"Australia, NZ and Canada",Australia & NZ
Budimex SA (WSE:BDX),WSE:BDX,Engineering/Construction,Industrials,1600,Poland,Developed Europe,EU & Environs
Budweiser Brewing Company APAC Limited (SEHK:1876),SEHK:1876,Beverage (Alcoholic),Consumer Staples,2082,Hong Kong,Emerging Markets,China
Bufab AB (publ) (OM:BUFAB),OM:BUFAB,Retail (Distributors),Industrials,5072,Sweden,Developed Europe,EU & Environs
Buff Technologies Ltd. (TASE:BUFT),TASE:BUFT,Entertainment,Communication Services,7372,Israel,Emerging Markets,Africa and Middle East
"Buffalo Co.,Ltd. (JASDAQ:3352)",JASDAQ:3352,Retail (Automotive),Consumer Discretionary,5531,Japan,Japan,Japan
Buffalo Coal Corp. (TSXV:BUF),TSXV:BUF,Coal & Related Energy,Energy,1220,South Africa,Emerging Markets,Africa and Middle East
Buhler Industries Inc. (TSX:BUI),TSX:BUI,Farming/Agriculture,Industrials,3523,Canada,"Australia, NZ and Canada",Canada
Build Acquisition Corp. (NYSE:BGSX),NYSE:BGSX,Investments & Asset Management,Financials,9995,United States,United States,United States
Build King Holdings Limited (SEHK:240),SEHK:240,Engineering/Construction,Industrials,1700,Hong Kong,Emerging Markets,China
"Build-A-Bear Workshop, Inc. (NYSE:BBW)",NYSE:BBW,Retail (Special Lines),Consumer Discretionary,5945,United States,United States,United States
Buildablock Corp. (OTCPK:BABL),OTCPK:BABL,Software (Entertainment),Communication Services,4841,Canada,"Australia, NZ and Canada",Canada
BuildData Group AB (OM:BUILD),OM:BUILD,Software (System & Application),Information Technology,7372,Sweden,Developed Europe,EU & Environs
BuildDirect.com Technologies Inc. (TSXV:BILD),TSXV:BILD,Retail (Online),Consumer Discretionary,5961,Canada,"Australia, NZ and Canada",Canada
"Builders FirstSource, Inc. (NYSE:BLDR)",NYSE:BLDR,Building Materials,Industrials,2452,United States,United States,United States
BuilderSmart Public Company Limited (SET:BSM),SET:BSM,Retail (Distributors),Industrials,5211,Thailand,Emerging Markets,Small Asia
Buima Group Inc. (TPEX:5543),TPEX:5543,Building Materials,Industrials,7363,Cayman Islands,Emerging Markets,Latin America & Caribbean
Bukit Darah PLC (COSE:BUKI.N0000),COSE:BUKI.N0000,Farming/Agriculture,Consumer Staples,100,Sri Lanka,Emerging Markets,Small Asia
Bukit Sembawang Estates Limited (SGX:B61),SGX:B61,Real Estate (Development),Real Estate,6552,Singapore,Emerging Markets,Small Asia
"Bukwang Pharmaceutical Co., Ltd. (KOSE:A003000)",KOSE:A003000,Drugs (Pharmaceutical),Health Care,2834,South Korea,Emerging Markets,Small Asia
Bulgarian Holding Company AD (BUL:BHC),BUL:BHC,Investments & Asset Management,Financials,6200,Bulgaria,Emerging Markets,Eastern Europe & Russia
Bulgarian Private Equity Fund AD (BUL:BPEF),BUL:BPEF,Investments & Asset Management,Financials,6726,Bulgaria,Emerging Markets,Eastern Europe & Russia
Bulgarian Real Estate Fund REIT (BUL:BREF),BUL:BREF,R.E.I.T.,Real Estate,6798,Bulgaria,Emerging Markets,Eastern Europe & Russia
Bulgarian River Shipping J.S.Co. (BUL:BRP),BUL:BRP,Shipbuilding & Marine,Industrials,4400,Bulgaria,Emerging Markets,Eastern Europe & Russia
Bulgarian Stock Exchange AD (BUL:BSE),BUL:BSE,Financial Svcs. (Non-bank & Insurance),Financials,6200,Bulgaria,Emerging Markets,Eastern Europe & Russia
Bulgartabac Holding AD (BUL:BTH),BUL:BTH,Tobacco,Consumer Staples,2111,Bulgaria,Emerging Markets,Eastern Europe & Russia
Buligo Capital Ltd (TASE:BLGO),TASE:BLGO,Investments & Asset Management,Financials,0,Israel,Emerging Markets,Africa and Middle East
Bull Horn Holdings Corp. (NasdaqCM:BHSE),NasdaqCM:BHSE,Investments & Asset Management,Financials,9995,United States,United States,United States
Bull Trading and Investment Ltd. (TASE:BULL),TASE:BULL,Financial Svcs. (Non-bank & Insurance),Financials,6153,Israel,Emerging Markets,Africa and Middle East
"Bull Will Co., Ltd. (TPEX:6259)",TPEX:6259,Computer Services,Information Technology,5065,Taiwan,Emerging Markets,Small Asia
"Bull-Dog Sauce Co., Ltd. (TSE:2804)",TSE:2804,Food Processing,Consumer Staples,2000,Japan,Japan,Japan
"Bullet Blockchain, Inc. (OTCPK:BULT)",OTCPK:BULT,Metals & Mining,Materials,1000,United States,United States,United States
Bullet Exploration Inc. (TSXV:AMMO),TSXV:AMMO,Metals & Mining,Materials,1021,Canada,"Australia, NZ and Canada",Canada
Bulletin Resources Limited (ASX:BNR),ASX:BNR,Precious Metals,Materials,1000,Australia,"Australia, NZ and Canada",Australia & NZ
Bullion Gold Resources Corp. (TSXV:BGD),TSXV:BGD,Precious Metals,Materials,1040,Canada,"Australia, NZ and Canada",Canada
Bulten AB (publ) (OM:BULTEN),OM:BULTEN,Auto Parts,Consumer Discretionary,3420,Sweden,Developed Europe,EU & Environs
Bumble Inc. (NasdaqGS:BMBL),NasdaqGS:BMBL,Software (Entertainment),Communication Services,7370,United States,United States,United States
Bumech S.A. (WSE:BMC),WSE:BMC,Business & Consumer Services,Industrials,7600,Poland,Developed Europe,EU & Environs
Bumi Armada Berhad (KLSE:ARMADA),KLSE:ARMADA,Oilfield Svcs/Equip.,Energy,4412,Malaysia,Emerging Markets,Small Asia
Bumitama Agri Ltd. (SGX:P8Z),SGX:P8Z,Farming/Agriculture,Consumer Staples,2070,Indonesia,Emerging Markets,Small Asia
Bumrungrad Hospital Public Company Limited (SET:BH),SET:BH,Hospitals/Healthcare Facilities,Health Care,8062,Thailand,Emerging Markets,Small Asia
"Bumyang Construction Co.,Ltd. (KOSE:A002410)",KOSE:A002410,Engineering/Construction,Industrials,1500,South Korea,Emerging Markets,Small Asia
Bund Center Investment Ltd (SGX:BTE),SGX:BTE,Real Estate (Operations & Services),Real Estate,6510,Singapore,Emerging Markets,Small Asia
Bunge Limited (NYSE:BG),NYSE:BG,Farming/Agriculture,Consumer Staples,2040,United States,United States,United States
"Bunka Shutter Co., Ltd. (TSE:5930)",TSE:5930,Building Materials,Industrials,3442,Japan,Japan,Japan
"Bunkeido Co., Ltd. (NSE:9471)",NSE:9471,Publishing & Newspapers,Communication Services,2731,Japan,Japan,Japan
Bunker Hill Mining Corp. (OTCPK:BHLL),OTCPK:BHLL,Metals & Mining,Materials,1000,Canada,"Australia, NZ and Canada",Canada
"Bunkyodo Group Holdings Co., Ltd. (JASDAQ:9978)",JASDAQ:9978,Retail (Special Lines),Consumer Discretionary,5940,Japan,Japan,Japan
Bunny's Limited (KASE:BNL),KASE:BNL,Food Processing,Consumer Staples,0,Pakistan,Emerging Markets,Small Asia
Bunzl plc (LSE:BNZL),LSE:BNZL,Retail (Distributors),Industrials,5100,United Kingdom,Developed Europe,UK
Bupa Arabia for Cooperative Insurance Company (SASE:8210),SASE:8210,Insurance (Life),Financials,6324,Saudi Arabia,Emerging Markets,Africa and Middle East
Burberry Group plc (LSE:BRBY),LSE:BRBY,Apparel,Consumer Discretionary,2300,United Kingdom,Developed Europe,UK
Burçelik Bursa Çelik Döküm Sanayii A.S. (IBSE:BURCE),IBSE:BURCE,Machinery,Industrials,3500,Turkey,Developed Europe,EU & Environs
Burçelik Vana Sanayi ve Ticaret A.S. (IBSE:BURVA),IBSE:BURVA,Machinery,Industrials,3490,Turkey,Developed Europe,EU & Environs
Burckhardt Compression Holding AG (SWX:BCHN),SWX:BCHN,Machinery,Industrials,3560,Switzerland,Developed Europe,EU & Environs
Burcon NutraScience Corporation (TSX:BU),TSX:BU,Chemical (Specialty),Materials,2836,Canada,"Australia, NZ and Canada",Canada
Bure Equity AB (publ) (OM:BURE),OM:BURE,Investments & Asset Management,Financials,6799,Sweden,Developed Europe,EU & Environs
Bureau Veritas SA (ENXTPA:BVI),ENXTPA:BVI,Business & Consumer Services,Industrials,8700,France,Developed Europe,EU & Environs
Burelle SA (ENXTPA:BUR),ENXTPA:BUR,Auto Parts,Consumer Discretionary,3080,France,Developed Europe,EU & Environs
Burford Capital Limited (AIM:BUR),AIM:BUR,Financial Svcs. (Non-bank & Insurance),Financials,6153,Guernsey,Developed Europe,EU & Environs
Burgan Bank K.P.S.C. (KWSE:BURG),KWSE:BURG,Bank (Money Center),Financials,6020,Kuwait,Emerging Markets,Africa and Middle East
"Burgan Company for Well Drilling, Trading and Maintenance K.S.C. (Public) (KWSE:ABAR)",KWSE:ABAR,Oil/Gas (Production and Exploration),Energy,1381,Kuwait,Emerging Markets,Africa and Middle East
Burgenland Holding Aktiengesellschaft (WBAG:BHD),WBAG:BHD,Utility (General),Utilities,4931,Austria,Developed Europe,EU & Environs
Burger Fuel Group Limited (NZSE:BFG),NZSE:BFG,Restaurant/Dining,Consumer Discretionary,5812,New Zealand,"Australia, NZ and Canada",Australia & NZ
Burger King India Limited (BSE:543248),BSE:543248,Restaurant/Dining,Consumer Discretionary,5812,India,Emerging Markets,India
"BurgerFi International, Inc. (NasdaqGM:BFI)",NasdaqGM:BFI,Restaurant/Dining,Consumer Discretionary,5812,United States,United States,United States
Burgundy Diamond Mines Limited (ASX:BDM),ASX:BDM,Metals & Mining,Materials,1000,Australia,"Australia, NZ and Canada",Australia & NZ
Burgundy Technology Acquisition Corporation (NasdaqCM:BTAQ),NasdaqCM:BTAQ,Investments & Asset Management,Financials,9995,Cayman Islands,Emerging Markets,Latin America & Caribbean
Burin Gold Corp. (TSXV:BURG),TSXV:BURG,Precious Metals,Materials,1041,Canada,"Australia, NZ and Canada",Canada
Buriram Sugar Public Company Limited (SET:BRR),SET:BRR,Food Processing,Consumer Staples,2060,Thailand,Emerging Markets,Small Asia
Burke & Herbert Bank & Trust Company (OTCPK:BHRB),OTCPK:BHRB,Banks (Regional),Financials,6020,United States,United States,United States
Burkhalter Holding AG (SWX:BRKN),SWX:BRKN,Engineering/Construction,Industrials,1700,Switzerland,Developed Europe,EU & Environs
Burley Minerals Ltd (ASX:BUR),ASX:BUR,Metals & Mining,Materials,1000,Australia,"Australia, NZ and Canada",Australia & NZ
"Burlington Stores, Inc. (NYSE:BURL)",NYSE:BURL,Retail (Special Lines),Consumer Discretionary,5600,United States,United States,United States
"Burnham Holdings, Inc. (OTCPK:BURC.A)",OTCPK:BURC.A,Building Materials,Industrials,3443,United States,United States,United States
Burnpur Cement Limited (BSE:532931),BSE:532931,Construction Supplies,Materials,3241,India,Emerging Markets,India
Bursa Cimento Fabrikasi A.S. (IBSE:BUCIM),IBSE:BUCIM,Construction Supplies,Materials,3241,Turkey,Developed Europe,EU & Environs
Bursa de Valori Bucuresti SA (BVB:BVB),BVB:BVB,Financial Svcs. (Non-bank & Insurance),Financials,6200,Romania,Emerging Markets,Eastern Europe & Russia
Bursa Malaysia Berhad (KLSE:BURSA),KLSE:BURSA,Financial Svcs. (Non-bank & Insurance),Financials,6200,Malaysia,Emerging Markets,Small Asia
Burshane LPG (Pakistan) Limited (KASE:BPL),KASE:BPL,Oil/Gas Distribution,Energy,2911,Pakistan,Emerging Markets,Small Asia
Buru Energy Limited (ASX:BRU),ASX:BRU,Oil/Gas (Production and Exploration),Energy,1311,Australia,"Australia, NZ and Canada",Australia & NZ
Buruj Cooperative Insurance Company (SASE:8270),SASE:8270,Insurance (Prop/Cas.),Financials,6300,Saudi Arabia,Emerging Markets,Africa and Middle East
"Burzynski Research Institute, Inc. (OTCPK:BZYR)",OTCPK:BZYR,Drugs (Biotechnology),Health Care,2836,United States,United States,United States
"Bus Online Co., Ltd. (SZSE:002188)",SZSE:002188,Telecom. Equipment,Information Technology,3663,China,Emerging Markets,China
Busan City Gas. Co. Ltd. (KOSE:A015350),KOSE:A015350,Power,Utilities,4924,South Korea,Emerging Markets,Small Asia
"Busan Industrial Co., Ltd. (KOSE:A011390)",KOSE:A011390,Construction Supplies,Materials,3270,South Korea,Emerging Markets,Small Asia
Buscar Company (OTCPK:CGLD),OTCPK:CGLD,Metals & Mining,Materials,1040,United States,United States,United States
Bushiroad Inc. (TSE:7803),TSE:7803,Entertainment,Communication Services,7812,Japan,Japan,Japan
Bushveld Minerals Limited (AIM:BMN),AIM:BMN,Steel,Materials,1000,South Africa,Emerging Markets,Africa and Middle East
Business Alignment Public Company Limited (SET:BIZ),SET:BIZ,Healthcare Support Services,Health Care,5047,Thailand,Emerging Markets,Small Asia
Business Brain Showa-Ota Inc. (TSE:9658),TSE:9658,Computer Services,Information Technology,7370,Japan,Japan,Japan
"Business Breakthrough, Inc. (TSE:2464)",TSE:2464,Education,Consumer Discretionary,8200,Japan,Japan,Japan
Business Engineering Corporation (TSE:4828),TSE:4828,Computer Services,Information Technology,7370,Japan,Japan,Japan
"Business First Bancshares, Inc. (NasdaqGS:BFST)",NasdaqGS:BFST,Banks (Regional),Financials,6020,United States,United States,United States
"Business One Holdings, Inc. (FKSE:4827)",FKSE:4827,Real Estate (General/Diversified),Real Estate,7372,Japan,Japan,Japan
Business Online Public Company Limited (SET:BOL),SET:BOL,Business & Consumer Services,Industrials,7370,Thailand,Emerging Markets,Small Asia
Business Warrior Corporation (OTCPK:BZWR),OTCPK:BZWR,Software (System & Application),Information Technology,7370,United States,United States,United States
Business-intelligence of Oriental Nations Corporation Ltd. (SZSE:300166),SZSE:300166,Software (System & Application),Information Technology,7372,China,Emerging Markets,China
"BusinessOn Communication Co., Ltd (KOSDAQ:A138580)",KOSDAQ:A138580,Software (System & Application),Information Technology,7370,South Korea,Emerging Markets,Small Asia
But Son Cement Packing Joint Stock Company (HNX:BBS),HNX:BBS,Packaging & Container,Materials,3241,Vietnam,Emerging Markets,Small Asia
"But'one Information Corporation,Xi'an (SHSE:600455)",SHSE:600455,Education,Consumer Discretionary,8200,China,Emerging Markets,China
Butler National Corporation (OTCPK:BUKS),OTCPK:BUKS,Aerospace/Defense,Industrials,8741,United States,United States,United States
Butn Limited (ASX:BTN),ASX:BTN,Financial Svcs. (Non-bank & Insurance),Financials,6153,Australia,"Australia, NZ and Canada",Australia & NZ
Butte Energy Inc. (TSXV:BEN.H),TSXV:BEN.H,Oil/Gas (Production and Exploration),Energy,1311,Canada,"Australia, NZ and Canada",Canada
Butterfly Gandhimathi Appliances Limited (BSE:517421),BSE:517421,Furn/Home Furnishings,Consumer Discretionary,3630,India,Emerging Markets,India
"Butterfly Network, Inc. (NYSE:BFLY)",NYSE:BFLY,Healthcare Products,Health Care,3840,United States,United States,United States
Buxly Paints Limited (KASE:BUXL),KASE:BUXL,Chemical (Specialty),Materials,2851,Pakistan,Emerging Markets,Small Asia
Buxton Resources Limited (ASX:BUX),ASX:BUX,Metals & Mining,Materials,1000,Australia,"Australia, NZ and Canada",Australia & NZ
"Buyer Group International, Inc. (OTCPK:BYRG)",OTCPK:BYRG,Metals & Mining,Materials,1099,United States,United States,United States
"BuySell Technologies Co.,Ltd. (TSE:7685)",TSE:7685,Retail (Online),Consumer Discretionary,5960,Japan,Japan,Japan
"Buzz Technologies, Inc. (OTCPK:BZTG)",OTCPK:BZTG,Telecom. Services,Communication Services,7370,United States,United States,United States
"BuzzFeed, Inc. (NasdaqCM:BZFD)",NasdaqCM:BZFD,Publishing & Newspapers,Communication Services,2741,United States,United States,United States
Buzzi Unicem S.p.A. (BIT:BZU),BIT:BZU,Construction Supplies,Materials,3241,Italy,Developed Europe,EU & Environs
"BV Financial, Inc. (OTCPK:BVFL)",OTCPK:BVFL,Financial Svcs. (Non-bank & Insurance),Financials,6035,United States,United States,United States
BVT S.A. (WSE:BVT),WSE:BVT,Financial Svcs. (Non-bank & Insurance),Financials,7320,Poland,Developed Europe,EU & Environs
BVZ Holding AG (SWX:BVZN),SWX:BVZN,Transportation (Railroads),Industrials,4011,Switzerland,Developed Europe,EU & Environs
BW Energy Limited (OB:BWE),OB:BWE,Oil/Gas (Production and Exploration),Energy,1311,Norway,Developed Europe,EU & Environs
BW Epic Kosan Ltd. (OB:BWEK),OB:BWEK,Oil/Gas Distribution,Energy,4400,Singapore,Emerging Markets,Small Asia
BW Ideol AS (OB:BWIDL),OB:BWIDL,Engineering/Construction,Industrials,1600,Norway,Developed Europe,EU & Environs
BW LPG Limited (OB:BWLPG),OB:BWLPG,Oil/Gas Distribution,Energy,4610,Singapore,Emerging Markets,Small Asia
BW Offshore Limited (OB:BWO),OB:BWO,Oilfield Svcs/Equip.,Energy,1382,Bermuda,Emerging Markets,Latin America & Caribbean
BWP Trust (ASX:BWP),ASX:BWP,R.E.I.T.,Real Estate,6798,Australia,"Australia, NZ and Canada",Australia & NZ
BWR Exploration Inc. (TSXV:BWR),TSXV:BWR,Metals & Mining,Materials,1000,Canada,"Australia, NZ and Canada",Canada
BWX Limited (ASX:BWX),ASX:BWX,Household Products,Consumer Staples,2844,Australia,"Australia, NZ and Canada",Australia & NZ
"BWX Technologies, Inc. (NYSE:BWXT)",NYSE:BWXT,Aerospace/Defense,Industrials,3559,United States,United States,United States
"By-health Co., Ltd. (SZSE:300146)",SZSE:300146,Household Products,Consumer Staples,2834,China,Emerging Markets,China
Byblos Bank S.A.L. (BDB:BYB),BDB:BYB,Bank (Money Center),Financials,6020,Lebanon,Emerging Markets,Africa and Middle East
BYBON Group Company Limited (SZSE:300736),SZSE:300736,Retail (Special Lines),Consumer Discretionary,7600,China,Emerging Markets,China
"BYC Co., Ltd. (KOSE:A001460)",KOSE:A001460,Apparel,Consumer Discretionary,2300,South Korea,Emerging Markets,Small Asia
BYD Company Limited (SEHK:1211),SEHK:1211,Auto & Truck,Consumer Discretionary,3711,China,Emerging Markets,China
BYD Electronic (International) Company Limited (SEHK:285),SEHK:285,Telecom. Equipment,Information Technology,3661,China,Emerging Markets,China
BYGGFAKTA GROUP Nordic HoldCo AB (publ) (OM:BFG),OM:BFG,Software (System & Application),Information Technology,7370,Sweden,Developed Europe,EU & Environs
Byggma ASA (OB:BMA),OB:BMA,Building Materials,Industrials,2430,Norway,Developed Europe,EU & Environs
Byggmästare Anders J Ahlström Holding AB (publ) (OM:AJA B),OM:AJA B,Real Estate (Operations & Services),Real Estate,6500,Sweden,Developed Europe,EU & Environs
Byggmax Group AB (publ) (OM:BMAX),OM:BMAX,Retail (Building Supply),Consumer Discretionary,5200,Sweden,Developed Europe,EU & Environs
ByggPartner i Dalarna Holding AB (publ) (OM:BYGGP),OM:BYGGP,Engineering/Construction,Industrials,1600,Sweden,Developed Europe,EU & Environs
"Byline Bancorp, Inc. (NYSE:BY)",NYSE:BY,Banks (Regional),Financials,6020,United States,United States,United States
BYND Cannasoft Enterprises Inc. (CNSX:BYND),CNSX:BYND,Software (System & Application),Information Technology,7372,Canada,"Australia, NZ and Canada",Canada
"BYON Co., Ltd. (KOSDAQ:A032980)",KOSDAQ:A032980,Chemical (Basic),Materials,2390,South Korea,Emerging Markets,Small Asia
Byotrol plc (AIM:BYOT),AIM:BYOT,Chemical (Specialty),Materials,2842,United Kingdom,Developed Europe,UK
Byrna Technologies Inc. (NasdaqCM:BYRN),NasdaqCM:BYRN,Aerospace/Defense,Industrials,3480,United States,United States,United States
Byron Energy Limited (ASX:BYE),ASX:BYE,Oil/Gas (Production and Exploration),Energy,6799,Australia,"Australia, NZ and Canada",Australia & NZ
Bystronic AG (SWX:BYS),SWX:BYS,Machinery,Industrials,3559,Switzerland,Developed Europe,EU & Environs
BYTE Acquisition Corp. (NasdaqCM:BYTS),NasdaqCM:BYTS,Investments & Asset Management,Financials,9995,United States,United States,United States
Byte Computer S.A. (ATSE:BYTE),ATSE:BYTE,Computer Services,Information Technology,7370,Greece,Developed Europe,EU & Environs
Bytes Technology Group plc (LSE:BYIT),LSE:BYIT,Software (System & Application),Information Technology,7372,United Kingdom,Developed Europe,UK
Byucksan Corporation (KOSE:A007210),KOSE:A007210,Building Materials,Industrials,3290,South Korea,Emerging Markets,Small Asia
C & A Textiles Limited (DSE:CNATEX),DSE:CNATEX,Apparel,Consumer Discretionary,2300,Bangladesh,Emerging Markets,Small Asia
C & C Constructions Limited (BSE:532813),BSE:532813,Engineering/Construction,Industrials,1600,India,Emerging Markets,India
C & I Leasing Plc (NGSE:CILEASING),NGSE:CILEASING,Retail (Distributors),Industrials,6172,Nigeria,Emerging Markets,Africa and Middle East
C C Land Holdings Limited (SEHK:1224),SEHK:1224,Real Estate (Development),Real Estate,3100,Hong Kong,Emerging Markets,China
C Cheng Holdings Limited (SEHK:1486),SEHK:1486,Business & Consumer Services,Industrials,8700,Hong Kong,Emerging Markets,China
C M Holdings PLC (COSE:COLO.N0000),COSE:COLO.N0000,Retail (Automotive),Consumer Discretionary,5500,Sri Lanka,Emerging Markets,Small Asia
C Security Systems AB (publ) (NGM:CSEC),NGM:CSEC,Shipbuilding & Marine,Industrials,3812,Sweden,Developed Europe,EU & Environs
C Sun Mfg Ltd. (TWSE:2467),TWSE:2467,Machinery,Industrials,3567,Taiwan,Emerging Markets,Small Asia
C T Holdings PLC (COSE:CTHR.N0000),COSE:CTHR.N0000,Retail (Grocery and Food),Consumer Staples,5140,Sri Lanka,Emerging Markets,Small Asia
"C-Bond Systems, Inc. (OTCPK:CBNT)",OTCPK:CBNT,Chemical (Specialty),Materials,2800,United States,United States,United States
C-Care (Mauritius) Limited (MUSE:MASC.I0000),MUSE:MASC.I0000,Hospitals/Healthcare Facilities,Health Care,8062,Mauritius,Emerging Markets,Africa and Middle East
C-Com Satellite Systems Inc. (TSXV:CMI),TSXV:CMI,Telecom. Equipment,Information Technology,3663,Canada,"Australia, NZ and Canada",Canada
C-Link Squared Limited (SEHK:1463),SEHK:1463,Information Services,Information Technology,7374,Malaysia,Emerging Markets,Small Asia
C-Media Electronics Inc. (TPEX:6237),TPEX:6237,Semiconductor,Information Technology,3674,Taiwan,Emerging Markets,Small Asia
C-MER Eye Care Holdings Limited (SEHK:3309),SEHK:3309,Healthcare Support Services,Health Care,8011,Hong Kong,Emerging Markets,China
C-Rad AB (publ) (OM:CRAD B),OM:CRAD B,Healthcare Products,Health Care,3845,Sweden,Developed Europe,EU & Environs
C-Tech United Corp. (TPEX:3625),TPEX:3625,Electronics (General),Information Technology,3290,Taiwan,Emerging Markets,Small Asia
C. Mer Industries Ltd. (TASE:CMER),TASE:CMER,Engineering/Construction,Industrials,3663,Israel,Emerging Markets,Africa and Middle East
C. W. Mackie PLC (COSE:CWM.N0000),COSE:CWM.N0000,Retail (Distributors),Consumer Discretionary,5000,Sri Lanka,Emerging Markets,Small Asia
C.A. Inmuebles Y Valores Caracas (CCSE:IVC),CCSE:IVC,Real Estate (Operations & Services),Real Estate,6512,Venezuela,Emerging Markets,Latin America & Caribbean
C.A. Ron Santa Teresa (CCSE:RST),CCSE:RST,Beverage (Alcoholic),Consumer Staples,2085,Venezuela,Emerging Markets,Latin America & Caribbean
C.banner International Holdings Limited (SEHK:1028),SEHK:1028,Shoe,Consumer Discretionary,3140,Hong Kong,Emerging Markets,China
C.C.C. Tourist Enterprises Public Company Limited (CSE:CCCT),CSE:CCCT,Hotel/Gaming,Consumer Discretionary,7011,Cyprus,Developed Europe,EU & Environs
"C.C.P. Contact Probes Co., Ltd. (TPEX:6217)",TPEX:6217,Electronics (General),Information Technology,3812,Taiwan,Emerging Markets,Small Asia
C.E.Management Integrated Laboratory Co.Ltd (TSE:6171),TSE:6171,Business & Consumer Services,Industrials,8700,Japan,Japan,Japan
