Company Name,Exchange:Ticker,Industry Group,Primary Sector,SIC Code,Country,Broad Group,Sub Group
Captor Therapeutics spolka akcyjna (WSE:CTX),WSE:CTX,Drugs (Biotechnology),Health Care,2836,Poland,Developed Europe,EU & Environs
CAQ Holdings Limited (ASX:CAQ),ASX:CAQ,Real Estate (Development),Real Estate,6552,Hong Kong,Emerging Markets,China
Car & General (Kenya) Plc (NASE:CGEN),NASE:CGEN,Retail (Automotive),Consumer Discretionary,5500,Kenya,Emerging Markets,Africa and Middle East
"Car Mate Mfg. Co., Ltd. (JASDAQ:7297)",JASDAQ:7297,Auto Parts,Consumer Discretionary,3714,Japan,Japan,Japan
"Cara Therapeutics, Inc. (NasdaqGM:CARA)",NasdaqGM:CARA,Drugs (Pharmaceutical),Health Care,2836,United States,United States,United States
Carabao Group Public Company Limited (SET:CBG),SET:CBG,Beverage (Soft),Consumer Staples,2086,Thailand,Emerging Markets,Small Asia
Caracal Gold plc (LSE:GCAT),LSE:GCAT,Precious Metals,Materials,1040,United Kingdom,Developed Europe,UK
Carasent ASA (OB:CARA),OB:CARA,Heathcare Information and Technology,Health Care,7372,Norway,Developed Europe,EU & Environs
Carasso Motors Ltd. (TASE:CRSO),TASE:CRSO,Retail (Automotive),Consumer Discretionary,5500,Israel,Emerging Markets,Africa and Middle East
Caravel Minerals Limited (ASX:CVV),ASX:CVV,Metals & Mining,Materials,1000,Australia,"Australia, NZ and Canada",Australia & NZ
Carawine Resources Limited (ASX:CWX),ASX:CWX,Metals & Mining,Materials,1000,Australia,"Australia, NZ and Canada",Australia & NZ
Carbacid Investments plc (NASE:CARB),NASE:CARB,Chemical (Specialty),Materials,2810,Kenya,Emerging Markets,Africa and Middle East
Carbeeza Inc. (TSXV:AUTO),TSXV:AUTO,Retail (Online),Consumer Discretionary,5960,Canada,"Australia, NZ and Canada",Canada
Carbine Resources Limited (ASX:CRB),ASX:CRB,Metals & Mining,Materials,1040,Australia,"Australia, NZ and Canada",Australia & NZ
Carbios SAS (ENXTPA:ALCRB),ENXTPA:ALCRB,Chemical (Basic),Materials,3559,France,Developed Europe,EU & Environs
Carbiotix AB (publ) (NGM:CRBX),NGM:CRBX,Healthcare Products,Health Care,2836,Sweden,Developed Europe,EU & Environs
Carboclor S.A. (BASE:CARC),BASE:CARC,Shipbuilding & Marine,Industrials,2860,Argentina,Emerging Markets,Latin America & Caribbean
Carbon Energy Corporation (OTCPK:CRBO),OTCPK:CRBO,Oil/Gas (Production and Exploration),Energy,1311,United States,United States,United States
Carbon Revolution Limited (ASX:CBR),ASX:CBR,Auto Parts,Consumer Discretionary,3714,Australia,"Australia, NZ and Canada",Australia & NZ
Carbon Streaming Corporation (OTCPK:OFST.F),OTCPK:OFST.F,Environmental & Waste Services,Industrials,4950,Canada,"Australia, NZ and Canada",Canada
Carbon Studio Spólka Akcyjna (WSE:CRB),WSE:CRB,Entertainment,Communication Services,7372,Poland,Developed Europe,EU & Environs
Carbon Transition ASA (OB:CARBN),OB:CARBN,Oilfield Svcs/Equip.,Energy,1389,Norway,Developed Europe,EU & Environs
"CarbonMeta Technologies, Inc. (OTCPK:COWI)",OTCPK:COWI,Computer Services,Information Technology,7370,United States,United States,United States
Carbonxt Group Limited (ASX:CG1),ASX:CG1,Chemical (Basic),Materials,2810,United States,United States,United States
Carborundum Universal Limited (BSE:513375),BSE:513375,Chemical (Basic),Materials,3290,India,Emerging Markets,India
"Carchs Holdings Co., Ltd. (TSE:7602)",TSE:7602,Retail (Automotive),Consumer Discretionary,5500,Japan,Japan,Japan
Carclo plc (LSE:CAR),LSE:CAR,Chemical (Specialty),Materials,3080,United Kingdom,Developed Europe,UK
Card Factory plc (LSE:CARD),LSE:CARD,Retail (Special Lines),Consumer Discretionary,5940,United Kingdom,Developed Europe,UK
"Cardax, Inc. (OTCPK:CDXI)",OTCPK:CDXI,Drugs (Pharmaceutical),Health Care,2834,United States,United States,United States
Cardero Resource Corp. (TSXV:CDU),TSXV:CDU,Metals & Mining,Materials,1000,Canada,"Australia, NZ and Canada",Canada
CardieX Limited (ASX:CDX),ASX:CDX,Healthcare Products,Health Care,3845,Australia,"Australia, NZ and Canada",Australia & NZ
Cardiff Lexington Corporation (OTCPK:CDIX),OTCPK:CDIX,Business & Consumer Services,Industrials,7291,United States,United States,United States
"Cardiff Oncology, Inc. (NasdaqCM:CRDF)",NasdaqCM:CRDF,Drugs (Biotechnology),Health Care,2836,United States,United States,United States
Cardiff Property Plc (LSE:CDFF),LSE:CDFF,Real Estate (Operations & Services),Real Estate,6510,United Kingdom,Developed Europe,UK
"Cardinal Co., Ltd. (JASDAQ:7855)",JASDAQ:7855,Computers/Peripherals,Information Technology,3577,Japan,Japan,Japan
Cardinal Energy Ltd. (TSX:CJ),TSX:CJ,Oil/Gas (Production and Exploration),Energy,1311,Canada,"Australia, NZ and Canada",Canada
"Cardinal Health, Inc. (NYSE:CAH)",NYSE:CAH,Healthcare Support Services,Health Care,5122,United States,United States,United States
"CardioComm Solutions, Inc. (TSXV:EKG)",TSXV:EKG,Heathcare Information and Technology,Health Care,7373,Canada,"Australia, NZ and Canada",Canada
CardioGenics Holdings Inc (OTCPK:CGNH),OTCPK:CGNH,Drugs (Biotechnology),Health Care,2835,Canada,"Australia, NZ and Canada",Canada
Cardiol Therapeutics Inc. (TSX:CRDL),TSX:CRDL,Drugs (Pharmaceutical),Health Care,2836,Canada,"Australia, NZ and Canada",Canada
"Cardiovascular Systems, Inc. (NasdaqGS:CSII)",NasdaqGS:CSII,Healthcare Products,Health Care,3840,United States,United States,United States
"Cardlytics, Inc. (NasdaqGM:CDLX)",NasdaqGM:CDLX,Advertising,Communication Services,7370,United States,United States,United States
Cardno Limited (ASX:CDD),ASX:CDD,Environmental & Waste Services,Industrials,8711,Australia,"Australia, NZ and Canada",Australia & NZ
Care Property Invest NV (ENXTBR:CPINV),ENXTBR:CPINV,R.E.I.T.,Real Estate,6798,Belgium,Developed Europe,EU & Environs
CARE Ratings Limited (NSEI:CARERATING),NSEI:CARERATING,Financial Svcs. (Non-bank & Insurance),Financials,6200,India,Emerging Markets,India
"Care Service Co.,Ltd. (JASDAQ:2425)",JASDAQ:2425,Healthcare Support Services,Health Care,8051,Japan,Japan,Japan
Care Twentyone Corporation (JASDAQ:2373),JASDAQ:2373,Healthcare Support Services,Health Care,8082,Japan,Japan,Japan
Carebook Technologies Inc. (TSXV:CRBK),TSXV:CRBK,Heathcare Information and Technology,Health Care,7372,Canada,"Australia, NZ and Canada",Canada
"CareCloud, Inc. (NasdaqGM:MTBC)",NasdaqGM:MTBC,Heathcare Information and Technology,Health Care,7370,United States,United States,United States
"CareDx, Inc (NasdaqGM:CDNA)",NasdaqGM:CDNA,Drugs (Biotechnology),Health Care,2835,United States,United States,United States
"CAREER BANK Co., Ltd. (SPSE:4834)",SPSE:4834,Business & Consumer Services,Industrials,7361,Japan,Japan,Japan
"CAREER CO., LTD. (TSE:6198)",TSE:6198,Business & Consumer Services,Industrials,7361,Japan,Japan,Japan
"Career Design Center Co., Ltd. (TSE:2410)",TSE:2410,Business & Consumer Services,Industrials,7361,Japan,Japan,Japan
Career Point Limited (NSEI:CAREERP),NSEI:CAREERP,Education,Consumer Discretionary,8200,India,Emerging Markets,India
"Career Technology (Mfg.) Co., Ltd. (TWSE:6153)",TWSE:6153,Electronics (General),Information Technology,3672,Taiwan,Emerging Markets,Small Asia
CareerIndex Inc. (TSE:6538),TSE:6538,Software (Entertainment),Communication Services,7370,Japan,Japan,Japan
"Careerlink Co., Ltd. (TSE:6070)",TSE:6070,Business & Consumer Services,Industrials,7363,Japan,Japan,Japan
"Carefree Group, Inc. (OTCPK:CRFU)",OTCPK:CRFU,Hotel/Gaming,Consumer Discretionary,7000,United States,United States,United States
"Caregen Co., Ltd. (KOSDAQ:A214370)",KOSDAQ:A214370,Drugs (Pharmaceutical),Health Care,2836,South Korea,Emerging Markets,Small Asia
Careium AB (Publ) (OM:CARE),OM:CARE,Healthcare Products,Health Care,3669,Sweden,Developed Europe,EU & Environs
Carel Industries S.p.A. (BIT:CRL),BIT:CRL,Building Materials,Industrials,3822,Italy,Developed Europe,EU & Environs
"Carelabs Co.,Ltd (KOSDAQ:A263700)",KOSDAQ:A263700,Heathcare Information and Technology,Health Care,7370,South Korea,Emerging Markets,Small Asia
"CareMax, Inc. (NasdaqGS:CMAX)",NasdaqGS:CMAX,Healthcare Support Services,Health Care,8011,United States,United States,United States
"CareNet, Inc. (TSE:2150)",TSE:2150,Heathcare Information and Technology,Health Care,7370,Japan,Japan,Japan
Carepay Inc. (OTCPK:SOFE),OTCPK:SOFE,Heathcare Information and Technology,Health Care,7370,United States,United States,United States
Careplus Group Berhad (KLSE:CAREPLS),KLSE:CAREPLS,Healthcare Products,Health Care,3842,Malaysia,Emerging Markets,Small Asia
"CareRay Digital Medical Technology Co., Ltd. (SHSE:688607)",SHSE:688607,Healthcare Products,Health Care,3844,China,Emerging Markets,China
CareRx Corporation (TSX:CRRX),TSX:CRRX,Retail (Special Lines),Consumer Staples,5912,Canada,"Australia, NZ and Canada",Canada
"CareSpan Health, Inc. (TSXV:CSPN)",TSXV:CSPN,Heathcare Information and Technology,Health Care,7372,Canada,"Australia, NZ and Canada",Canada
CareTech Holdings PLC (AIM:CTH),AIM:CTH,Hospitals/Healthcare Facilities,Health Care,8051,United Kingdom,Developed Europe,UK
"CareTrust REIT, Inc. (NasdaqGS:CTRE)",NasdaqGS:CTRE,R.E.I.T.,Real Estate,6798,United States,United States,United States
"CareView Communications, Inc. (OTCPK:CRVW)",OTCPK:CRVW,Heathcare Information and Technology,Health Care,7372,United States,United States,United States
Cargills (Ceylon) PLC (COSE:CARG.N0000),COSE:CARG.N0000,Retail (Grocery and Food),Consumer Staples,2000,Sri Lanka,Emerging Markets,Small Asia
Cargo Boat Development Company PLC (COSE:CABO.N0000),COSE:CABO.N0000,Real Estate (Operations & Services),Real Estate,6500,Sri Lanka,Emerging Markets,Small Asia
Cargo Handlers Limited (JMSE:CHL),JMSE:CHL,Shipbuilding & Marine,Industrials,4400,Jamaica,Emerging Markets,Latin America & Caribbean
Cargojet Inc. (TSX:CJT),TSX:CJT,Transportation,Industrials,4513,Canada,"Australia, NZ and Canada",Canada
Cargotec Corporation (HLSE:CGCBV),HLSE:CGCBV,Machinery,Industrials,3537,Finland,Developed Europe,EU & Environs
"CarGurus, Inc. (NasdaqGS:CARG)",NasdaqGS:CARG,Software (Entertainment),Communication Services,7370,United States,United States,United States
Caribbean Assurance Brokers Limited (JMSE:CABROKERS),JMSE:CABROKERS,Insurance (General),Financials,6411,Jamaica,Emerging Markets,Latin America & Caribbean
Caribbean Cement Company Limited (JMSE:CCC),JMSE:CCC,Construction Supplies,Materials,3241,Jamaica,Emerging Markets,Latin America & Caribbean
Caribbean Cream Limited (JMSE:KREMI),JMSE:KREMI,Food Processing,Consumer Staples,2024,Jamaica,Emerging Markets,Latin America & Caribbean
Caribbean Flavours and Fragrances Limited (JMSE:CFF),JMSE:CFF,Food Processing,Consumer Staples,2000,Jamaica,Emerging Markets,Latin America & Caribbean
Caribbean Investment Holdings Limited (OTCPK:BCBH.F),OTCPK:BCBH.F,Banks (Regional),Financials,6020,Turks & Caicos Islands,Emerging Markets,Latin America & Caribbean
Caribbean Producers (Jamaica) Limited (JMSE:CPJ),JMSE:CPJ,Food Wholesalers,Consumer Staples,5180,Jamaica,Emerging Markets,Latin America & Caribbean
"Caribbean Utilities Company, Ltd. (TSX:CUP.U)",TSX:CUP.U,Power,Utilities,4911,Cayman Islands,Emerging Markets,Latin America & Caribbean
Cariboo Rose Resources Ltd. (TSXV:CRB),TSXV:CRB,Metals & Mining,Materials,1000,Canada,"Australia, NZ and Canada",Canada
"Caribou Biosciences, Inc. (NasdaqGS:CRBU)",NasdaqGS:CRBU,Drugs (Biotechnology),Health Care,2836,United States,United States,United States
Carimin Petroleum Berhad (KLSE:CARIMIN),KLSE:CARIMIN,Oilfield Svcs/Equip.,Energy,1311,Malaysia,Emerging Markets,Small Asia
Carindale Property Trust (ASX:CDP),ASX:CDP,R.E.I.T.,Real Estate,6798,Australia,"Australia, NZ and Canada",Australia & NZ
Carl Data Solutions Inc. (DB:7C5),DB:7C5,Software (System & Application),Information Technology,7372,Canada,"Australia, NZ and Canada",Canada
Carl Zeiss Meditec AG (XTRA:AFX),XTRA:AFX,Healthcare Products,Health Care,3840,Germany,Developed Europe,EU & Environs
Carlin Gold Corporation (TSXV:CGD),TSXV:CGD,Precious Metals,Materials,1040,Canada,"Australia, NZ and Canada",Canada
Carlisle Companies Incorporated (NYSE:CSL),NYSE:CSL,Building Materials,Industrials,2950,United States,United States,United States
"Carlit Holdings Co., Ltd. (TSE:4275)",TSE:4275,Chemical (Basic),Materials,9998,Japan,Japan,Japan
Carlo Gavazzi Holding AG (SWX:GAV),SWX:GAV,Electrical Equipment,Industrials,3823,Switzerland,Developed Europe,EU & Environs
Carlos Casado S.A. (BASE:CADO),BASE:CADO,Farming/Agriculture,Consumer Staples,6552,Argentina,Emerging Markets,Latin America & Caribbean
"CarLotz, Inc. (NasdaqGM:LOTZ)",NasdaqGM:LOTZ,Retail (Automotive),Consumer Discretionary,5500,United States,United States,United States
Carlsberg A/S (CPSE:CARL B),CPSE:CARL B,Beverage (Alcoholic),Consumer Staples,2082,Denmark,Developed Europe,EU & Environs
Carlsberg Brewery Malaysia Berhad (KLSE:CARLSBG),KLSE:CARLSBG,Beverage (Alcoholic),Consumer Staples,2082,Malaysia,Emerging Markets,Small Asia
Carlson Investments S.A. (WSE:CAI),WSE:CAI,Construction Supplies,Materials,3270,Poland,Developed Europe,EU & Environs
Carlton Investments Limited (ASX:CIN),ASX:CIN,Investments & Asset Management,Financials,6799,Australia,"Australia, NZ and Canada",Australia & NZ
Carly Holdings Limited (ASX:CL8),ASX:CL8,Retail (Online),Consumer Discretionary,7370,Australia,"Australia, NZ and Canada",Australia & NZ
Carlyle Commodities Corp. (CNSX:CCC),CNSX:CCC,Metals & Mining,Materials,1000,Canada,"Australia, NZ and Canada",Canada
Carmat SA (ENXTPA:ALCAR),ENXTPA:ALCAR,Healthcare Products,Health Care,3845,France,Developed Europe,EU & Environs
"CarMax, Inc. (NYSE:KMX)",NYSE:KMX,Retail (Automotive),Consumer Discretionary,5500,United States,United States,United States
Carmila S.A. (ENXTPA:CARM),ENXTPA:CARM,R.E.I.T.,Real Estate,6500,France,Developed Europe,EU & Environs
Carmit Candy Industries Ltd. (TASE:CRMT),TASE:CRMT,Food Processing,Consumer Staples,2060,Israel,Emerging Markets,Africa and Middle East
"Carna Biosciences, Inc. (JASDAQ:4572)",JASDAQ:4572,Heathcare Information and Technology,Health Care,2835,Japan,Japan,Japan
Carnaby Resources Limited (ASX:CNB),ASX:CNB,Metals & Mining,Materials,1000,Australia,"Australia, NZ and Canada",Australia & NZ
Carnarvon Energy Limited (ASX:CVN),ASX:CVN,Oil/Gas (Production and Exploration),Energy,1311,Australia,"Australia, NZ and Canada",Australia & NZ
Carnation Industries Limited (BSE:530609),BSE:530609,Steel,Materials,3320,India,Emerging Markets,India
Carnavale Resources Limited (ASX:CAV),ASX:CAV,Metals & Mining,Materials,1000,Australia,"Australia, NZ and Canada",Australia & NZ
Carnegie Clean Energy Limited (ASX:CCE),ASX:CCE,Green & Renewable Energy,Utilities,4911,Australia,"Australia, NZ and Canada",Australia & NZ
"Carnegie Development, Inc. (OTCPK:CDJM)",OTCPK:CDJM,Real Estate (Development),Real Estate,9995,United States,United States,United States
Carney Technology Acquisition Corp. II (NasdaqCM:CTAQ),NasdaqCM:CTAQ,Investments & Asset Management,Financials,9995,United States,United States,United States
Carnival Corporation & plc (NYSE:CCL),NYSE:CCL,Hotel/Gaming,Consumer Discretionary,4400,United States,United States,United States
Carnival Group International Holdings Limited (SEHK:996),SEHK:996,Real Estate (Development),Real Estate,6500,Hong Kong,Emerging Markets,China
Carnival Industrial Corporation (TWSE:1417),TWSE:1417,Apparel,Consumer Discretionary,2300,Taiwan,Emerging Markets,Small Asia
Carozzi S.A. (SNSE:CAROZZI),SNSE:CAROZZI,Food Processing,Consumer Staples,2060,Chile,Emerging Markets,Latin America & Caribbean
"CarParts.com, Inc. (NasdaqGS:PRTS)",NasdaqGS:PRTS,Retail (Online),Consumer Discretionary,5961,United States,United States,United States
Carpathia Capital S.A. (WSE:CRC),WSE:CRC,Investments & Asset Management,Financials,6799,Poland,Developed Europe,EU & Environs
Carpenter Tan Holdings Limited (SEHK:837),SEHK:837,Apparel,Consumer Discretionary,3990,China,Emerging Markets,China
Carpenter Technology Corporation (NYSE:CRS),NYSE:CRS,Steel,Materials,3312,United States,United States,United States
Carpevigo Holding AG (MUN:CV3),MUN:CV3,Green & Renewable Energy,Utilities,4911,Germany,Developed Europe,EU & Environs
Carpinienne de Participations (ENXTPA:CARP),ENXTPA:CARP,Real Estate (Operations & Services),Real Estate,6799,France,Developed Europe,EU & Environs
Carr's Group plc (LSE:CARR),LSE:CARR,Farming/Agriculture,Consumer Staples,2870,United Kingdom,Developed Europe,UK
Carrefour SA (ENXTPA:CA),ENXTPA:CA,Retail (General),Consumer Staples,5399,France,Developed Europe,EU & Environs
CarrefourSA Carrefour Sabanci Ticaret Merkezi A.S. (IBSE:CRFSA),IBSE:CRFSA,Retail (General),Consumer Staples,5399,Turkey,Developed Europe,EU & Environs
Carreras Limited (JMSE:CAR),JMSE:CAR,Retail (Distributors),Consumer Discretionary,2111,Jamaica,Emerging Markets,Latin America & Caribbean
"Carriage Services, Inc. (NYSE:CSV)",NYSE:CSV,Business & Consumer Services,Consumer Discretionary,7200,United States,United States,United States
Carrianna Group Holdings Company Limited (SEHK:126),SEHK:126,Hotel/Gaming,Consumer Discretionary,7011,Hong Kong,Emerging Markets,China
Carrier Global Corporation (NYSE:CARR),NYSE:CARR,Building Materials,Industrials,3585,United States,United States,United States
"Carriesoft Co., Ltd. (KOSDAQ:A317530)",KOSDAQ:A317530,Entertainment,Communication Services,7812,South Korea,Emerging Markets,Small Asia
"Carroll Shelby International, Inc. (OTCPK:CSBI)",OTCPK:CSBI,Auto & Truck,Consumer Discretionary,3711,United States,United States,United States
"Carrols Restaurant Group, Inc. (NasdaqGS:TAST)",NasdaqGS:TAST,Restaurant/Dining,Consumer Discretionary,5812,United States,United States,United States
Carry Wealth Holdings Limited (SEHK:643),SEHK:643,Apparel,Consumer Discretionary,2300,Hong Kong,Emerging Markets,China
Cars.com Inc. (NYSE:CARS),NYSE:CARS,Software (Entertainment),Communication Services,7370,United States,United States,United States
carsales.com Ltd (ASX:CAR),ASX:CAR,Software (Entertainment),Communication Services,7370,Australia,"Australia, NZ and Canada",Australia & NZ
CARsgen Therapeutics Holdings Limited (SEHK:2171),SEHK:2171,Drugs (Biotechnology),Health Care,2836,China,Emerging Markets,China
Carson Cumberbatch PLC (COSE:CARS.N0000),COSE:CARS.N0000,Food Processing,Consumer Staples,9998,Sri Lanka,Emerging Markets,Small Asia
"Carta Holdings, Inc. (TSE:3688)",TSE:3688,Advertising,Communication Services,9997,Japan,Japan,Japan
Cartavio S.A.A. (BVL:CARTAVC1),BVL:CARTAVC1,Farming/Agriculture,Consumer Staples,2060,Peru,Emerging Markets,Latin America & Caribbean
"Carter Bankshares, Inc. (NasdaqGS:CARE)",NasdaqGS:CARE,Banks (Regional),Financials,6020,United States,United States,United States
"Carter's, Inc. (NYSE:CRI)",NYSE:CRI,Apparel,Consumer Discretionary,2300,United States,United States,United States
Cartesian Growth Corporation (NasdaqCM:GLBL),NasdaqCM:GLBL,Investments & Asset Management,Financials,9995,United States,United States,United States
Carthage Cement SA (BVMT:CC),BVMT:CC,Construction Supplies,Materials,3241,Tunisia,Emerging Markets,Africa and Middle East
Cartier Iron Corporation (CNSX:CFE),CNSX:CFE,Steel,Materials,6799,Canada,"Australia, NZ and Canada",Canada
Cartier Resources Inc. (TSXV:ECR),TSXV:ECR,Precious Metals,Materials,1040,Canada,"Australia, NZ and Canada",Canada
Cartier Saada SA (CBSE:CRS),CBSE:CRS,Food Processing,Consumer Staples,2030,Morocco,Emerging Markets,Africa and Middle East
CarTrade Tech Limited (BSE:543333),BSE:543333,Retail (Online),Consumer Discretionary,5960,India,Emerging Markets,India
Carvana Co. (NYSE:CVNA),NYSE:CVNA,Retail (Automotive),Consumer Discretionary,5961,United States,United States,United States
"Carver Bancorp, Inc. (NasdaqCM:CARV)",NasdaqCM:CARV,Financial Svcs. (Non-bank & Insurance),Financials,6035,United States,United States,United States
Cary Group Holding AB (publ) (OM:CARY),OM:CARY,Business & Consumer Services,Consumer Discretionary,7500,Sweden,Developed Europe,EU & Environs
CAS Corporation (KOSDAQ:A016920),KOSDAQ:A016920,Machinery,Industrials,3590,South Korea,Emerging Markets,Small Asia
Casa de Bolsa Finamex S.A.B. de C.V. (BMV:FINAMEX O),BMV:FINAMEX O,Brokerage & Investment Banking,Financials,6200,Mexico,Emerging Markets,Latin America & Caribbean
Casa de Bucovina - Club de Munte S.A. (BVB:BCM),BVB:BCM,Hotel/Gaming,Consumer Discretionary,7011,Romania,Emerging Markets,Eastern Europe & Russia
Casa Emtia Petrol Kimyevi ve Turevleri San. Tic. A.S. (IBSE:CASA),IBSE:CASA,Food Processing,Consumer Staples,2092,Turkey,Developed Europe,EU & Environs
Casa Grande S.A.A. (BVL:CASAGRC1),BVL:CASAGRC1,Food Processing,Consumer Staples,2060,Peru,Emerging Markets,Latin America & Caribbean
Casa Holdings Limited (SGX:C04),SGX:C04,Retail (Distributors),Consumer Discretionary,3630,Singapore,Emerging Markets,Small Asia
Casa Inc. (TSE:7196),TSE:7196,Financial Svcs. (Non-bank & Insurance),Financials,6153,Japan,Japan,Japan
Casa Minerals Inc. (TSXV:CASA),TSXV:CASA,Metals & Mining,Materials,1000,Canada,"Australia, NZ and Canada",Canada
"Casa Systems, Inc. (NasdaqGS:CASA)",NasdaqGS:CASA,Telecom. Equipment,Information Technology,3576,United States,United States,United States
Casablanca Group Limited (SEHK:2223),SEHK:2223,Furn/Home Furnishings,Consumer Discretionary,2200,Hong Kong,Emerging Markets,China
CASASOLD S.p.A. (BIT:CASA),BIT:CASA,Real Estate (Operations & Services),Real Estate,6531,Italy,Developed Europe,EU & Environs
Cascada Silver Corp. (CNSX:CSS),CNSX:CSS,Metals & Mining,Materials,1000,Canada,"Australia, NZ and Canada",Canada
Cascade Acquisition Corp. (NYSE:CAS),NYSE:CAS,Investments & Asset Management,Financials,9995,United States,United States,United States
Cascadero Copper Corporation (TSXV:CCD),TSXV:CCD,Metals & Mining,Materials,1000,Canada,"Australia, NZ and Canada",Canada
Cascades Inc. (TSX:CAS),TSX:CAS,Packaging & Container,Materials,2631,Canada,"Australia, NZ and Canada",Canada
Cascadia Acquisition Corp. (NasdaqGM:CCAI),NasdaqGM:CCAI,Investments & Asset Management,Financials,9995,United States,United States,United States
Cascadia Blockchain Group Corp. (CNSX:CK),CNSX:CK,Software (System & Application),Information Technology,7372,Canada,"Australia, NZ and Canada",Canada
Case Group AB (publ) (OM:CASE),OM:CASE,Investments & Asset Management,Financials,6282,Sweden,Developed Europe,EU & Environs
"Casella Waste Systems, Inc. (NasdaqGS:CWST)",NasdaqGS:CWST,Environmental & Waste Services,Industrials,4950,United States,United States,United States
"Casey's General Stores, Inc. (NasdaqGS:CASY)",NasdaqGS:CASY,Retail (Grocery and Food),Consumer Staples,5412,United States,United States,United States
Cash Converters International Limited (ASX:CCV),ASX:CCV,Financial Svcs. (Non-bank & Insurance),Financials,6141,Australia,"Australia, NZ and Canada",Australia & NZ
CASH Financial Services Group Limited (SEHK:510),SEHK:510,Brokerage & Investment Banking,Financials,6211,Hong Kong,Emerging Markets,China
cash.life AG (DUSE:SGS),DUSE:SGS,Investments & Asset Management,Financials,6411,Germany,Developed Europe,EU & Environs
"Cashbox Partyworld Co., Ltd. (TPEX:8359)",TPEX:8359,Entertainment,Communication Services,7990,Taiwan,Emerging Markets,Small Asia
Cashbox Ventures Ltd. (CNSX:CBOX.X),CNSX:CBOX.X,Software (Entertainment),Communication Services,7375,United States,United States,United States
Cashbuild Limited (JSE:CSB),JSE:CSB,Retail (Building Supply),Consumer Discretionary,5211,South Africa,Emerging Markets,Africa and Middle East
Cashmere Valley Bank (OTCPK:CSHX),OTCPK:CSHX,Banks (Regional),Financials,6020,United States,United States,United States
Cashrewards Limited (ASX:CRW),ASX:CRW,Advertising,Communication Services,7310,Australia,"Australia, NZ and Canada",Australia & NZ
"Cashway Fintech Co.,Ltd. (SHSE:603106)",SHSE:603106,Computers/Peripherals,Information Technology,3578,China,Emerging Markets,China
"CASI Pharmaceuticals, Inc. (NasdaqCM:CASI)",NasdaqCM:CASI,Drugs (Biotechnology),Health Care,2834,United States,United States,United States
"CASIN Real Estate Development Group Co., Ltd. (SZSE:000838)",SZSE:000838,Real Estate (Development),Real Estate,6500,China,Emerging Markets,China
"Casing Macron Technology Co., Ltd. (TPEX:3325)",TPEX:3325,Computers/Peripherals,Information Technology,3490,Taiwan,Emerging Markets,Small Asia
"Casino, Guichard-Perrachon Société Anonyme (ENXTPA:CO)",ENXTPA:CO,Retail (Grocery and Food),Consumer Staples,5411,France,Developed Europe,EU & Environs
"Casio Computer Co.,Ltd. (TSE:6952)",TSE:6952,Electronics (Consumer & Office),Consumer Discretionary,3570,Japan,Japan,Japan
Caspar Asset Management S.A. (WSE:CSR),WSE:CSR,Investments & Asset Management,Financials,6200,Poland,Developed Europe,EU & Environs
Casper Sleep Inc. (NYSE:CSPR),NYSE:CSPR,Furn/Home Furnishings,Consumer Discretionary,2510,United States,United States,United States
Caspian Sunrise plc (AIM:CASP),AIM:CASP,Oil/Gas (Production and Exploration),Energy,1311,United Kingdom,Developed Europe,UK
Caspin Resources Limited (ASX:CPN),ASX:CPN,Metals & Mining,Materials,1000,Australia,"Australia, NZ and Canada",Australia & NZ
"Cass Information Systems, Inc. (NasdaqGS:CASS)",NasdaqGS:CASS,Information Services,Information Technology,7389,United States,United States,United States
"Cassava Sciences, Inc. (NasdaqCM:SAVA)",NasdaqCM:SAVA,Drugs (Pharmaceutical),Health Care,2834,United States,United States,United States
Cassava SmarTech Zimbabwe Limited (ZMSE:CSZL),ZMSE:CSZL,Financial Svcs. (Non-bank & Insurance),Financials,7370,Zimbabwe,Emerging Markets,Africa and Middle East
Cassiar Gold Corp. (TSXV:GLDC),TSXV:GLDC,Metals & Mining,Materials,1000,Canada,"Australia, NZ and Canada",Canada
CASSINA IXC. Ltd. (JASDAQ:2777),JASDAQ:2777,Furn/Home Furnishings,Consumer Discretionary,5020,Japan,Japan,Japan
Cassiopea S.p.A. (SWX:SKIN),SWX:SKIN,Drugs (Pharmaceutical),Health Care,2834,Italy,Developed Europe,EU & Environs
Cassius Mining Limited (ASX:CMD),ASX:CMD,Metals & Mining,Materials,1000,Australia,"Australia, NZ and Canada",Australia & NZ
Cassius Ventures Ltd. (TSXV:CZ.H),TSXV:CZ.H,Precious Metals,Materials,1041,Canada,"Australia, NZ and Canada",Canada
Cast SA (ENXTPA:CAS),ENXTPA:CAS,Software (System & Application),Information Technology,7372,France,Developed Europe,EU & Environs
